code,company,date,text
XOM,Exxon Mobil Corp,2017-09-28,U.S. stocks higher at close of trade; Dow Jones Industrial Average up 0.18%
XOM,Exxon Mobil Corp,2017-09-28,Dow on Track for Best Month Since July as US Economic Growth Rises
XOM,Exxon Mobil Corp,2017-09-28,Aramco listing reshapes Saudi Arabia's OPEC oil policy
XOM,Exxon Mobil Corp,2017-09-28,Chevron taps Mike Wirth to be next CEO as Watson retires
XOM,Exxon Mobil Corp,2017-09-27,Exxon bets on Brazil  buying into eight offshore oil blocks in auction
XOM,Exxon Mobil Corp,2017-09-27,Exxon  Petrobras win two Brazil oil blocks with $1.08B bids
XOM,Exxon Mobil Corp,2017-09-27,Exxon adds 22K acres to Permian Basin portfolio
XOM,Exxon Mobil Corp,2017-09-26,Mnuchin seeks dismissal of Exxon lawsuit over Russia sanctions fine
XOM,Exxon Mobil Corp,2017-09-26,Total looks to make foray into offshore Guyana for as much as $13.5M
XOM,Exxon Mobil Corp,2017-10-05,15% of U.S. Gulf of Mexico oil output shut ahead of Tropical Storm Nate
XOM,Exxon Mobil Corp,2017-10-05,Exxon announces fresh Guyana oil discovery
XOM,Exxon Mobil Corp,2017-10-04,Exxon says Beaumont refinery operations back to normal
XOM,Exxon Mobil Corp,2017-10-04,Tillerson says he never considered resigning
XOM,Exxon Mobil Corp,2017-10-03,Oppenheimer Large Cap Revenue ETF (RWL) September Summary
XOM,Exxon Mobil Corp,2017-10-03,Petrobras privatization possible in the future  Brazil energy minister says
XOM,Exxon Mobil Corp,2017-10-02,U.S. stocks higher at close of trade; Dow Jones Industrial Average up 0.68%
XOM,Exxon Mobil Corp,2017-10-02,Dow Jones Closes 150 points Higher as Risk-on Trade Resumes
XOM,Exxon Mobil Corp,2017-10-02,Trump Plan Aims New Foreign Tax at Apple  Other Multinationals
XOM,Exxon Mobil Corp,2017-09-29,Russia's Rosneft elects former German chancellor Schroeder as chairman
XOM,Exxon Mobil Corp,2017-10-16,Pampa Energía proposes $800M gas pipeline for Argentina shale boom
XOM,Exxon Mobil Corp,2017-10-16,Global gas producers turn to new challenge: finding buyers
XOM,Exxon Mobil Corp,2017-10-12,Exxon opens third Singapore cogeneration power plant
XOM,Exxon Mobil Corp,2017-10-10,B.C. fin min to fight Kinder pipeline plan but more open to LNG investments
XOM,Exxon Mobil Corp,2017-10-10,Chevron starts LNG production at Wheatstone Train 1
XOM,Exxon Mobil Corp,2017-10-07,Stocks to watch next week
XOM,Exxon Mobil Corp,2017-10-06,Oil set to end multi-week rally as oversupply concerns resurface
XOM,Exxon Mobil Corp,2017-10-06,Eni bets big on Zohr explorer finding new treasure
XOM,Exxon Mobil Corp,2017-10-05,Mexico warns U.S. against 'protectionist war ' peso weakens
XOM,Exxon Mobil Corp,2017-10-05,Tropical Storm Nate pounds Central America  heads for U.S.
XOM,Exxon Mobil Corp,2017-10-25,Big Oil Set to Make Facebook-Level Cash Even With $50 Crude
XOM,Exxon Mobil Corp,2017-10-24,PJM Interconnection CEO assails Perry plan to prop up coal  nuclear
XOM,Exxon Mobil Corp,2017-10-24,Flurry of deals by Hess sacrifices steady revenue for chance of future growth
XOM,Exxon Mobil Corp,2017-10-23,Tillerson pays flying visit to Afghanistan to discuss U.S. strategy
XOM,Exxon Mobil Corp,2017-10-23,Exclusive: EU dismisses smoke regulation  looks into tougher fire safety tests
XOM,Exxon Mobil Corp,2017-10-21,Tillerson lands in Riyadh at start of Gulf  South Asia tour
XOM,Exxon Mobil Corp,2017-10-20,What to Watch as Global Earnings Season Gets Into Full Swing
XOM,Exxon Mobil Corp,2017-10-19,Thirty years ago this week  Wall Street slid into the abyss
XOM,Exxon Mobil Corp,2017-10-18,Exxon buys oil terminal for newly acquired Delaware Basin acreage
XOM,Exxon Mobil Corp,2017-10-17,Exxon starts production on new Mont Belvieu polyethylene line
XOM,Exxon Mobil Corp,2017-10-27,Exxon's third-quarter profit beats expectations despite Harvey dent
XOM,Exxon Mobil Corp,2017-10-27,Exxon +1% as Q3 earnings improve by 50%  beating estimates
XOM,Exxon Mobil Corp,2017-10-27,Exxon Mobil Q3 Earnings Beat Analyst Expectations
XOM,Exxon Mobil Corp,2017-10-27,Exxon Mobil beats by $0.07  beats on revenue
XOM,Exxon Mobil Corp,2017-10-27,Stocks- Wall Street Set for Another Record Day
XOM,Exxon Mobil Corp,2017-10-27, Top 5 Things to Know in the Market on Friday
XOM,Exxon Mobil Corp,2017-10-26,Brazil vs. Mexico: Latin America's fight for Big Oil's money
XOM,Exxon Mobil Corp,2017-10-25,Exxon Mobil declares $0.77 dividend
XOM,Exxon Mobil Corp,2017-10-25,Exxon gets government OK for 35-year Argentina shale concession
XOM,Exxon Mobil Corp,2017-10-25,Oil sands production expansion seen slowing by half in 2019  ESAI says
XOM,Exxon Mobil Corp,2017-10-30,Reuters: Chad wants to cut off Glencore's oil supplies in debt dispute
XOM,Exxon Mobil Corp,2017-10-30,Reuters: Exxon exits Pakistan gas project
XOM,Exxon Mobil Corp,2017-10-27,Bloomberg: Exxon set to settle pollution violations with DoJ
XOM,Exxon Mobil Corp,2017-10-27,Haley says does not want Secretary of State Tillerson's job
XOM,Exxon Mobil Corp,2017-10-27,Shell  BP  Exxon big winners in historic Brazil oil auction
XOM,Exxon Mobil Corp,2017-10-27,Oil up 2 percent  Brent hits $60 per barrel on support for extending curbs
XOM,Exxon Mobil Corp,2017-10-27,Shell wins three oil blocks in Brazil's deepwater
XOM,Exxon Mobil Corp,2017-10-27,Exxon  Chevron results linked to oil price  not cost cuts
XOM,Exxon Mobil Corp,2017-10-27,Exxon  investors huddle on climate data as proxy deadline looms
XOM,Exxon Mobil Corp,2017-10-27,Big Oil's $1 billion climate fund picks investments  eyes new members
XOM,Exxon Mobil Corp,2017-11-03,Bloomberg: Exxon spending $1B annually on green energy research
XOM,Exxon Mobil Corp,2017-11-02,Oil Hits 28-Month High as OPEC Behemoths Back Extending Limits
XOM,Exxon Mobil Corp,2017-11-02,Reuters: Large CDU at Exxon's Baton Rouge refinery back in production
XOM,Exxon Mobil Corp,2017-11-02,Oppenheimer Large Cap Revenue ETF (RWL) October Summary
XOM,Exxon Mobil Corp,2017-11-01,From Oil to Ruthenium  Here's How Commodities Are Bouncing Back
XOM,Exxon Mobil Corp,2017-11-01,Oil Trims Advance as Storage Drawdown Fails to Impress Traders
XOM,Exxon Mobil Corp,2017-11-01,Fire breaks out at Exxon's Baton Rouge refinery
XOM,Exxon Mobil Corp,2017-11-01,Red Bull to remain Renault benchmark  says Horner
XOM,Exxon Mobil Corp,2017-10-31,Exxon  PDC Energy settle pollution cases with DoJ
XOM,Exxon Mobil Corp,2017-10-31,Top 250 firms emit third of CO2; few have strong goals to cut: study
XOM,Exxon Mobil Corp,2017-11-14,GE  energy shares drag Wall Street lower; bond proxies rise
XOM,Exxon Mobil Corp,2017-11-14,Senators blast State Department over cuts
XOM,Exxon Mobil Corp,2017-11-14,Buying Texas Oil at New Mexico Prices: Majors Go West for Shale
XOM,Exxon Mobil Corp,2017-11-13,Ghana says talks begin with Exxon on deepwater drilling contract
XOM,Exxon Mobil Corp,2017-11-13,BlackRock's Fink learns to live with activist investors
XOM,Exxon Mobil Corp,2017-11-09,U.S. stocks lower at close of trade; Dow Jones Industrial Average down 0.48%
XOM,Exxon Mobil Corp,2017-11-09,U.S. Senate confirms top EPA air quality official despite concerns
XOM,Exxon Mobil Corp,2017-11-08,Peak oil? Majors aren't buying into the threat from renewables
XOM,Exxon Mobil Corp,2017-11-03,U.S. shale producers promise both higher output and returns
XOM,Exxon Mobil Corp,2017-11-03,Trump says unsure if Tillerson will remain secretary of state
XOM,Exxon Mobil Corp,2017-11-17,Rosneft announces world's longest well at Sakhalin-1 project
XOM,Exxon Mobil Corp,2017-11-17,Oil giants unlikely to share coal's fate  for now
XOM,Exxon Mobil Corp,2017-11-16,Nasdaq Closes at Record High as Cisco Surges 5% 
XOM,Exxon Mobil Corp,2017-11-16,U.S. stocks higher at close of trade; Dow Jones Industrial Average up 0.85%
XOM,Exxon Mobil Corp,2017-11-16,Exxon in fifth straight drop as RBC cuts target citing share buyback limitation
XOM,Exxon Mobil Corp,2017-11-16,Norway's $1T wealth fund considers exiting oil and gas stocks
XOM,Exxon Mobil Corp,2017-11-15,Crude oil posts fourth straight loss as crude inventories swell
XOM,Exxon Mobil Corp,2017-11-15,Wall Street falls as energy tracks oil lower; tech weighs
XOM,Exxon Mobil Corp,2017-11-15,Exclusive: Glencore offers Chad new plan to repay more than $1 billion loan
XOM,Exxon Mobil Corp,2017-11-15,Government's Groningen gas production plan rejected by advisory council
XOM,Exxon Mobil Corp,2017-11-27,Exxon Mobil CEO makes first big changes to refining
XOM,Exxon Mobil Corp,2017-11-27,Exxon to restructure refining operations
XOM,Exxon Mobil Corp,2017-11-24,IMF credit to Chad delayed over Glencore oil debt
XOM,Exxon Mobil Corp,2017-11-23,How 'princess' of Angola lost her oil crown
XOM,Exxon Mobil Corp,2017-11-22,Exxon evacuates staff from Papua New Guinea LNG project due to unrest
XOM,Exxon Mobil Corp,2017-11-22,Exxon  Shell  BP to team up to cut emissions from nat gas production
XOM,Exxon Mobil Corp,2017-11-22,Exclusive: Iraq looks to Kuwait gas pipeline to pay off reparations
XOM,Exxon Mobil Corp,2017-11-21,U.S. diplomats accuse Tillerson of breaking child soldiers law
XOM,Exxon Mobil Corp,2017-11-21,WSJ: Growing gas glut threatens west Texas oil boom
XOM,Exxon Mobil Corp,2017-11-20,WSJ: Oil companies  automakers seek lifeline for internal combustion engine
XOM,Exxon Mobil Corp,2017-12-03,Exclusive: Exxon eyes Egypt's offshore oil and gas - sources
XOM,Exxon Mobil Corp,2017-12-03,U.S. allies fret as 'guillotine' hangs over Tillerson
XOM,Exxon Mobil Corp,2017-11-30,Trump considers plan to replace Tillerson with CIA chief: U.S. officials
XOM,Exxon Mobil Corp,2017-11-29,Exxon nears exploration deal for offshore Mauritania  official says
XOM,Exxon Mobil Corp,2017-11-29,Reuters: Exxon assessing damage to shut Beaumont refinery crude unit
XOM,Exxon Mobil Corp,2017-11-28,OPEC heading for oil cut extension with a caveat
XOM,Exxon Mobil Corp,2017-11-28,Oil prices slip on OPEC deal extension jitters
XOM,Exxon Mobil Corp,2017-11-28,Exxon starts production at Canada's Hebron field
XOM,Exxon Mobil Corp,2017-11-28,Exxon sees delayed Antwerp clean fuels unit running by mid-2018
XOM,Exxon Mobil Corp,2017-11-27,Energy slumps  Amazon shines as Wall Street ends flat
XOM,Exxon Mobil Corp,2017-12-05,'Responsible' investor group toughens code on global members
XOM,Exxon Mobil Corp,2017-12-05,U.S. oil companies join voluntary program to plug methane leaks
XOM,Exxon Mobil Corp,2017-12-05,Tillerson seeks to reassure worried Europe over Trump
XOM,Exxon Mobil Corp,2017-12-05,Exxon climate change probe goes to Massachusetts Supreme Court
XOM,Exxon Mobil Corp,2017-12-05,Exxon climate-change probe goes to Massachusetts top court
XOM,Exxon Mobil Corp,2017-12-05,GM puts an e-commerce marketplace in the dashboard
XOM,Exxon Mobil Corp,2017-12-04,Reuters: Exxon's Beaumont refinery CDU may be shut until late January
XOM,Exxon Mobil Corp,2017-12-04,Exxon confirms deal for deepwater acreage offshore Mauritania
XOM,Exxon Mobil Corp,2017-12-04,Oppenheimer Large Cap Revenue ETF (RWL) November Summary
XOM,Exxon Mobil Corp,2017-12-04,Exxon eyes Egypt's offshore oil and gas
XOM,Exxon Mobil Corp,2017-12-07,Exxon to open first Mobil-branded gas stations in Mexico this week
XOM,Exxon Mobil Corp,2017-12-07,Exxon  Chevron  Shell paid no tax in Australia for FY 2016
XOM,Exxon Mobil Corp,2017-12-07,Eni secures $4.7B in financing for Coral South FLNG project
XOM,Exxon Mobil Corp,2017-12-07,ExxonMobil  Chevron  Shell paid no tax in Australia for 2016
XOM,Exxon Mobil Corp,2017-12-06,Alberta unveils rules for oil sands  other large carbon emitters
XOM,Exxon Mobil Corp,2017-12-06,Exxon is latest U.S. firm to supply newly free Mexico fuel market
XOM,Exxon Mobil Corp,2017-12-06,Wall Street flat; rise in tech stocks offsets energy lag
XOM,Exxon Mobil Corp,2017-12-06,Tillerson takes tough line on Russia  open to peacekeepers
XOM,Exxon Mobil Corp,2017-12-06,Saudi Arabia's SABIC looking at investing in U.S.
XOM,Exxon Mobil Corp,2017-12-06,'You're wrong'  Tillerson says of reports he will be fired
XOM,Exxon Mobil Corp,2017-12-15,Alaska oil companies settle dispute over Trans-Alaska Pipeline tariff charges
XOM,Exxon Mobil Corp,2017-12-15,Oil Rally Fizzles for Third Week With 2018 Outlook Still Cloudy
XOM,Exxon Mobil Corp,2017-12-14,Exclusive: Chevron nears Schlumberger deal to drill wells in Brazil: sources
XOM,Exxon Mobil Corp,2017-12-14,Exxon Mobil and Petrobas form strategic alliance
XOM,Exxon Mobil Corp,2017-12-12,World is losing the battle against climate change  Macron says
XOM,Exxon Mobil Corp,2017-12-12,New York comptroller to pull Exxon shareholder climate proposal
XOM,Exxon Mobil Corp,2017-12-12,Too Big to Grow  Exxon Star Dims Amid Struggles to Boost Oil
XOM,Exxon Mobil Corp,2017-12-11,Exxon to provide details on climate-change impact to its business
XOM,Exxon Mobil Corp,2017-12-11,Exxon bows to investor requests for enhanced climate change disclosures
XOM,Exxon Mobil Corp,2017-12-11,Exxon said to strike oil offshore Equatorial Guinea
XOM,Exxon Mobil Corp,2017-12-31,2017 leaders and laggards
XOM,Exxon Mobil Corp,2017-12-29,Boeing  Caterpillar top Dow 2017 standings; GE lags far behind
XOM,Exxon Mobil Corp,2017-12-25,Still no deal for Exxon  Iraqi southern oilfields
XOM,Exxon Mobil Corp,2017-12-24,Chad reshuffles finance  other key ministries - decree
XOM,Exxon Mobil Corp,2017-12-22,This year's lumps of coal could be 2018's diamonds
XOM,Exxon Mobil Corp,2017-12-21,Statoil submits $2.3B plan to extend Snorre field production
XOM,Exxon Mobil Corp,2017-12-20,Exxon to ease ban on shareholder meetings with directors
XOM,Exxon Mobil Corp,2017-12-20,Exxon Mobil to ease restrictions on shareholder talks with directors
XOM,Exxon Mobil Corp,2017-12-18,Exxon  BHP to end Australia gas sales  separately market gas in 2019
XOM,Exxon Mobil Corp,2017-12-16,Stocks to watch next week
XOM,Exxon Mobil Corp,2018-01-10,New York City sues Big Oil companies over global warming
XOM,Exxon Mobil Corp,2018-01-10,Exxon makes sixth oil discovery off Guyana
XOM,Exxon Mobil Corp,2018-01-08,U.S. offers drillers nearly all offshore waters  but focus is on eastern Gulf
XOM,Exxon Mobil Corp,2018-01-05,Tillerson says will stay as top U.S. diplomat through 2018
XOM,Exxon Mobil Corp,2018-01-04,Oppenheimer Large Cap Revenue ETF (RWL) December Summary
XOM,Exxon Mobil Corp,2018-01-04,Quest for new oil discoveries still on back burner
XOM,Exxon Mobil Corp,2018-01-03,S&P 500 Closes Above 2 700 For First Time Ever As Tech  Energy Rally
XOM,Exxon Mobil Corp,2018-01-03,U.S. stocks higher at close of trade; Dow Jones Industrial Average up 0.40%
XOM,Exxon Mobil Corp,2018-01-03,Bargain Bin: ETFs for value hunters
XOM,Exxon Mobil Corp,2018-01-02,BP sets $1.5 billion charge for U.S tax changes but sees long-term boost
XOM,Exxon Mobil Corp,2018-01-18,Exxon signs deal for deepwater drilling off Ghana
XOM,Exxon Mobil Corp,2018-01-16,Exxon finds oil  gas in Papua New Guinea
XOM,Exxon Mobil Corp,2018-01-16,U.S. oil industry set to break record  upend global trade
XOM,Exxon Mobil Corp,2018-01-12,Fields of Gold? Jana seeks new money  allies with impact hedge fund
XOM,Exxon Mobil Corp,2018-01-11,Revitalized McLaren now need to deliver
XOM,Exxon Mobil Corp,2018-01-11,Chevron hits 52-week high as BMO upgrades
XOM,Exxon Mobil Corp,2018-01-10,U.S. stocks lower at close of trade; Dow Jones Industrial Average down 0.07%
XOM,Exxon Mobil Corp,2018-01-10,Nasdaq  Dow  S&P 500 Close Lower on China  NAFTA Worries
XOM,Exxon Mobil Corp,2018-01-10,Exxon challenges California municipal governments over climate claims
XOM,Exxon Mobil Corp,2018-01-10,Further production cut eyed for Groningen after tremor
XOM,Exxon Mobil Corp,2018-01-29,Exxon plans major U.S. investments due to tax reform: CEO
XOM,Exxon Mobil Corp,2018-01-29,Exxon CEO pledges $50B-plus in U.S. investment over five years
XOM,Exxon Mobil Corp,2018-01-29,Economic Calendar: Top Things to Watch 
XOM,Exxon Mobil Corp,2018-01-29,Top 5 Things to Know in the Market on Monday
XOM,Exxon Mobil Corp,2018-01-28,Economic Calendar - Top 5 Things to Watch This Week
XOM,Exxon Mobil Corp,2018-01-26,Shell buying spree cranks up race for clean energy
XOM,Exxon Mobil Corp,2018-01-22,U.S. needs to pay attention to relationship with Britain  Tillerson says
XOM,Exxon Mobil Corp,2018-01-19,Mexico's energy opening faces test in deepwater oil auction
XOM,Exxon Mobil Corp,2018-01-18,Chevron cut to Hold from Buy at HSBC after recent run-up
XOM,Exxon Mobil Corp,2018-01-18,Gas supply suspended from Russia's Sakhalin-1 project
XOM,Exxon Mobil Corp,2018-02-01,Exxon Mobil names MetLife CEO Kandarian to its board
XOM,Exxon Mobil Corp,2018-02-01,U.S. stocks mixed at close of trade; Dow Jones Industrial Average up 0.06%
XOM,Exxon Mobil Corp,2018-02-01,Dutch regulator points to possible 2B cm cut at Groningen gas field
XOM,Exxon Mobil Corp,2018-02-01,Shell's strong Q4 tempered by cash flow disappointment
XOM,Exxon Mobil Corp,2018-02-01,Shell poised to dethrone Exxon in oil titans' cash clash
XOM,Exxon Mobil Corp,2018-01-31,Exxon Mobil declares $0.77 dividend
XOM,Exxon Mobil Corp,2018-01-31,Shell makes large deepwater Gulf of Mexico oil discovery
XOM,Exxon Mobil Corp,2018-01-31,Weaker Dollar Boosting Corporate Profits In Fourth-Quarter 
XOM,Exxon Mobil Corp,2018-01-30,Exxon aims to triple Permian production to 600K boe/day by 2025
XOM,Exxon Mobil Corp,2018-01-30,Pemex woes  presidential race stall Mexican oil joint ventures
XOM,Exxon Mobil Corp,2018-02-02,Russian oil production flat  showing apparent adherence to supply pact
XOM,Exxon Mobil Corp,2018-02-02,Tumble in energy leads markets lower
XOM,Exxon Mobil Corp,2018-02-02,Exxon -6%  Chevron -4% as both companies shock with earnings shortfalls
XOM,Exxon Mobil Corp,2018-02-02,Exxon -3% premarket after Q4 earnings miss  3% drop in production
XOM,Exxon Mobil Corp,2018-02-02,Exxon Mobil misses by $0.15  misses on revenue
XOM,Exxon Mobil Corp,2018-02-02,Stocks-  U.S. Futures Fall Amid Concern Over Rising Bond Yields
XOM,Exxon Mobil Corp,2018-02-02,Top 5 Things to Know in the Market on Friday
XOM,Exxon Mobil Corp,2018-02-01,Cnooc Raises Spending to 4-Year High as Reserve Boost Eyed
XOM,Exxon Mobil Corp,2018-02-01,Notable earnings before Friday’s open
XOM,Exxon Mobil Corp,2018-02-01,Dow Jones Ekes Out Gains; Alphabet Misses Earnings  Beats Revenue
XOM,Exxon Mobil Corp,2018-02-05,U.S. stocks lower at close of trade; Dow Jones Industrial Average down 4.60%
XOM,Exxon Mobil Corp,2018-02-05,Dow Jones Sinks Nearly 1 200 Points in Stock Market Rout
XOM,Exxon Mobil Corp,2018-02-05,DJIA down 1%  leading averages lower
XOM,Exxon Mobil Corp,2018-02-04,Amid stock market selloff  U.S. profit forecasts rise
XOM,Exxon Mobil Corp,2018-02-02,Dow sees worst day in two years as bond yields jump
XOM,Exxon Mobil Corp,2018-02-02,Exxon climate analysis sees scenario for weaker global oil demand
XOM,Exxon Mobil Corp,2018-02-02,Global stocks plunge as U.S. jobs data spikes bond yields
XOM,Exxon Mobil Corp,2018-02-02,U.S. stocks lower at close of trade; Dow Jones Industrial Average down 2.54%
XOM,Exxon Mobil Corp,2018-02-02,Dow Jones Plunges 660 Points as Rising Bond Yields Halt Rally 
XOM,Exxon Mobil Corp,2018-02-02,Exxon  Chevron shares plunge after weak results spook Street
XOM,Exxon Mobil Corp,2018-02-08,Exxon adds 2.7B barrels to reserves  up 19% Y/Y
XOM,Exxon Mobil Corp,2018-02-08,SBM Offshore NV ADR reports FY results
XOM,Exxon Mobil Corp,2018-02-07,U.S. closer to decision on sanctioning Venezuela oil: Tillerson
XOM,Exxon Mobil Corp,2018-02-07,U.S. stocks lower at close of trade; Dow Jones Industrial Average down 0.08%
XOM,Exxon Mobil Corp,2018-02-07,Dow Reverses Gains Closes Lower as Soaring Bond Yields Spook Investors
XOM,Exxon Mobil Corp,2018-02-06,Exxon Mobil finishes construction on Baytown ethane cracker
XOM,Exxon Mobil Corp,2018-02-06,U.S. stocks higher at close of trade; Dow Jones Industrial Average up 2.33%
XOM,Exxon Mobil Corp,2018-02-06,Dow Jones Rebounds 1100 Points From Session Lows To Close Higher
XOM,Exxon Mobil Corp,2018-02-06,Chevron +1.5% as Barclays upgrades; Exxon extends losses amid downgrade
XOM,Exxon Mobil Corp,2018-02-06,Exxon gets double downgrade at Barclays
XOM,Exxon Mobil Corp,2018-02-16,Report: Exxon  Total seen committing $6B for Papua New Guinea LNG
XOM,Exxon Mobil Corp,2018-02-15,U.S. stocks higher at close of trade; Dow Jones Industrial Average up 1.05%
XOM,Exxon Mobil Corp,2018-02-14,Hail shale  but deepwater oil fights back
XOM,Exxon Mobil Corp,2018-02-13,Exxon to sell Scarborough gas field stake to Woodside Petro for $744M
XOM,Exxon Mobil Corp,2018-02-13,Bloomberg: Exxon sues the suers in climate change fight
XOM,Exxon Mobil Corp,2018-02-13,Norway wealth fund CEO to firms: allow independent directors on your boards
XOM,Exxon Mobil Corp,2018-02-12,Exxon needs to become its own activist  says Bloomberg's Denning
XOM,Exxon Mobil Corp,2018-02-12,Court turns down bid to undo New Jersey's $225M settlement with Exxon
XOM,Exxon Mobil Corp,2018-02-12,Big Oil takes stage for post-austerity beauty contest
XOM,Exxon Mobil Corp,2018-02-08,U.S. stocks lower at close of trade; Dow Jones Industrial Average down 2.51%
XOM,Exxon Mobil Corp,2018-02-27,Report: Exxon to shut Papua New Guinea LNG plant for at least a week
XOM,Exxon Mobil Corp,2018-02-27,At least 14 dead in Papua New Guinea quake; ExxonMobil shuts LNG plant
XOM,Exxon Mobil Corp,2018-02-26,Major quake cuts communications  halts oil and gas operations in Papua New Guinea
XOM,Exxon Mobil Corp,2018-02-23,The 10 Largest U.S. Companies By Market Capitalization 
XOM,Exxon Mobil Corp,2018-02-23,Exxon  BHP drop sale of old Australia oil fields
XOM,Exxon Mobil Corp,2018-02-23,Exxon  BHP Axe Lengthy Sale of 50-Year-Old Australia Oil Fields
XOM,Exxon Mobil Corp,2018-02-22,Crude oil  energy equities rise after surprise inventory drop
XOM,Exxon Mobil Corp,2018-02-22,Reuters: Exxon nears OK for largest U.S. crude processing plant
XOM,Exxon Mobil Corp,2018-02-20,Papua New Guinea partners agree to plans for gas export expansion
XOM,Exxon Mobil Corp,2018-02-18,Global dividends hit record of $1.25 trillion in 2017  more to come
XOM,Exxon Mobil Corp,2018-03-01,Exxon's Papua New Guinea LNG project could be shut for six weeks
XOM,Exxon Mobil Corp,2018-03-01,Exxon quits some Russian joint ventures citing sanctions
XOM,Exxon Mobil Corp,2018-03-01,Death toll rises to 31 in PNG quake as weather and damage hamper relief effort
XOM,Exxon Mobil Corp,2018-02-28,Exxon to pull out of oil ventures with Rosneft due to Russia sanctions
XOM,Exxon Mobil Corp,2018-02-28,Chevron board member tweet hints support for renewable technologies
XOM,Exxon Mobil Corp,2018-02-28,Exxon says expecting to build Mozambique LNG export project
XOM,Exxon Mobil Corp,2018-02-28,Exxon says no apparent damage to Papua New Guinea gas pipeline
XOM,Exxon Mobil Corp,2018-02-28,Exxon  Hess find more oil offshore Guyana
XOM,Exxon Mobil Corp,2018-02-27,Exxon eyes sale of interest in Canada's Terra Nova oil project
XOM,Exxon Mobil Corp,2018-02-27,Exxon selling stake in Canada's Terra Nova project
XOM,Exxon Mobil Corp,2018-03-08,Tariffs move 'in the opposite direction' from tax cut benefits  Exxon CEO says
XOM,Exxon Mobil Corp,2018-03-07,Papua New Guinea sees long recovery ahead as quake death toll tops 100
XOM,Exxon Mobil Corp,2018-03-07,U.S. stocks mixed at close of trade; Dow Jones Industrial Average down 0.33%
XOM,Exxon Mobil Corp,2018-03-07,Exxon -3% after unveiling big spending boost to lift production
XOM,Exxon Mobil Corp,2018-03-07,Energy sector leads markets lower
XOM,Exxon Mobil Corp,2018-03-07,Exxon woos Wall St. with bold plan to double earnings by 2025
XOM,Exxon Mobil Corp,2018-03-07,Stocks- Wall Street Opens Lower Amid Political Uncertainty
XOM,Exxon Mobil Corp,2018-03-07,Exxon seeks to more than double earnings  cash flow by 2025
XOM,Exxon Mobil Corp,2018-03-07,Shakes and superstition: Exxon faces backlash in Papua New Guinea
XOM,Exxon Mobil Corp,2018-03-07,Exxon CEO struggles to reverse Tillerson's legacy of failed bets
XOM,Exxon Mobil Corp,2018-03-13,Trade Wars Aside  Trump's `Taiwan Card' Is China's Real Worry
XOM,Exxon Mobil Corp,2018-03-13,Trump fires top diplomat Tillerson  taps CIA's Pompeo
XOM,Exxon Mobil Corp,2018-03-13,Greens fear climate backslide with Pompeo as top U.S. diplomat
XOM,Exxon Mobil Corp,2018-03-13,Reuters: Oil majors eye Argentina in test of free-market reforms
XOM,Exxon Mobil Corp,2018-03-13,Exxon-partnered biotech firm eyes cost-competitive biofuel by 2025
XOM,Exxon Mobil Corp,2018-03-13,Exxon exec confirms Gulf Coast oil refining expansion plan
XOM,Exxon Mobil Corp,2018-03-13,Oil majors' interest in Argentina tests free-market reforms
XOM,Exxon Mobil Corp,2018-03-13,U.S. may lift travel ban on 'important partner' Chad  Tillerson says
XOM,Exxon Mobil Corp,2018-03-12,BHP  Woodside reach agreement on purchase of Scarborough gas project
XOM,Exxon Mobil Corp,2018-03-09,Turkish Cypriots vow to launch gas search unless Greek side pulls back
XOM,Exxon Mobil Corp,2018-03-19,Reuters: Exxon buys LNG to chill quake-hit Papua New Guinea project
XOM,Exxon Mobil Corp,2018-03-16,Brazil presidential contender Gomes would reverse privatizations
XOM,Exxon Mobil Corp,2018-03-16,Wall Street advances as financial  energy stocks gain
XOM,Exxon Mobil Corp,2018-03-16,Eni raises dividend 4%  hikes production target
XOM,Exxon Mobil Corp,2018-03-15,Exxon upgraded to Buy at HSBC as 'risks of being negative' grow
XOM,Exxon Mobil Corp,2018-03-15,Stocks- Wall Street Flat After Unemployment Data
XOM,Exxon Mobil Corp,2018-03-15,Investors still in love with growth stocks risk losing out on value
XOM,Exxon Mobil Corp,2018-03-14,Exxon says it does not expect to pay Australian corporate tax until 2021
XOM,Exxon Mobil Corp,2018-03-14,Oil majors give in to investors with share buyback spree
