code,company,date,text
WMB,Williams Companies Inc,2019-03-13,Israel says Hezbollah suspect in U.S. troop deaths now active on Golan
WMB,Williams Companies Inc,2019-03-13,Value Doesn't Die 
WMB,Williams Companies Inc,2019-03-13,Mercedes look to burst Ferrari's bubble in Melbourne
WMB,Williams Companies Inc,2019-03-12,Cannabis constituency? Israeli election rivals warm to pot
WMB,Williams Companies Inc,2019-03-12,NBA roundup: Clippers' Williams makes history off bench
WMB,Williams Companies Inc,2019-03-12,Osaka powers into fourth round at Indian Wells
WMB,Williams Companies Inc,2019-03-11,Tennis: Latvia's Sevastova out of Indian Wells with virus
WMB,Williams Companies Inc,2019-03-11,Israeli deportation hearing focuses on Human Right Watch official's tweets
WMB,Williams Companies Inc,2019-03-17,Bottas and Mercedes dominate Australian opener
WMB,Williams Companies Inc,2019-03-17,NHL roundup: Killorn  Lightning crush Caps
WMB,Williams Companies Inc,2019-03-16,PG&E close to reshaping leadership with investor backing: WSJ
WMB,Williams Companies Inc,2019-03-16,Nadal pulls out with injury before Federer semi-final
WMB,Williams Companies Inc,2019-03-16,NBA roundup: Bucks rally from 23 down to rout Heat
WMB,Williams Companies Inc,2019-03-16,Hamilton takes pole as Mercedes speed stuns rivals
WMB,Williams Companies Inc,2019-03-16,Andreescu continues fairytale run to reach Indian Wells final
WMB,Williams Companies Inc,2019-03-15,British outsourcer Interserve taken over by its creditors
WMB,Williams Companies Inc,2019-03-15,No new natural gas hookups in New York's Westchester County  Con Ed says
WMB,Williams Companies Inc,2019-03-14,Tennis: In-form Bencic powers into Indian Wells semis
WMB,Williams Companies Inc,2019-03-19,This High-Yield Pipeline Stock Makes Another Smart Move
WMB,Williams Companies Inc,2019-03-19,Economy center stage in April election in Canada's Alberta province
WMB,Williams Companies Inc,2019-03-19,Tennis: Canadian teen Andreescu keen to ensure injuries don't block her meteoric rise
WMB,Williams Companies Inc,2019-03-19,Stifel Says Buy 4 Large Cap MLPs That Pay Big Dividends
WMB,Williams Companies Inc,2019-03-18,NFL notebook: Bengals release LB Burfict
WMB,Williams Companies Inc,2019-03-18,Tennis: Andreescu emerges as Canada's next great hope for Grand Slam glory
WMB,Williams Companies Inc,2019-03-18,NBA roundup: Sixers down Bucks despite Giannis' 52
WMB,Williams Companies Inc,2019-03-17,Teenager Andreescu stuns Kerber to win Indian Wells title
WMB,Williams Companies Inc,2019-03-17,Israel's top court disqualifies far-rightist  approves Arab party for ballot
WMB,Williams Companies Inc,2019-03-17,Fed looks to avoid crossed signals at policy meeting
WMB,Williams Companies Inc,2019-03-21,Tennis: Venus shines as sun returns to Miami Open
WMB,Williams Companies Inc,2019-03-21,Germany urged to champion global treaty to ban 'killer robots'
WMB,Williams Companies Inc,2019-03-21,Pompeo  in Israel  calls Hezbollah risk to Middle East stability
WMB,Williams Companies Inc,2019-03-21,President's re-election pitch resonates in heartland of Ukraine's revolution
WMB,Williams Companies Inc,2019-03-20,Rain again spoils Miami Open party  wiping out play
WMB,Williams Companies Inc,2019-03-20,Tennis: Osaka sister act primed for Miami Open spotlight
WMB,Williams Companies Inc,2019-03-20,Netanyahu says Iran has 'sensitive information' on rival  Tehran denies hack
WMB,Williams Companies Inc,2019-03-20,Kuwait says U.S. Mideast peace plan should weigh regional considerations
WMB,Williams Companies Inc,2019-03-20,NHL roundup: Caps alone atop Metro
WMB,Williams Companies Inc,2019-03-19,Tennis: Rain delays Miami Open start at new Hard Rock home
WMB,Williams Companies Inc,2019-03-24,NBA roundup: Hornets storm back to stun Celtics
WMB,Williams Companies Inc,2019-03-23,World number one Osaka stunned by Hsieh in Miami
WMB,Williams Companies Inc,2019-03-23,Serena Williams withdraws from Miami Open with knee injury
WMB,Williams Companies Inc,2019-03-23,NBA roundup: Harden scores 61 as Rockets stop Spurs
WMB,Williams Companies Inc,2019-03-22,Tennessee holds off stubborn No. 15 seed Colgate
WMB,Williams Companies Inc,2019-03-22,Tennis: Osaka enjoys rollercoaster win in Miami
WMB,Williams Companies Inc,2019-03-22,NCAA roundup: No. 12 Murray State stuns No. 5 Marquette
WMB,Williams Companies Inc,2019-03-22,No upset alert for No. 1 seed Gonzaga in first-round rout
WMB,Williams Companies Inc,2019-03-21,Morant  No. 12 Murray State race past No. 5 Marquette
WMB,Williams Companies Inc,2019-03-21,Trump signs executive 'free speech' order for U.S. colleges
WMB,Williams Companies Inc,2019-03-26,Unpredictable election makes Ukraine's friends wary
WMB,Williams Companies Inc,2019-03-26,Stanford bounces BYU  reaches 12th straight Sweet 16
WMB,Williams Companies Inc,2019-03-25,Canadian teenager Andreescu retires in Miami fourth round
WMB,Williams Companies Inc,2019-03-25,Canadian judge says ex-Guantanamo inmate's war crimes sentence has expired
WMB,Williams Companies Inc,2019-03-25,Ex-coaches charged in U.S. college admission scandal due in court
WMB,Williams Companies Inc,2019-03-25,NBA roundup: Curry returns  Warriors retake No. 1 seed
WMB,Williams Companies Inc,2019-03-25,NCAA roundup: No. 1 Duke barely holds off UCF
WMB,Williams Companies Inc,2019-03-24,UConn tops Buffalo  rolls into another Sweet 16
WMB,Williams Companies Inc,2019-03-24,Halep recovers to beat Hercog  Venus wins in Miami
WMB,Williams Companies Inc,2019-03-24,Tennessee survives second-half scare for OT win vs. Iowa
WMB,Williams Companies Inc,2019-03-28,Freeport LNG Texas export plant moves closer to entering service
WMB,Williams Companies Inc,2019-03-28,John Williams Downplays Recession Fears  Stresses Flexible Fed Policy
WMB,Williams Companies Inc,2019-03-28,Trump changes mind and extends Liberians' immigration protections in U.S
WMB,Williams Companies Inc,2019-03-28,Fed's Williams sees no elevated chance of near-term recession
WMB,Williams Companies Inc,2019-03-28,Tennis: Hopman Cup ends after three decades as Perth made ATP Cup host
WMB,Williams Companies Inc,2019-03-27,Halep sees off Wang to move into Miami semis
WMB,Williams Companies Inc,2019-03-27,Recession Risks Creep Beyond Yield Curve Into U.S. Economic Data
WMB,Williams Companies Inc,2019-03-27,NBA roundup: Bledsoe leads Bucks past Rockets
WMB,Williams Companies Inc,2019-03-27,Comedian set to win first round of Ukraine presidential vote
WMB,Williams Companies Inc,2019-03-26,Formula One and FIA present 2021 rules package to teams
WMB,Williams Companies Inc,2019-03-29,Georgia lawmakers pass heartbeat abortion ban  joining four other U.S. states
WMB,Williams Companies Inc,2019-03-29,Take Five: The shape of you - world market themes for the week ahead
WMB,Williams Companies Inc,2019-03-29,Fed policymakers do not want rate cuts  not even the doves
WMB,Williams Companies Inc,2019-03-29,Global funds raise stock allocations and cut cash buffer: Reuters poll
WMB,Williams Companies Inc,2019-03-29,Tesla: Electric Noise 
WMB,Williams Companies Inc,2019-03-29,NCAA Tournament roundup: Purdue tops Vols in OT
WMB,Williams Companies Inc,2019-03-29,Oil Set for Best Quarter in Almost a Decade on OPEC+ Supply Cuts
WMB,Williams Companies Inc,2019-03-29,No. 3 Purdue outlasts No. 2 Tennessee in OT thriller
WMB,Williams Companies Inc,2019-03-28,Capitals lock up playoff spot with win over Hurricanes
WMB,Williams Companies Inc,2019-03-28,Fed Downplays Recession Fears  Trade Talks for Months?: Eco Day
WMB,Williams Companies Inc,2019-04-01,NBA roundup: Warriors alone atop Western Conference
WMB,Williams Companies Inc,2019-04-01,MLB roundup: Harper leads Phillies to series sweep
WMB,Williams Companies Inc,2019-03-31,Rapper Nipsey Hussle shot dead outside his Los Angeles store: media
WMB,Williams Companies Inc,2019-03-31,UConn tops Louisville  heads to 12th straight Final Four
WMB,Williams Companies Inc,2019-03-31,MLB roundup: Harper launches first Phils HR in win over Braves
WMB,Williams Companies Inc,2019-03-31,Comedian in front as curtain rises on Ukrainian presidential election
WMB,Williams Companies Inc,2019-03-30,Investing in These Stocks Could Enrich Your Retirement
WMB,Williams Companies Inc,2019-03-30,Report:Texas A&M to offer coaching job to Williams
WMB,Williams Companies Inc,2019-03-30,UConn upends UCLA to reach 14th straight regional final
WMB,Williams Companies Inc,2019-03-30,Auburn storms past No. 1 seed North Carolina
WMB,Williams Companies Inc,2019-04-02,College notebook: Duke's Williamson  Barrett headline All-America team
WMB,Williams Companies Inc,2019-04-02,Morant joins Duke's Williamson  Barrett on All-American team
WMB,Williams Companies Inc,2019-04-02,Superdry founder named interim CEO as majority of board steps down
WMB,Williams Companies Inc,2019-04-02,Chicago heads to the polls to elect city's first black woman as mayor
WMB,Williams Companies Inc,2019-04-02,Superdry founder set to win investor backing for return to board
WMB,Williams Companies Inc,2019-04-02,Australia government promises 'back in black' budget in election run-up
WMB,Williams Companies Inc,2019-04-01,NFL notebook: Browns trade Ogbah to Chiefs
WMB,Williams Companies Inc,2019-04-01,No. 1 Notre Dame blasts No. 2 Stanford to make Final Four
WMB,Williams Companies Inc,2019-04-01,Comedian faces scrutiny over oligarch ties in Ukraine presidential race
WMB,Williams Companies Inc,2019-04-01,QBs Murray  Haskins to work out for Raiders
WMB,Williams Companies Inc,2019-04-04,Canadian court dismisses $9.5 billion Ecuadorian claim against Chevron Canada
WMB,Williams Companies Inc,2019-04-04,Reports: Raiders release WR Roberts
WMB,Williams Companies Inc,2019-04-04,NBA roundup: Heat's loss scrambles East standings
WMB,Williams Companies Inc,2019-04-03,Bankrupt PG&E Names TVA’s Johnson as CEO  Forms New Board
WMB,Williams Companies Inc,2019-04-03,NFL notebook: McCarthy opens up on Packers firing
WMB,Williams Companies Inc,2019-04-03,Tennessee G Bone to enter NBA draft; Williams next?
WMB,Williams Companies Inc,2019-04-03,Texas A&M lands Va. Tech's Buzz Williams
WMB,Williams Companies Inc,2019-04-03,CMC shares hit record low on profit warning as finance chief plans exit
WMB,Williams Companies Inc,2019-04-03,NHL roundup: Habs sink Lightning  pull even with Jackets
WMB,Williams Companies Inc,2019-04-03,PG&E Is Near a Deal With Hedge Funds on CEO  Board Overhaul
WMB,Williams Companies Inc,2019-04-07,Williamson wins Naismith player of year honor
WMB,Williams Companies Inc,2019-04-06,Notre Dame tops UConn  advances to NCAA title game
WMB,Williams Companies Inc,2019-04-05,Ravens agree to contract with ex-Raiders WR Roberts
WMB,Williams Companies Inc,2019-04-05,The First Down Year 
WMB,Williams Companies Inc,2019-04-05,Comedian rips up the play book in Ukraine election success
WMB,Williams Companies Inc,2019-04-05,NBA roundup: Bucks lock up No. 1 seed
WMB,Williams Companies Inc,2019-04-05,World number one Osaka signs with Nike
WMB,Williams Companies Inc,2019-04-05,Soccer: Morgan nets 100th goal as USWNT tops Australia
WMB,Williams Companies Inc,2019-04-04,NFL notebook: Report details toxic Rodgers-McCarthy dynamic
WMB,Williams Companies Inc,2019-04-04,Fed Officials Resist Rate-Cut Idea Pushed by Trump's Advisers
WMB,Williams Companies Inc,2019-04-10,Tennis: Crisis? What crisis? Briton Moore completes amazing comeback
WMB,Williams Companies Inc,2019-04-10,Crestwood buys Williams’ 50% stake in Powder River Basin JV for $485M
WMB,Williams Companies Inc,2019-04-09,Draft notebook: SEC stars Washington  Williams enter draft
WMB,Williams Companies Inc,2019-04-09,Airbnb reverses on delisting Israeli settlements  won't profit off West Bank
WMB,Williams Companies Inc,2019-04-09,Tennessee's Williams testing NBA draft process
WMB,Williams Companies Inc,2019-04-09,Trump Said to Seek Limit on State Power Over Pipelines
WMB,Williams Companies Inc,2019-04-09,Murray meeting again with Cardinals: report
WMB,Williams Companies Inc,2019-04-08,Southern Roots 
WMB,Williams Companies Inc,2019-04-07,Virginia Tech hires Young from Wofford
WMB,Williams Companies Inc,2019-04-07,Tennessee's Barnes wins Naismith coaching honor
WMB,Williams Companies Inc,2019-04-12,'Star Wars: Rise of Skywalker' sees return of emperor Palpatine
WMB,Williams Companies Inc,2019-04-12,Lakers  Walton mutually part ways
WMB,Williams Companies Inc,2019-04-12,Ukrainian comedian gets serious with investors in bid for presidency
WMB,Williams Companies Inc,2019-04-11,Nomination for top U.S. diplomat for South Asia withdrawn: White House
WMB,Williams Companies Inc,2019-04-11,Fed Officials Signal High Hurdle to Hike as Inflation Lags
WMB,Williams Companies Inc,2019-04-11,No comparing Tiger and Golden Bear  says Player
WMB,Williams Companies Inc,2019-04-11,U.S. economy 'healthy' from a monetary policy perspective: Fed's Williams
WMB,Williams Companies Inc,2019-04-11,NBA roundup: Pistons nail down final East playoff spot
WMB,Williams Companies Inc,2019-04-10,These 2 High-Yield Stocks Team Up on a Win-Win Transaction
WMB,Williams Companies Inc,2019-04-10,Netanyahu's winning strategy: big power statecraft and social media focus
WMB,Williams Companies Inc,2019-04-16,Trump to Allow U.S. Lawsuits Over Seized Property in Cuba
WMB,Williams Companies Inc,2019-04-16,Poroshenko 2.0: Ukraine leader reboots campaign ahead of presidential run-off
WMB,Williams Companies Inc,2019-04-15,Tiger Woods' Masters win gives Nike investors another reason to cheer
WMB,Williams Companies Inc,2019-04-15,Motor racing: Mercedes look more dominant than ever
WMB,Williams Companies Inc,2019-04-15,Legendary Beginnings 
WMB,Williams Companies Inc,2019-04-14,Trump  Obama join sport greats heaping praise on Masters winner Woods
WMB,Williams Companies Inc,2019-04-14,Hamilton back on top after landmark win in China
WMB,Williams Companies Inc,2019-04-14,NBA notebook: Kings reportedly to hire Walton as head coach
WMB,Williams Companies Inc,2019-04-13,Williamson adds to haul  wins Wooden Award
WMB,Williams Companies Inc,2019-04-12,Defiant Poroshenko: Ukraine's voters will choose substance over style in election
WMB,Williams Companies Inc,2019-04-19,Warriors ready to unleash playoff-mode Durant
WMB,Williams Companies Inc,2019-04-19,Doctors assessing when Madeira bus crash survivors can fly home to Germany
WMB,Williams Companies Inc,2019-04-18,MLB roundup: Astros' streak halted at 10
WMB,Williams Companies Inc,2019-04-17,Alberta's foray into leftist politics sets stage for strong opposition
WMB,Williams Companies Inc,2019-04-17,Twenty years after Columbine  mass shooting survivors help others heal
WMB,Williams Companies Inc,2019-04-17,Right-wing victory in Canada's Alberta may spell trouble for Trudeau
WMB,Williams Companies Inc,2019-04-17,What's Worth Saving? 
WMB,Williams Companies Inc,2019-04-17,Hungry for change  Ukrainians set to elect comedian as next president
WMB,Williams Companies Inc,2019-04-17,Right-wing party wins power in Canada's oil region  attacks Trudeau on environment
WMB,Williams Companies Inc,2019-04-16,In major shift  Trump to allow lawsuits against foreign firms in Cuba
