code,company,date,text
CSCO,Cisco Systems Inc,2017-04-15,Hacker documents show NSA tools for breaching global money transfer system
CSCO,Cisco Systems Inc,2017-05-17,U.S. stocks tumble 1% on Trump turmoil  oil spikes after inventory draw
CSCO,Cisco Systems Inc,2017-05-17,Wall St. points to lower open as Trump worries rattle markets
CSCO,Cisco Systems Inc,2017-05-16,Researchers say global cyber attack similar to North Korean hacks
CSCO,Cisco Systems Inc,2017-05-16,UK venture firm Notion wins overseas backers to avert Brexit fund gap
CSCO,Cisco Systems Inc,2017-05-15,Wall Street rises with help from technology  financial  energy stocks
CSCO,Cisco Systems Inc,2017-05-15,U.S. stocks higher at close of trade; Dow Jones Industrial Average up 0.41%
CSCO,Cisco Systems Inc,2017-05-15,US stocks surge as Nasdaq and S&P hit record highs
CSCO,Cisco Systems Inc,2017-05-15,Cisco gets upgrade to Buy at Morgan Stanley on security-driven trends
CSCO,Cisco Systems Inc,2017-05-15,Wall St higher as oil surges 
CSCO,Cisco Systems Inc,2017-05-11,Cisco buying AI company for $125M
CSCO,Cisco Systems Inc,2017-05-19,U.S. stocks higher at close of trade; Dow Jones Industrial Average up 0.69%
CSCO,Cisco Systems Inc,2017-05-18,Wall Street rebounds after steepest selloff in months
CSCO,Cisco Systems Inc,2017-05-18,US stocks bounce back from the 'Trump Dump'  Nasdaq notches 0.73% 
CSCO,Cisco Systems Inc,2017-05-18,U.S. stocks higher at close of trade; Dow Jones Industrial Average up 0.27%
CSCO,Cisco Systems Inc,2017-05-18, U.S. stocks rebound from Trump sell-off  positive data provides backing
CSCO,Cisco Systems Inc,2017-05-18,Premarket Losers as of 9:05 am
CSCO,Cisco Systems Inc,2017-05-18,U.S. stock futures continue Trump induced slump  Dow down 100 points
CSCO,Cisco Systems Inc,2017-05-17,Cisco revenue forecast disappoints; says to cut 1 100 more jobs
CSCO,Cisco Systems Inc,2017-05-17,Cisco down 5.5% on weaker outlook 
CSCO,Cisco Systems Inc,2017-05-17,Dow loses 370 points as US stocks suffer worst day of 2017 
CSCO,Cisco Systems Inc,2017-06-12,Weekend can't stop tech selloff
CSCO,Cisco Systems Inc,2017-06-07,Illumio raises $125 million as cyber security firm targets sales growth
CSCO,Cisco Systems Inc,2017-06-02,As large cap gets larger  can the tech rally continue?
CSCO,Cisco Systems Inc,2017-06-01,Arista wins round in Cisco patent fight over network technology
CSCO,Cisco Systems Inc,2017-06-01,Intel talks autonomous driving future
CSCO,Cisco Systems Inc,2017-06-01,Arista recoups losses on word of win on second Cisco patent claim
CSCO,Cisco Systems Inc,2017-05-31,HPE posts steep revenue decline in key servers business
CSCO,Cisco Systems Inc,2017-05-24,US stocks extend win streak to five days after release of Fed minutes
CSCO,Cisco Systems Inc,2017-05-24,U.S. stocks higher at close of trade; Dow Jones Industrial Average up 0.36%
CSCO,Cisco Systems Inc,2017-05-19,Dow notches more than 100 points but ends week in negative
CSCO,Cisco Systems Inc,2017-06-27,U.S. stocks lower at close of trade; Dow Jones Industrial Average down 0.46%
CSCO,Cisco Systems Inc,2017-06-27,Exclusive: Ericsson scraps push for new clients beyond telecoms
CSCO,Cisco Systems Inc,2017-06-26,Apple  Cisco team up to push for cyber security insurance discounts
CSCO,Cisco Systems Inc,2017-06-26,Apple  Cisco want mutual customers to get security discount
CSCO,Cisco Systems Inc,2017-06-23,Under pressure  Western tech firms bow to Russian demands to share cyber secrets
CSCO,Cisco Systems Inc,2017-06-23,Western tech firms sharing cyber secrets?
CSCO,Cisco Systems Inc,2017-06-21,Arista Networks up 1.8% after initial ITC ruling in its favor
CSCO,Cisco Systems Inc,2017-06-21,Intel to collaborate with Israel's Team8  Illusive on cybersecurity
CSCO,Cisco Systems Inc,2017-06-20,Cisco adds subscription services to its core networking business
CSCO,Cisco Systems Inc,2017-06-19,Accenture  Microsoft team up on blockchain-based digital ID network
CSCO,Cisco Systems Inc,2017-07-15,Stocks to watch next week
CSCO,Cisco Systems Inc,2017-07-11,Streaming TV apps grapple with password sharing
CSCO,Cisco Systems Inc,2017-07-11,Hyperledger releases its first production ready blockchain
CSCO,Cisco Systems Inc,2017-07-05,Ukraine scrambles to contain new cyber threat after 'NotPetya' attack
CSCO,Cisco Systems Inc,2017-07-03,Family firm in Ukraine says it was not responsible for cyber attack
CSCO,Cisco Systems Inc,2017-07-03,Broadcom wins U.S. antitrust consent to buy Brocade: FTC
CSCO,Cisco Systems Inc,2017-06-29,The Dow sheds 168 points as the ‘tech wreck’ reappears 
CSCO,Cisco Systems Inc,2017-06-29,U.S. stocks lower at close of trade; Dow Jones Industrial Average down 0.78%
CSCO,Cisco Systems Inc,2017-06-28,New computer virus spreads from Ukraine to disrupt world business
CSCO,Cisco Systems Inc,2017-06-27,Nasdaq sheds 100 points as tech tumbles for second-straight day
CSCO,Cisco Systems Inc,2017-08-11,U.S. stocks higher at close of trade; Dow Jones Industrial Average up 0.07%
CSCO,Cisco Systems Inc,2017-08-11,U.S. stock futures lower as markets watch North Korea  CPI on tap
CSCO,Cisco Systems Inc,2017-08-11,Top 5 things to know in the market on Friday
CSCO,Cisco Systems Inc,2017-08-10,U.S. stocks lower at close of trade; Dow Jones Industrial Average down 0.93%
CSCO,Cisco Systems Inc,2017-08-10,Dow dips 200 points as US-North Korea tensions heat up
CSCO,Cisco Systems Inc,2017-08-02,U.S. bosses throw weight behind new drive to court India
CSCO,Cisco Systems Inc,2017-07-26,U.S. stocks higher at close of trade; Dow Jones Industrial Average up 0.45%
CSCO,Cisco Systems Inc,2017-07-26,Dow hits record high on strong earnings
CSCO,Cisco Systems Inc,2017-07-21,Arista Networks -2.3%; will appeal ITC decision  build workarounds
CSCO,Cisco Systems Inc,2017-07-21,Arista loses bid to lift import ban in Cisco battle
CSCO,Cisco Systems Inc,2017-08-17,U.S. stocks lower as Cisco  Wal-Mart weigh
CSCO,Cisco Systems Inc,2017-08-17,U.S. stock futures lower as markets await Wal-Mart  jobs data
CSCO,Cisco Systems Inc,2017-08-16,Cisco's security business revenue misses estimates  shares drop
CSCO,Cisco Systems Inc,2017-08-16,Wall Street ends up but off highs after Trump announcement  Fed minutes
CSCO,Cisco Systems Inc,2017-08-16,Cisco Systems experiences drop in revenue  earnings in line 
CSCO,Cisco Systems Inc,2017-08-16,Dow closes above 22 000 as fed minutes spark uncertainty over rate hikes
CSCO,Cisco Systems Inc,2017-08-16,U.S. stock futures point to higher open ahead of Fed minutes
CSCO,Cisco Systems Inc,2017-08-15,Reuters: Microsoft  Cisco among companies lobbying ahead of NAFTA talks
CSCO,Cisco Systems Inc,2017-08-15,Tech companies ramp up NAFTA lobbying on eve of trade talks
CSCO,Cisco Systems Inc,2017-08-12,Stocks to watch next week
CSCO,Cisco Systems Inc,2017-08-22,Wall Street rally resumes as Dow jumps nearly 200 points
CSCO,Cisco Systems Inc,2017-08-22,Cisco Systems shares climb following latest acquisition
CSCO,Cisco Systems Inc,2017-08-21,U.S. stocks mixed at close of trade; Dow Jones Industrial Average up 0.13%
CSCO,Cisco Systems Inc,2017-08-21,US stocks close mostly higher as Dow rebounds from weekly loss
CSCO,Cisco Systems Inc,2017-08-21,Cisco to buy Springpath for $320M-plus
CSCO,Cisco Systems Inc,2017-08-18,U.S. stocks lower at close of trade; Dow Jones Industrial Average down 0.35%
CSCO,Cisco Systems Inc,2017-08-18,US stocks close lower as Dow posts weekly loss
CSCO,Cisco Systems Inc,2017-08-17,Washington's mounting woes push S&P to biggest loss in three months
CSCO,Cisco Systems Inc,2017-08-17,U.S. stocks lower at close of trade; Dow Jones Industrial Average down 1.24%
CSCO,Cisco Systems Inc,2017-08-17,Dow sheds 270 points as political drama grips Wall Street
CSCO,Cisco Systems Inc,2017-08-30,Exclusive: BroadSoft explores options  including potential sale - sources
CSCO,Cisco Systems Inc,2017-08-30,U.S. stocks higher at close of trade; Dow Jones Industrial Average up 0.12%
CSCO,Cisco Systems Inc,2017-08-30,Nasdaq closes 1% higher; Apple hits intraday high
CSCO,Cisco Systems Inc,2017-08-29,Apple  Accenture team up on iPhone  iPad apps for businesses
CSCO,Cisco Systems Inc,2017-08-25,Pure Storage names new CEO; shares up 12.7%
CSCO,Cisco Systems Inc,2017-08-24,U.S. stocks lower at close of trade; Dow Jones Industrial Average down 0.13%
CSCO,Cisco Systems Inc,2017-08-24,Dow slides for 2nd straight day  shrugs off bullish tax reform remarks
CSCO,Cisco Systems Inc,2017-08-23,Dow rally hits a wall after Trump threatens government shutdown
CSCO,Cisco Systems Inc,2017-08-23,U.S. stocks lower at close of trade; Dow Jones Industrial Average down 0.40%
CSCO,Cisco Systems Inc,2017-08-22,U.S. stocks higher at close of trade; Dow Jones Industrial Average up 0.90%
CSCO,Cisco Systems Inc,2017-09-22,Dow Posts Weekly Gain  Shrugs off Geopolitical Uncertainty  
CSCO,Cisco Systems Inc,2017-09-22,U.S. stocks mixed at close of trade; Dow Jones Industrial Average down 0.04%
CSCO,Cisco Systems Inc,2017-09-20,Hackers used Avast's CCleaner breach to attack technology companies
CSCO,Cisco Systems Inc,2017-09-20,Arista Networks +2% as 'humble' Morgan Stanley re-upgrades to Buy
CSCO,Cisco Systems Inc,2017-09-18,Hackers compromised free CCleaner software  Avast's Piriform says
CSCO,Cisco Systems Inc,2017-09-18,Cisco's Executive Chairman Chambers not to seek re-election
CSCO,Cisco Systems Inc,2017-09-18,Cisco CEO Robbins to replace Chambers as chairman
CSCO,Cisco Systems Inc,2017-09-12,Slack launches new features for inter-company collaboration
CSCO,Cisco Systems Inc,2017-09-11,U.S. stocks higher at close of trade; Dow Jones Industrial Average up 1.19%
CSCO,Cisco Systems Inc,2017-09-11,US stocks close higher: Dow gains 259 points as concerns over Irma fade
CSCO,Cisco Systems Inc,2018-07-16,Stocks - Nasdaq Closes Lower; Netflix Sinks as Revenue  Guidance Misses
CSCO,Cisco Systems Inc,2018-07-16,Stocks-  U.S. Futures Flat as Investors Look to Earnings
CSCO,Cisco Systems Inc,2018-07-13,Cisco sinks on report Amazon wading into networking equipment
CSCO,Cisco Systems Inc,2018-07-13,U.S. stocks higher at close of trade; Dow Jones Industrial Average up 0.38%
CSCO,Cisco Systems Inc,2018-07-12,U.S. stocks higher at close of trade; Dow Jones Industrial Average up 0.91%
CSCO,Cisco Systems Inc,2018-07-12,Microsoft debuts free tier in competitive workplace chat app market
CSCO,Cisco Systems Inc,2018-07-12,Trade war may steer tax cuts' windfall to even more buybacks
CSCO,Cisco Systems Inc,2018-07-10,AT&T to buy cybersecurity firm AlienVault
CSCO,Cisco Systems Inc,2018-07-10,Success with Snap helps venture firm Lightspeed raise $1.8 billion for new funds
CSCO,Cisco Systems Inc,2018-07-09,Exclusive: Russia's telecoms security push hits snag - it needs foreign help
CSCO,Cisco Systems Inc,2018-08-02,S&P 500  Nasdaq rise as Apple hits $1 trillion mark
CSCO,Cisco Systems Inc,2018-08-02,U.S. stocks mixed at close of trade; Dow Jones Industrial Average down 0.03%
CSCO,Cisco Systems Inc,2018-08-02,Cisco to buy cyber-security company Duo for $2.35 billion
CSCO,Cisco Systems Inc,2018-07-27,U.S. stocks lower at close of trade; Dow Jones Industrial Average down 0.30%
CSCO,Cisco Systems Inc,2018-07-25,Stocks- U.S. Futures Flat Before Trump  Juncker Meeting
CSCO,Cisco Systems Inc,2018-07-20,Stocks - Dow Extends Weekly Winning Streak Despite Trade-War Jitters
CSCO,Cisco Systems Inc,2018-07-20,U.S. stocks lower at close of trade; Dow Jones Industrial Average down 0.03%
CSCO,Cisco Systems Inc,2018-07-19,Stocks - eBay  Domino’s Plunge in Pre-market  IBM  Cisco Gain
CSCO,Cisco Systems Inc,2018-07-19,Stocks-  U.S. Futures Fall Ahead of Earnings  Trade Tension Worry 
CSCO,Cisco Systems Inc,2018-07-16,U.S. stocks mixed at close of trade; Dow Jones Industrial Average up 0.18%
CSCO,Cisco Systems Inc,2018-08-16,Stocks - U.S. Futures Bounce on U.S.-China Trade Developments  Earnings in Focus
CSCO,Cisco Systems Inc,2018-08-15,Cisco's software push fuels quarterly beat  strong forecast
CSCO,Cisco Systems Inc,2018-08-15,After Hours Gainers / Losers (08/15/2018)
CSCO,Cisco Systems Inc,2018-08-15,Stocks - U.S. Futures Point to Lower Open with Earnings  Turkey in Focus
CSCO,Cisco Systems Inc,2018-08-15,Top 5 Things To Know In The Market On Wednesday
CSCO,Cisco Systems Inc,2018-08-12,Economic Calendar - Top 5 Things To Watch This Week
CSCO,Cisco Systems Inc,2018-08-09,Factbox: U.S. companies with exposure to Russia
CSCO,Cisco Systems Inc,2018-08-08,Invesco QQQ ETF (QQQ) July Summary
CSCO,Cisco Systems Inc,2018-08-06,Arista to pay $400 million to Cisco to resolve court fight
CSCO,Cisco Systems Inc,2018-08-06,Tencent Climbs Amid Reports of Google Partnership 
CSCO,Cisco Systems Inc,2018-08-31,U.S. stocks mixed at close of trade; Dow Jones Industrial Average down 0.09%
CSCO,Cisco Systems Inc,2018-08-29,Stocks- U.S. Futures Flat as NAFTA Deal Remains in the Spotlight
CSCO,Cisco Systems Inc,2018-08-28,U.S. stocks higher at close of trade; Dow Jones Industrial Average up 0.06%
CSCO,Cisco Systems Inc,2018-08-23,Uber investor Lead Edge Capital closes $520 million fund
CSCO,Cisco Systems Inc,2018-08-22,Wall Street's sector shakeup will let more tech stocks shine
CSCO,Cisco Systems Inc,2018-08-17,Top 5 Things That Moved Markets This Past Week
CSCO,Cisco Systems Inc,2018-08-16,Stocks - Dow Bags Biggest Daily Gain in Months as US-China Concerns Cool
CSCO,Cisco Systems Inc,2018-08-16,Wall Street gains on Walmart and Cisco earnings  trade optimism
CSCO,Cisco Systems Inc,2018-08-16,Stocks - Cisco Gains Midday  Lifting Telecom Shares
CSCO,Cisco Systems Inc,2018-08-16,Stocks - Walmart  Cisco Soar in Pre-market; JC Penney Crashes
CSCO,Cisco Systems Inc,2018-10-02,U.S. tech sector getting by without Facebook and Alphabet
CSCO,Cisco Systems Inc,2018-09-28,Slack preparing to go public in early 2019: WSJ
CSCO,Cisco Systems Inc,2018-09-24,China says U.S. trying to force it to submit on trade as new tariffs kick in
CSCO,Cisco Systems Inc,2018-09-24,Apple  Salesforce team up to bring Siri to more business apps
CSCO,Cisco Systems Inc,2018-09-24,Tech index refresh could give under-the-radar names their day in the sun
CSCO,Cisco Systems Inc,2018-09-21,U.S. stocks mixed at close of trade; Dow Jones Industrial Average up 0.32%
CSCO,Cisco Systems Inc,2018-09-19,What sector overhaul means for tech stocks  Wall Street
CSCO,Cisco Systems Inc,2018-09-17,U.S. duties spare Apple gadgets but hit cloud industry
CSCO,Cisco Systems Inc,2018-09-07,Kudlow Says U.S. Willing to Talk With China as Tariffs Loom
CSCO,Cisco Systems Inc,2018-09-06,Finisar beats by $0.06  beats on revenue
CSCO,Cisco Systems Inc,2018-11-07,Cisco Rises 3%
CSCO,Cisco Systems Inc,2018-10-31,Cisco Rises 3%
CSCO,Cisco Systems Inc,2018-10-26,U.S. stocks lower at close of trade; Dow Jones Industrial Average down 1.19%
CSCO,Cisco Systems Inc,2018-10-26,Cisco Falls 3%
CSCO,Cisco Systems Inc,2018-10-25,Exclusive: Information technology company ConvergeOne explores sale - sources
CSCO,Cisco Systems Inc,2018-10-25,Cisco Rises 3%
CSCO,Cisco Systems Inc,2018-10-23,Web performance software company Cloudflare readies IPO -sources
CSCO,Cisco Systems Inc,2018-10-23,Reuters: Cloudflare preps IPO with potential $3.5B valuation
CSCO,Cisco Systems Inc,2018-10-23,A passion for makeup drove Urban Decay's Zomnir to cosmetics industry
CSCO,Cisco Systems Inc,2018-10-23,Israel's Team8 launches $85 million cybersecurity and data fund
CSCO,Cisco Systems Inc,2018-11-14,Cisco beats as network gear demand rises  new bets pay off
CSCO,Cisco Systems Inc,2018-11-14,Stocks - U.S. Futures Flat to Lower  Inflation Data in Focus
CSCO,Cisco Systems Inc,2018-11-14,Top 5 Things to Know in The Market on Wednesday
CSCO,Cisco Systems Inc,2018-11-12,Cisco Falls 3%
CSCO,Cisco Systems Inc,2018-11-11,Economic Calendar - Top 5 Things to Watch This Week
CSCO,Cisco Systems Inc,2018-11-09,U.S. stocks lower at close of trade; Dow Jones Industrial Average down 0.77%
CSCO,Cisco Systems Inc,2018-11-09,Cisco Falls 3%
CSCO,Cisco Systems Inc,2018-11-08,U.S. stocks mixed at close of trade; Dow Jones Industrial Average up 0.04%
CSCO,Cisco Systems Inc,2018-11-08,Cisco works with Amazon to help businesses run apps in the cloud
CSCO,Cisco Systems Inc,2018-11-08,Stocks - U.S. Futures Fall Ahead of Fed Decision
CSCO,Cisco Systems Inc,2018-11-16,Digital media company Technicolor explores options including sale: sources
CSCO,Cisco Systems Inc,2018-11-15,Wall Street climbs on hopes of easing trade tensions
CSCO,Cisco Systems Inc,2018-11-15,Stocks - Dow Snaps 4-Day Losing Streak as Trade Optimism Sparks Rebound
CSCO,Cisco Systems Inc,2018-11-15,U.S. stocks higher at close of trade; Dow Jones Industrial Average up 0.83%
CSCO,Cisco Systems Inc,2018-11-15,Stocks - Wall Street Falls After Jobless Claims Numbers
CSCO,Cisco Systems Inc,2018-11-15,Cisco Rises 5%
CSCO,Cisco Systems Inc,2018-11-15,QURE  ARNA and CSCO among premarket gainers
CSCO,Cisco Systems Inc,2018-11-15,Stocks - Cisco  JP Morgan  Walmart Gain in Pre-market; JC Penney Crashes
CSCO,Cisco Systems Inc,2018-11-15,Stocks - U.S. Futures Rise as China and U.S. Resume Trade Talks 
CSCO,Cisco Systems Inc,2018-11-14,Cisco Earnings  Revenue beat in Q1
CSCO,Cisco Systems Inc,2018-12-07,Cisco Falls 3%
CSCO,Cisco Systems Inc,2018-12-06,China Accuses U.S. of Trying to Contain its Rise: Huawei Update
CSCO,Cisco Systems Inc,2018-12-06,U.S. stocks mixed at close of trade; Dow Jones Industrial Average down 0.32%
CSCO,Cisco Systems Inc,2018-12-04,Cisco Falls 3%
CSCO,Cisco Systems Inc,2018-12-04,TIBCO to buy data management firm Orchestra Networks: sources
CSCO,Cisco Systems Inc,2018-11-29,Nio  China rival to Tesla  says U.S. head to step down
CSCO,Cisco Systems Inc,2018-11-25,Logitech ends negotiations to acquire Plantronics
CSCO,Cisco Systems Inc,2018-11-23,Exclusive: Logitech in talks to acquire headphone maker Plantronics - sources
CSCO,Cisco Systems Inc,2018-11-21,Cisco to acquire UK-based Ensoft
CSCO,Cisco Systems Inc,2018-11-20,Cisco Falls 3%
CSCO,Cisco Systems Inc,2018-12-14,Deutsche Telekom reviews Huawei ties; Orange says no on 5G
CSCO,Cisco Systems Inc,2018-12-14,Cisco Falls 3%
CSCO,Cisco Systems Inc,2018-12-14,Stocks - U.S. Futures Fall Amid Fears of Slowing Global Growth
CSCO,Cisco Systems Inc,2018-12-12,Loop Capital: A Cisco/Luxtera deal threatens AAOI  FNSR
CSCO,Cisco Systems Inc,2018-12-12,Stocks - U.S. Futures Surge on Positive Trade Talks
CSCO,Cisco Systems Inc,2018-12-11,Invesco QQQ ETF (QQQ) November Summary
CSCO,Cisco Systems Inc,2018-12-10,U.S.  China Executives Grow Wary on Travel After Huawei Arrest
CSCO,Cisco Systems Inc,2018-12-09,Huawei's CEO Built an Empire. Trump Could Tear it Down
CSCO,Cisco Systems Inc,2018-12-07,Exclusive: Chat-service firm Slack taps Goldman Sachs to lead IPO - sources
CSCO,Cisco Systems Inc,2018-12-07,U.S. stocks lower at close of trade; Dow Jones Industrial Average down 2.24%
CSCO,Cisco Systems Inc,2019-01-04,Cisco Rises 3%
CSCO,Cisco Systems Inc,2019-01-03,Cisco Falls 3%
CSCO,Cisco Systems Inc,2019-01-03,Stocks - U.S. Futures Slump After Apple Cuts Forecast
CSCO,Cisco Systems Inc,2018-12-31,Merck  Pfizer top Dow 2018 standings; Goldman Sachs slides to the bottom
CSCO,Cisco Systems Inc,2018-12-26,Cisco Rises 3%
CSCO,Cisco Systems Inc,2018-12-24,Cisco Falls 3%
CSCO,Cisco Systems Inc,2018-12-21,Huawei's Rapid Growth  Alleged Theft Helped Sow Mistrust in U.S.
CSCO,Cisco Systems Inc,2018-12-19,Cisco Falls 3%
CSCO,Cisco Systems Inc,2018-12-17,Cisco Falls 3%
CSCO,Cisco Systems Inc,2018-12-14,U.S. stocks lower at close of trade; Dow Jones Industrial Average down 2.02%
CSCO,Cisco Systems Inc,2019-02-07,Illumio raises $65 million  J.P. Morgan Asset Management leads round
CSCO,Cisco Systems Inc,2019-02-07,Stocks - U.S. Futures Fall As Europe Slashes Growth Forecasts
CSCO,Cisco Systems Inc,2019-02-04,Slack makes confidential filing to go public
CSCO,Cisco Systems Inc,2019-01-30,Italian Postal Service Joins Hyperledger Blockchain Community
CSCO,Cisco Systems Inc,2019-01-28,Stocks - Caterpillar Slides in Premarket  S&P Global  Blackberry  Dropbox Gain
CSCO,Cisco Systems Inc,2019-01-21,In Versailles  Macron vows to reform to avoid king's fate
CSCO,Cisco Systems Inc,2019-01-17,Rallying: Qatari Al-Attiyah wins his third Dakar  Toyota's first
CSCO,Cisco Systems Inc,2019-01-16,Marriott hack Highlights Demand for Cybersecurity Investing
CSCO,Cisco Systems Inc,2019-01-15,Rubrik valued at $3.3 billion in latest Bain Capital-led funding
CSCO,Cisco Systems Inc,2019-01-15,Top Picks 2019- Arista Networks Inc. ANET
CSCO,Cisco Systems Inc,2019-02-13,Austria calls for European stance on Huawei to ensure competition
CSCO,Cisco Systems Inc,2019-02-13,Top 5 Things to Know in the Market on Wednesday
CSCO,Cisco Systems Inc,2019-02-12,Day Ahead: Top 3 Things to Watch
CSCO,Cisco Systems Inc,2019-02-12,Morgan Stanley downgrades Cisco before earnings
CSCO,Cisco Systems Inc,2019-02-11,U.S. stocks mixed at close of trade; Dow Jones Industrial Average down 0.21%
CSCO,Cisco Systems Inc,2019-02-11,Former executive of Duo Security  Zscaler joins IronNet as co-CEO
CSCO,Cisco Systems Inc,2019-02-11,Top 5 Things to Know in the Market on Monday
CSCO,Cisco Systems Inc,2019-02-10,Economic Calendar - Top 5 Things to Watch This Week
CSCO,Cisco Systems Inc,2019-02-08,U.S. stocks mixed at close of trade; Dow Jones Industrial Average down 0.25%
CSCO,Cisco Systems Inc,2019-02-07,Barclays hires internet banker from Deutsche Bank
CSCO,Cisco Systems Inc,2019-02-14,Israeli software firm DriveNets raises $110 million in first funding round
CSCO,Cisco Systems Inc,2019-02-14,Cisco Rises 4%
CSCO,Cisco Systems Inc,2019-02-14,Stocks - Wall Street Slumps After Retail Sales Fall in December
CSCO,Cisco Systems Inc,2019-02-14,Cisco Rises 3%
CSCO,Cisco Systems Inc,2019-02-14,Stocks - U.S. Futures Jump on News of Possible Trade Extension
CSCO,Cisco Systems Inc,2019-02-13,Newer businesses drive Cisco's earnings beat; shares rise
CSCO,Cisco Systems Inc,2019-02-13,Stocks Moving After Hours: Cisco  MGM Resorts  Century Link  NetApp  T-Mobile
CSCO,Cisco Systems Inc,2019-02-13,Cisco Shares Rise on Top and Bottom Line Beats
CSCO,Cisco Systems Inc,2019-02-13,Wall Street advances on trade hopes  tame inflation data
CSCO,Cisco Systems Inc,2019-02-13,U.S. stocks higher at close of trade; Dow Jones Industrial Average up 0.46%
CSCO,Cisco Systems Inc,2019-03-06,U.S. stocks lower at close of trade; Dow Jones Industrial Average down 0.52%
CSCO,Cisco Systems Inc,2019-03-06,Daily Stock Pick: Cisco Systems
CSCO,Cisco Systems Inc,2019-03-05,Former Cisco Employee Arrested  Charged With $9.3 Million Wire Fraud
CSCO,Cisco Systems Inc,2019-03-01,U.S. stocks higher at close of trade; Dow Jones Industrial Average up 0.43%
CSCO,Cisco Systems Inc,2019-02-27,Rakuten's all-cloud mobile network goes down a storm in Barcelona
CSCO,Cisco Systems Inc,2019-02-27,Explainer: Securing the 5G future - what's the issue?
CSCO,Cisco Systems Inc,2019-02-26,U.S. stocks lower at close of trade; Dow Jones Industrial Average down 0.13%
CSCO,Cisco Systems Inc,2019-02-25,U.S. stocks higher at close of trade; Dow Jones Industrial Average up 0.23%
CSCO,Cisco Systems Inc,2019-02-14,S&P 500 slips as grim retail sales data overshadows trade hopes
CSCO,Cisco Systems Inc,2019-02-14,U.S. stocks mixed at close of trade; Dow Jones Industrial Average down 0.41%
CSCO,Cisco Systems Inc,2019-03-26,Cisco: Global Blockchain market will be worth $10 billion by 2021
CSCO,Cisco Systems Inc,2019-03-25,Cisco Systems stock price target raised to $58 from $55 at KeyBanc Capital
CSCO,Cisco Systems Inc,2019-03-24,Exclusive: Telecom equipment provider Avaya considers leveraged buyout - sources
CSCO,Cisco Systems Inc,2019-03-18,Better Buy: Cisco Systems vs. Oracle
CSCO,Cisco Systems Inc,2019-03-17,Cisco Is Best Performing Dow Stock This Year
CSCO,Cisco Systems Inc,2019-03-15,Stocks - Dow Snaps Losing Streak as China Touts Progress on Trade
CSCO,Cisco Systems Inc,2019-03-15,Special Report: Beto O'Rourke's secret membership in a legendary hacking group
CSCO,Cisco Systems Inc,2019-03-14,Better IoT Buy: Sierra Wireless vs. Cisco
CSCO,Cisco Systems Inc,2019-03-12,Cisco Has the Fundamentals  but Shares Are Looking Frothy
CSCO,Cisco Systems Inc,2019-03-07,Stocks - U.S. Futures Slip as Huawei Sues U.S. Government
CSCO,Cisco Systems Inc,2019-04-06,‘Free’ Money: How Students Mine Cryptocurrency in Their Dorm Rooms
CSCO,Cisco Systems Inc,2019-04-06,Cisco Is Best-Performing Dow Stock of 2019
CSCO,Cisco Systems Inc,2019-04-05,The Tell: Cisco finds dozens of open-air groups peddling cybercrimes to 385 000 users on Facebook 
CSCO,Cisco Systems Inc,2019-04-03,Stocks - U.S. Futures Rise on Upbeat China  Europe Data 
CSCO,Cisco Systems Inc,2019-04-02,U.S. stocks mixed at close of trade; Dow Jones Industrial Average down 0.30%
CSCO,Cisco Systems Inc,2019-03-30,Former IBM and Cisco Executive Tom Noonan to Join Bakkt as Chairman of Board
CSCO,Cisco Systems Inc,2019-03-30,Why Cisco Topped the Dow’s Record Quarter
CSCO,Cisco Systems Inc,2019-03-29,Bakkt Taps Former IBM and Cisco Exec Tom Noonan to Chair Its Board
CSCO,Cisco Systems Inc,2019-03-29,Stock Market News: IBM  Cisco Top First-Quarter Dow Winners
CSCO,Cisco Systems Inc,2019-03-26,Cisco has new strategy to invest in hot start-ups  as other venture capitalists flood the zone
CSCO,Cisco Systems Inc,2017-06-15,Finisar EPS in-line  misses on revenue
CSCO,Cisco Systems Inc,2017-06-14,Nokia targets gains from web giants with fastest routers
CSCO,Cisco Systems Inc,2017-06-14,IDC: IoT spending to hit $800B in 2017
CSCO,Cisco Systems Inc,2017-06-14,Nokia's fast routers pursue Web-scale customer base
CSCO,Cisco Systems Inc,2017-06-13,Dow makes history as tech and financials gain 
