code,company,date,text
WMB,Williams Companies Inc,2019-04-24,Peace  honesty and cheap gas: Ukraine's new leader shoulders high expectations
WMB,Williams Companies Inc,2019-04-24,Mercedes' Bottas out for Baku revenge
WMB,Williams Companies Inc,2019-04-23,Crypto Wrap: Bitcoin Rises After Easter Lull; Serena Williams Invests in Coinbase
WMB,Williams Companies Inc,2019-04-23,Zelenskiy faces battles with Ukraine's hostile parliament
WMB,Williams Companies Inc,2019-04-23,Fed Seems Resigned to Bubble Risk in Effort to Extend Expansion
WMB,Williams Companies Inc,2019-04-22,NFL notebook: Cardinals reportedly fielding offers for top pick
WMB,Williams Companies Inc,2019-04-22,Ex-caddie: Tiger's comeback 'an incredible story'
WMB,Williams Companies Inc,2019-04-21,Four Olympic Gold Medals Winner Tennis Player Serena Williams Invests in Coinbase
WMB,Williams Companies Inc,2019-04-21,Fed up with status quo  Ukrainians may elect comedian in presidential run-off
WMB,Williams Companies Inc,2019-04-20,NFL mock draft: Cardinals face conundrum
WMB,Williams Companies Inc,2019-01-31,NBA roundup: Jokic's triple-double lifts Nuggets
WMB,Williams Companies Inc,2019-01-31,Cost-conscious Chinese tourists staying closer to home for Lunar New Year
WMB,Williams Companies Inc,2019-01-30,Exclusive: UAE used cyber super-weapon to spy on iPhones of foes
WMB,Williams Companies Inc,2019-01-30,Top 25 roundup: No. 3 Virginia tops No. 23 NC State in OT
WMB,Williams Companies Inc,2019-01-29,Apple Watch  using Aetna client data  wants to help you be healthy
WMB,Williams Companies Inc,2019-01-29,Netanyahu's toughest ballot rival  ex-general Gantz  to break silence
WMB,Williams Companies Inc,2019-01-29,NBA roundup: Nuggets' comeback stuns Grizzlies
WMB,Williams Companies Inc,2019-01-29,Powell faces early reckoning on Fed's $4-trillion question
WMB,Williams Companies Inc,2019-01-29,No deal  no problem: Wetherspoon pubs boss raises a glass to Brexit
WMB,Williams Companies Inc,2019-01-28,Motor racing: Fraga happy to blur the lines between real and virtual
WMB,Williams Companies Inc,2019-02-02,Williams’ bench strength lifts Clippers over Pistons
WMB,Williams Companies Inc,2019-02-02,NBA roundup: Irving shines as Celtics top Knicks
WMB,Williams Companies Inc,2019-02-02,NHL roundup: Lightning squeak by Islanders in shootout
WMB,Williams Companies Inc,2019-02-01,FCC faces tough questions from court on net neutrality repeal
WMB,Williams Companies Inc,2019-02-01,EPA taps climate skeptic for science advisory panel
WMB,Williams Companies Inc,2019-02-01,NBA roundup: LeBron returns  lifts Lakers in OT
WMB,Williams Companies Inc,2019-01-31,Symantec beats earnings estimates  CFO to step down
WMB,Williams Companies Inc,2019-01-31,Women's empowerment  social causes take the field in NFL Super Bowl ads
WMB,Williams Companies Inc,2019-01-31,U.S. appeals court  House panel to take up net neutrality
WMB,Williams Companies Inc,2019-01-31,Superhero creator Stan Lee honored in Hollywood
WMB,Williams Companies Inc,2019-02-05,Huge  pricey trucks haul jobs and profits for the Detroit Three
WMB,Williams Companies Inc,2019-02-05,Tennis: Halep appoints Belgian Van Cleemput as new coach
WMB,Williams Companies Inc,2019-02-04,Symantec appoints Debora Beachner Tomlin as new marketing chief
WMB,Williams Companies Inc,2019-02-04,Record Foreign Buying of Saudi Stocks as Khashoggi Woes Fade
WMB,Williams Companies Inc,2019-02-04,British lawmakers say highest Saudi authorities may be responsible for activists' torture
WMB,Williams Companies Inc,2019-02-03,Bud Light  robots  AI dominate attention during Super Bowl
WMB,Williams Companies Inc,2019-02-03,NBA roundup: Irving shines as Celtics snap Thunder's streak
WMB,Williams Companies Inc,2019-02-03,Ibaka helps Raptors cruise past Clippers
WMB,Williams Companies Inc,2019-02-03,NBA roundup: Harden scores 43 in Rockets' win
WMB,Williams Companies Inc,2019-02-03,Top 25 roundup: Indiana stuns No. 6 Michigan State
WMB,Williams Companies Inc,2019-02-10,Top 25 roundup: No. 2 Duke beats No. 3 Virginia again
WMB,Williams Companies Inc,2019-02-09,NBA roundup: Davis sits out end of Pelicans' tight win
WMB,Williams Companies Inc,2019-02-09,College football notebook: OSU QB Fields eligible to play in '19
WMB,Williams Companies Inc,2019-02-08,Fed's Daly embraces patience on rates  cites financial conditions
WMB,Williams Companies Inc,2019-02-07,India's central bank delivers a pre-election rate cut gift to Modi but is it enough?
WMB,Williams Companies Inc,2019-02-07,NBA roundup: Bucks stay hot  pound Wizards
WMB,Williams Companies Inc,2019-02-06,Palestinians warm to Netanyahu rival  citing signs of compromise
WMB,Williams Companies Inc,2019-02-06,Top 25 roundup: KSU upsets No. 13 Kansas
WMB,Williams Companies Inc,2019-02-06,NBA roundup: George  Westbrook power Thunder
WMB,Williams Companies Inc,2019-02-05,Apple retail chief Angela Ahrendts to depart in April
WMB,Williams Companies Inc,2019-02-18,European stocks hold onto four-month highs as trade talks progress
WMB,Williams Companies Inc,2019-02-18,Israeli cyber-hotline offers help for the hacked
WMB,Williams Companies Inc,2019-02-17,Split with Bajin not over money: Osaka
WMB,Williams Companies Inc,2019-02-17,Economic Calendar - Top 5 Things to Watch This Week
WMB,Williams Companies Inc,2019-02-17,NHL roundup: Allen's shutout lifts Blues to ninth straight win
WMB,Williams Companies Inc,2019-02-17,Top 25 roundup: No. 5 Kentucky takes down No. 1 Tennessee
WMB,Williams Companies Inc,2019-02-16,MLB notebook: Sabathia retiring after 2019 season
WMB,Williams Companies Inc,2019-02-15,NFL notebook: Kaepernick  Reid settle NFL grievances
WMB,Williams Companies Inc,2019-02-15,Lyft to woo investors with fast U.S. growth in IPO race with Uber
WMB,Williams Companies Inc,2019-02-14,NBA roundup: Russell lifts Nets over Cavs in 3 OTs
WMB,Williams Companies Inc,2019-02-19,Tearful Osaka stunned by Mladenovic in Dubai
WMB,Williams Companies Inc,2019-02-19,Exclusive: Fed's Williams says new economic outlook necessary for rate hikes
WMB,Williams Companies Inc,2019-02-19,Wall Street rises modestly on Walmart bump
WMB,Williams Companies Inc,2019-02-19,Reports: Padres  Machado agree to 10-year  $300 million deal
WMB,Williams Companies Inc,2019-02-19,F1's Williams target Wednesday new car track debut
WMB,Williams Companies Inc,2019-02-19,Tennis: ITF's new pathway to help dreamers reach the top
WMB,Williams Companies Inc,2019-02-19,Athletics: Semenya releases list of experts for battle with IAAF at CAS
WMB,Williams Companies Inc,2019-02-18,NFL notebook: Cowboys  DE Lawrence hope to avoid tag
WMB,Williams Companies Inc,2019-02-18,Serena climbs back to Top 10 in WTA rankings
WMB,Williams Companies Inc,2019-02-18,Poland pulls out of Israel summit in row over WW2 role
WMB,Williams Companies Inc,2019-02-14,Top 25 roundup: No. 1 Vols win 19th straight
WMB,Williams Companies Inc,2019-02-14,'Border buster' shows why Brexit frontier checks in Northern Ireland would matter
WMB,Williams Companies Inc,2019-02-13,Motor racing: Stroll ready to take a lead role in the family F1 business
WMB,Williams Companies Inc,2019-02-13,Election may keep Moldova in 'gray zone' between West and Russia
WMB,Williams Companies Inc,2019-02-13,NHL roundup: Lightning hammer sliding Flames
WMB,Williams Companies Inc,2019-02-12,NBA roundup: Westbrook sets consecutive triple-double mark
WMB,Williams Companies Inc,2019-02-12,China January exports  imports seen falling again in blow to global growth: Reuters poll
WMB,Williams Companies Inc,2019-02-11,Tennis: Osaka splits with coach Bajin
WMB,Williams Companies Inc,2019-02-11,Splits across the Irish border? Garage frets for post-Brexit future
WMB,Williams Companies Inc,2019-02-10,NBA roundup: George's 45 tops Harden's 42 in MVP-caliber matchup
WMB,Williams Companies Inc,2019-02-22,A Fed pivot  born of volatility  missteps  and new economic reality
WMB,Williams Companies Inc,2019-02-21,NFL notebook: League seeks info on Gurley's injury
WMB,Williams Companies Inc,2019-02-21,No-deal Brexit would take a chip off UK home values: Reuters poll
WMB,Williams Companies Inc,2019-02-21,Motor racing: Hulkenberg ends first test on a high for Renault
WMB,Williams Companies Inc,2019-02-21,Report: NFL reinstates former Bills RB Williams
WMB,Williams Companies Inc,2019-02-21,Fed Superstars Lay Out a Map for the Central Bank’s Big Rethink
WMB,Williams Companies Inc,2019-02-20,No host? No problem. Queen  Lady Gaga bring Grammys vibe to Oscars
WMB,Williams Companies Inc,2019-02-20,Tesla's top lawyer leaves two months into the job
WMB,Williams Companies Inc,2019-02-20,Motor racing: Raikkonen pushes Ferrari off the top of test timesheets
WMB,Williams Companies Inc,2019-02-20,U.S.-China trade hopes extend equity surge; central banks supportive
WMB,Williams Companies Inc,2019-02-24,From Russia to Wall Street 
WMB,Williams Companies Inc,2019-02-24,Top 25 roundup: No. 14 Texas Tech routs No. 12 Kansas
WMB,Williams Companies Inc,2019-02-23,NBA roundup: George  Thunder beat Jazz in 2 OTs
WMB,Williams Companies Inc,2019-02-22,Fed's policy pause sets stage for broad overhaul
WMB,Williams Companies Inc,2019-02-22,Twitter co-founder Evan Williams steps down from board
WMB,Williams Companies Inc,2019-02-22,Fed Officials Talk Up New Approach to Meeting Inflation Goal
WMB,Williams Companies Inc,2019-02-22,In hot job market  Fed still frets about low inflation
WMB,Williams Companies Inc,2019-02-22,Forex - U.S. Dollar Falls; Fed’s Williams Backs Phillips Curve
WMB,Williams Companies Inc,2019-02-22,NHL roundup: Stars snap Blues' winning streak
WMB,Williams Companies Inc,2019-02-22,Bye-bye Brexit: History haunts German woman leaving UK to avoid 'chaos'
WMB,Williams Companies Inc,2019-02-26,NBA roundup: Harden's 30-point streak ends in win
WMB,Williams Companies Inc,2019-02-25,Democratic U.S. lawmakers seek ethics probe of top EPA officials
WMB,Williams Companies Inc,2019-02-25,Stocks - GE Soars in Premarket  Newmont Mining  Spring Rise  Kraft Falls
WMB,Williams Companies Inc,2019-02-25,Hitting a Moving Target 
WMB,Williams Companies Inc,2019-02-25,Cartoon of tennis star Serena Williams not racist: Australia watchdog
WMB,Williams Companies Inc,2019-02-25,Rock band Queen plus Adam Lambert open first hostless Oscars in 30 years
WMB,Williams Companies Inc,2019-02-25,NBA roundup: Knicks wallop Spurs to end 18-game home skid
WMB,Williams Companies Inc,2019-02-25,Spring training roundup: Goldschmidt hitless in Cardinals debut
WMB,Williams Companies Inc,2019-02-24,Bold colors as stars arrive for the Oscars
WMB,Williams Companies Inc,2019-02-24,The Anatomy of Bubbles 
WMB,Williams Companies Inc,2019-03-01,Graft accusation piles pressure on Israel's Netanyahu as election looms
WMB,Williams Companies Inc,2019-03-01,European shares start March on a high as Moncler  WPP shine
WMB,Williams Companies Inc,2019-02-28,NFL notebook: TE Witten returns to Cowboys
WMB,Williams Companies Inc,2019-02-28,U.N. says Israel should face justice for Gaza protest killings
WMB,Williams Companies Inc,2019-02-28,No gas? No votes. Subsidy cuts imperil Ukraine leader's reelection bid
WMB,Williams Companies Inc,2019-02-28,Osaka adds American Jenkins to team
WMB,Williams Companies Inc,2019-02-28,NBA roundup: Wade buzzer-beater lifts Heat past Warriors
WMB,Williams Companies Inc,2019-02-27,Vettel crashes while Sainz goes fastest in testing
WMB,Williams Companies Inc,2019-02-27,Comedian takes center stage in Ukraine's presidential race
WMB,Williams Companies Inc,2019-02-26,NBA: Nowitzki and Doncic have fans cheering Mavs' past and future
WMB,Williams Companies Inc,2019-03-05,Clippers take care of skidding Lakers
WMB,Williams Companies Inc,2019-03-04,Flag comes down on U.S. Palestinian mission in Jerusalem
WMB,Williams Companies Inc,2019-03-04,Ukraine's Tymoshenko: 'gas princess'  prisoner  and next president?
WMB,Williams Companies Inc,2019-03-04,AAF roundup: Late field goal gives Atlanta first win
WMB,Williams Companies Inc,2019-03-03,NFL notebook: DLs Sweat  Banogu break records at showcase
WMB,Williams Companies Inc,2019-03-03,Economic Calendar - Top 5 Things to Watch This Week
WMB,Williams Companies Inc,2019-03-03,Top 25 roundup: No. 7 Tennessee routs No. 4 Kentucky
WMB,Williams Companies Inc,2019-03-02,Trump vows executive order requiring 'free speech' at colleges
WMB,Williams Companies Inc,2019-03-02,NBA roundup: Bulls outlast Hawks in 4-OT thriller
WMB,Williams Companies Inc,2019-03-02,NHL roundup: Jets pass Preds to gain division lead
WMB,Williams Companies Inc,2019-03-07,Azarenka  Konta cruise into second round at Indian Wells
WMB,Williams Companies Inc,2019-03-06,Kvitova says meeting with Seles was key after attack
WMB,Williams Companies Inc,2019-03-06,Fed's Williams says slower U.S. growth is a 'new normal'
WMB,Williams Companies Inc,2019-03-06,Netanyahu election rival pledges to 'separate' from Palestinians
WMB,Williams Companies Inc,2019-03-06,Market Snapshot: Stocks struggle for direction as investors brush off China stimulus  eye jobs numbers
WMB,Williams Companies Inc,2019-03-06,Top 5 Things to Know in The Market on Wednesday
WMB,Williams Companies Inc,2019-03-06,NHL roundup: Bruins' OT win extends streak
WMB,Williams Companies Inc,2019-03-05,Tennis: Wimbledon targeting juniors to make sure future is green
WMB,Williams Companies Inc,2019-03-05,EU equities rise as China stimulus pledge helps safe stocks
WMB,Williams Companies Inc,2019-03-05,NBA roundup: Suns stun Bucks
WMB,Williams Companies Inc,2019-03-09,NBA roundup: Rockets top 76ers for seventh straight win
WMB,Williams Companies Inc,2019-03-09,Adidas to pay equal bonuses for women's soccer World Cup winners
WMB,Williams Companies Inc,2019-03-09,Stephens stunned  Serena cruises at Indian Wells
WMB,Williams Companies Inc,2019-03-08,The World Economy Just Had a Rough Week
WMB,Williams Companies Inc,2019-03-08,Doves Fly as Central Banks Rethink Outlook: Global Economy Week
WMB,Williams Companies Inc,2019-03-07,Venus overcomes illness to advance at Indian Wells
WMB,Williams Companies Inc,2019-03-07,NFL notebook: Keenum reportedly headed to D.C.
WMB,Williams Companies Inc,2019-03-07,Draghi Slashes ECB Outlook as Officials Inject More Stimulus
WMB,Williams Companies Inc,2019-03-07,Far-rightists cleared for Israel election  Arab party blocked
WMB,Williams Companies Inc,2019-03-07,NBA roundup: Lakers lose as LeBron passes Jordan for career points
WMB,Williams Companies Inc,2019-03-10,Serena Williams retires ill at Indian Wells
WMB,Williams Companies Inc,2019-03-10,Halep claims tough win over qualifier Kozlova
WMB,Williams Companies Inc,2019-03-10,Enbridge pipeline delay spooks traders in long-term Canada crude market
WMB,Williams Companies Inc,2019-03-10,Why These Pipelines Are So Bullish on Natural Gas
WMB,Williams Companies Inc,2019-03-10,Top 25 roundup: No. 3 North Carolina beats No. 4 Duke again
WMB,Williams Companies Inc,2019-03-10,NHL roundup: Bruins edge Sens  run point streak to 19
WMB,Williams Companies Inc,2019-03-10,Venus surges  defending champ Osaka nervous but wins at Indian Wells
WMB,Williams Companies Inc,2019-03-09,NBA notebook: Harden expected to play Sunday
WMB,Williams Companies Inc,2019-03-09,Soccer: U.S. women's head coach Ellis supports players' lawsuit
WMB,Williams Companies Inc,2019-03-09,Thunder's George rips 'bad officiating' after defeat
WMB,Williams Companies Inc,2015-06-29,Second-quarter M&A close to record amid mega deals
WMB,Williams Companies Inc,2015-06-23,U.S. stocks higher at close of trade; Dow Jones Industrial Average up 0.13%
WMB,Williams Companies Inc,2015-06-22,U.S. stocks surge amid Greek developments  flurry of M&A activity
WMB,Williams Companies Inc,2015-06-22,U.S. stocks higher at close of trade; Dow Jones Industrial Average up 0.58%
WMB,Williams Companies Inc,2015-06-22,Wall Street rises on Greece optimism  Nasdaq ends at record
WMB,Williams Companies Inc,2015-06-22,ETE confirms $48 billion bid for reluctant Williams Co
WMB,Williams Companies Inc,2015-05-13,U.S. stocks mixed at close of trade; Dow Jones Industrial Average down 0.04%
WMB,Williams Companies Inc,2015-05-13,Wall St. little changed in earnings  data lull
WMB,Williams Companies Inc,2015-03-16,Big problem for fund managers: liking Apple too much
WMB,Williams Companies Inc,2016-01-06,U.S. stocks complete worst 3-day start since 2008  amid global concerns
WMB,Williams Companies Inc,2015-12-18,U.S. stocks suffer worst two-day loss since late-August  as oil weighs
WMB,Williams Companies Inc,2015-10-01,U.S. stocks mixed  as poor global manufacturing data weighs 
WMB,Williams Companies Inc,2015-10-01,U.S. stocks mixed at close of trade; Dow Jones Industrial Average down 0.08%
WMB,Williams Companies Inc,2015-09-28,U.S. stocks fall sharply  as poor Chinese data weighs on commodities
WMB,Williams Companies Inc,2015-09-28,U.S. stocks lower at close of trade; Dow Jones Industrial Average down 1.92%
WMB,Williams Companies Inc,2015-09-10,U.S. stocks higher at close of trade; Dow Jones Industrial Average up 0.47%
WMB,Williams Companies Inc,2015-08-17,U.S. stocks higher at close of trade; Dow Jones Industrial Average up 0.39%
WMB,Williams Companies Inc,2015-08-17,U.S. stocks rally from morning losses  amid optimistic housing data 
WMB,Williams Companies Inc,2015-07-14,WPX Energy enters oil-rich Permian basin with $2.35 billion buy
WMB,Williams Companies Inc,2016-02-10,U.S. stocks mixed as guarded Yellen offers few hints on Fed's tightening
WMB,Williams Companies Inc,2016-02-08,U.S. stock extend last week's losses  amid spillover from euro sell-off
WMB,Williams Companies Inc,2016-02-08,Chesapeake moves to quash bankruptcy fears as shares plunge
WMB,Williams Companies Inc,2016-01-26,U.S. stocks move broadly higher with Apple earnings on tap 
WMB,Williams Companies Inc,2016-01-22,U.S. cap first positive week of 2016 as crude rally bolsters Dow  NASDAQ
WMB,Williams Companies Inc,2016-01-15,U.S. stocks hit lowest levels in months as Dow closes down almost 400
WMB,Williams Companies Inc,2016-01-14,U.S. stocks surge amid oil rally  dovish Fed comments on next rate hike
WMB,Williams Companies Inc,2016-01-13,U.S. stocks stage dramatic reversal  as Dow plunges more than 350 points
WMB,Williams Companies Inc,2016-01-12,U.S. stocks broadly higher  in spite of continued slide in crude prices
WMB,Williams Companies Inc,2016-01-07,U.S. stocks plunge 2% as continuing China woes spill into global markets
WMB,Williams Companies Inc,2016-04-19,U.S. stocks mixed at close of trade; Dow Jones Industrial Average up 0.27%
WMB,Williams Companies Inc,2016-04-18,U.S. stocks higher at close of trade; Dow Jones Industrial Average up 0.60%
WMB,Williams Companies Inc,2016-03-24,U.S. stocks flat halting 5-week winning streak ahead of Easter holiday
WMB,Williams Companies Inc,2016-03-24,U.S. stocks mixed at close of trade; Dow Jones Industrial Average up 0.08%
WMB,Williams Companies Inc,2016-03-21,U.S. stocks higher at close of trade; Dow Jones Industrial Average up 0.12%
WMB,Williams Companies Inc,2016-03-11,Exclusive: Energy Transfer has held talks to sell Sunoco - sources
WMB,Williams Companies Inc,2016-03-11,Some bond funds bet on longer-lasting rally in energy debt 
WMB,Williams Companies Inc,2016-03-10,U.S. stocks mixed at close of trade; Dow Jones Industrial Average down 0.03%
WMB,Williams Companies Inc,2016-02-22,As U.S. shale sinks  pipeline fight sends woes downstream
WMB,Williams Companies Inc,2016-02-16,Hedge funds place bets on Morgan Stanley; some exit Valeant  
WMB,Williams Companies Inc,2016-08-01,Williams Companies Q2 EPS estimated at $0.23 on revenue of $1.92 bn 
WMB,Williams Companies Inc,2016-07-18,U.S. stocks higher at close of trade; Dow Jones Industrial Average up 0.09%
WMB,Williams Companies Inc,2016-07-14,U.S. stocks higher at close of trade; Dow Jones Industrial Average up 0.73%
WMB,Williams Companies Inc,2016-07-01,U.S. stocks higher at close of trade; Dow Jones Industrial Average up 0.11%
WMB,Williams Companies Inc,2016-07-01,U.S. stocks post 4th straight win as Dow  S&P complete best week in 2016
WMB,Williams Companies Inc,2016-06-16,U.S. stocks higher at close of trade; Dow Jones Industrial Average up 0.53%
WMB,Williams Companies Inc,2016-05-25,U.S. stocks complete stellar 2-day rally  as Dow turns positive for May
WMB,Williams Companies Inc,2016-05-25,U.S. stocks higher at close of trade; Dow Jones Industrial Average up 0.82%
WMB,Williams Companies Inc,2016-05-16,Top U.S. investors divided on energy shares in first quarter
WMB,Williams Companies Inc,2016-05-16,U.S. stocks higher at close of trade; Dow Jones Industrial Average up 1.00%
WMB,Williams Companies Inc,2017-05-01,"Pipeline companies rebel against Trump's ""Buy American"" rule"
WMB,Williams Companies Inc,2017-02-22,Pipeline fights move from Dakota prairie to Louisiana bayous
WMB,Williams Companies Inc,2017-01-10,U.S. stocks mixed at close of trade; Dow Jones Industrial Average down 0.16%
WMB,Williams Companies Inc,2016-12-23,U.S. stocks higher at close of trade; Dow Jones Industrial Average up 0.07%
WMB,Williams Companies Inc,2016-12-16,U.S. stocks lower at close of trade; Dow Jones Industrial Average down 0.04%
WMB,Williams Companies Inc,2016-11-15,California Resources +20% after new Soros buy
WMB,Williams Companies Inc,2016-09-07,Enbridge buying Spectra in $28 billion deal
WMB,Williams Companies Inc,2016-08-22,Corvex's Meister proposes to replace Williams' board
WMB,Williams Companies Inc,2016-08-18,U.S. stocks higher at close of trade; Dow Jones Industrial Average up 0.13%
WMB,Williams Companies Inc,2016-08-15,Lack of investment  payment delays hamper Venezuela oil output
WMB,Williams Companies Inc,2018-02-12,Constitution pipeline consortium seeks rehearing of New York permit denial
WMB,Williams Companies Inc,2017-11-08,Court rejects request to continue building Atlantic Sunrise pipeline
WMB,Williams Companies Inc,2017-10-31,Notable earnings after Wednesday’s close
WMB,Williams Companies Inc,2017-08-14,Corvex warns of proxy fight with Energen after raising stake
WMB,Williams Companies Inc,2017-08-07,"Efficiency improvements ""terrifying"" for nat gas price outlook  analyst says"
WMB,Williams Companies Inc,2017-06-20,Energy sector on track for worst one-day drop since March
WMB,Williams Companies Inc,2017-06-16,Williams Cos. +2% as CEO Armstrong buys 15K shares
WMB,Williams Companies Inc,2017-05-15,Corvex adds Facebook  exits Williams to headline Q1 changes
WMB,Williams Companies Inc,2017-05-15,New positions at Omega Advisors
WMB,Williams Companies Inc,2017-05-02,Notable earnings after Wednesday’s close
WMB,Williams Companies Inc,2018-10-30,Motor racing: Calderon sets a female F1 first for Latin America
WMB,Williams Companies Inc,2018-10-30,U.S. Baptist missionary from Indiana killed in Cameroon: family
WMB,Williams Companies Inc,2018-08-14,Soros Fund Management adds popular tech names  BlackRock in second quarter
WMB,Williams Companies Inc,2018-08-14,Stocks - Home Depot Jumps in Pre-market; Apple Gains; Switch Crashes
WMB,Williams Companies Inc,2018-08-01,Williams ups planned capex through 2019 on gas growth opportunities
WMB,Williams Companies Inc,2018-05-01,Notable earnings after Wednesday’s close
WMB,Williams Companies Inc,2018-03-16,Williams  Williams Partners say FERC policy changes do not affect guidance
WMB,Williams Companies Inc,2018-03-15,U.S. stocks mixed at close of trade; Dow Jones Industrial Average up 0.47%
WMB,Williams Companies Inc,2018-03-12,Reuters: Williams Cos. P-E partners in Caiman Energy II seek to cash out
WMB,Williams Companies Inc,2018-03-09,After Hours Gainers / Losers (3/9/2018)
WMB,Williams Companies Inc,2018-11-02,Fired Jackson: 'I laid foundation' for Browns
WMB,Williams Companies Inc,2018-11-02,Netanyahu condemns killing of Saudi journalist but keeps focus on Iran
WMB,Williams Companies Inc,2018-11-01,'Boy Erased' steps up battle against gay conversion therapy
WMB,Williams Companies Inc,2018-11-01,Take 5: Can Packers’ D maintain progress vs. Patriots?
WMB,Williams Companies Inc,2018-11-01,Redskins prep for pass-happy Falcons
WMB,Williams Companies Inc,2018-11-01,Traitors or Russian agents? Clergy caught in Ukraine church row
WMB,Williams Companies Inc,2018-11-01,Boost VC Just Fulfilled a Crypto Funding Pledge 4 Years in the Making
WMB,Williams Companies Inc,2018-10-31,Giants' Hall of Famer McCovey dies at 80
WMB,Williams Companies Inc,2018-10-31,Williams Earnings  Revenue beat in Q3
WMB,Williams Companies Inc,2018-10-31,Tennis: U.S. name unfamiliar lineup for Fed Cup final
WMB,Williams Companies Inc,2018-11-09,NBA roundup: Curry exits as Bucks blast Warriors
WMB,Williams Companies Inc,2018-11-08,CFTC charges former Deutsche Bank trader with fraudulently mismarking swaps
WMB,Williams Companies Inc,2018-11-07,American Melichar relishes making Fed Cup debut against country of birth
WMB,Williams Companies Inc,2018-11-06,NBA roundup: Murray's 48 lift Nuggets over Celtics
WMB,Williams Companies Inc,2018-11-05,FLM ALL 32: Team-by-team NFL notes
WMB,Williams Companies Inc,2018-11-05,Israel sees desalination as Sea of Galilee's savior
WMB,Williams Companies Inc,2018-11-04,Top 25 roundup: No. 1 Alabama shuts out No. 3 LSU in laugher
WMB,Williams Companies Inc,2018-11-03,Pliskova pulls out of Czech team for Fed Cup final vs. U.S.
WMB,Williams Companies Inc,2018-11-03,NBA roundup: Paul  Rockets halt losing skid
WMB,Williams Companies Inc,2018-11-02,Clippers roll on road past slumping Magic
WMB,Williams Companies Inc,2018-11-11,Mayfield's sizzling start leads Browns over Falcons
WMB,Williams Companies Inc,2018-11-11,Siniakova shines as Czech Republic claim sixth Fed Cup in eight years
WMB,Williams Companies Inc,2018-11-11,NBA roundup: Aldridge double-double leads Spurs over Rockets
