code,company,date,text
WMB,Williams Companies Inc,2018-11-11,Separatist-held regions hold elections in eastern Ukraine
WMB,Williams Companies Inc,2018-11-10,NFL notebook: Steelers' Bell unlikely to report by deadline
WMB,Williams Companies Inc,2018-11-10,Hamilton on pole in Brazil  Vettel alongside
WMB,Williams Companies Inc,2018-11-09,Investors focus on retailers as wages rise
WMB,Williams Companies Inc,2018-11-09,Tennis: U.S. counting on debutants in Fed Cup title defense
WMB,Williams Companies Inc,2018-11-09,Tennis: Czech Kvitova to miss first day of Fed Cup final
WMB,Williams Companies Inc,2018-11-09,Fed officials point to vulnerabilities behind hot U.S. labor market
WMB,Williams Companies Inc,2018-11-15,Broncos back from bye  visit quietly contending Chargers
WMB,Williams Companies Inc,2018-11-15,Top 5 Things to Know in The Market on Thursday
WMB,Williams Companies Inc,2018-11-15,NFL notebook: Big Ben never heard back from Bell
WMB,Williams Companies Inc,2018-11-14,Suncor CEO to retire next year  be replaced by COO
WMB,Williams Companies Inc,2018-11-14,Former world number two Agnieszka Radwanska announces retirement
WMB,Williams Companies Inc,2018-11-14,Israeli defense minister quits over Gaza truce in blow to Netanyahu
WMB,Williams Companies Inc,2018-11-13,Nike hires former Coca-Cola executive as Jordan Brand president
WMB,Williams Companies Inc,2018-11-13,NBA roundup: LeVert hurt as Nets lose
WMB,Williams Companies Inc,2018-11-13,Top 25 roundup: Vick's 3-point barrage leads No. 2 Kansas in win
WMB,Williams Companies Inc,2018-11-12,Fed's Daly Sees December Rate Hike  at Least Two 2019 Moves
WMB,Williams Companies Inc,2018-11-18,Dollar pauses as Fed officials caution about global growth  yen firms
WMB,Williams Companies Inc,2018-11-18,Hurricanes strike early  outlast Devils  2-1
WMB,Williams Companies Inc,2018-11-18,Dorsey: Browns haven't discussed Condi Rice
WMB,Williams Companies Inc,2018-11-18,Browns hope to interview Condi Rice: report
WMB,Williams Companies Inc,2018-11-17,NFL notebook: Fines handed out after Rams-Seahawks incidents
WMB,Williams Companies Inc,2018-11-16,NFL notebook: Flacco doubtful vs. Bengals
WMB,Williams Companies Inc,2018-11-16,NBA roundup: Harden  Rockets top depleted Warriors
WMB,Williams Companies Inc,2018-11-15,Mookie Betts crowned AL MVP winner
WMB,Williams Companies Inc,2018-11-15,More U.S. states could swarm into legal sports betting next year
WMB,Williams Companies Inc,2018-11-15,Take 5: Chiefs-Rams take center stage
WMB,Williams Companies Inc,2018-11-21,Team-by-team NFL notes
WMB,Williams Companies Inc,2018-11-21,Patriots QB Brady limited in practice
WMB,Williams Companies Inc,2018-11-21,Kim and Kanye donate $500 000 to California wildfire relief efforts
WMB,Williams Companies Inc,2018-11-21,Venus Williams settles lawsuit over fatal Florida car crash
WMB,Williams Companies Inc,2018-11-21,Israeli minister urges Airbnb boycott  talks up rival service
WMB,Williams Companies Inc,2018-11-21,Airbus names new finance and operations chiefs as overhaul continues
WMB,Williams Companies Inc,2018-11-20,Yields decline as global equity rout sparks safety buying
WMB,Williams Companies Inc,2018-11-20,Airbus to unveil top finance  operational executives: sources
WMB,Williams Companies Inc,2018-11-20,UK Plc prepares for messy Brexit as clock ticks down
WMB,Williams Companies Inc,2018-11-20,Gold Prices Little Changed as Fed Official Suggests Rates Likely to Rise Soon 
WMB,Williams Companies Inc,2018-11-25,NHL roundup: Laine scores five goals in Jets' win
WMB,Williams Companies Inc,2018-11-25,Top 25 roundup: No. 10 OSU continues dominance over No. 4 Michigan
WMB,Williams Companies Inc,2018-11-24,Top 25 roundup: No. 13 Virginia Tech cruises in rout
WMB,Williams Companies Inc,2018-11-24,Top 25 roundup: No. 6 Oklahoma Sooners edges No. 13 West Virginia Mountaineers to make Big 12 title game
WMB,Williams Companies Inc,2018-11-24,Top 25 roundup: No. 2 Kansas tops No. 5 Tennessee in overtime
WMB,Williams Companies Inc,2018-11-23,Top 25 roundup: Roach  Texas down No. 7 UNC
WMB,Williams Companies Inc,2018-11-22,Ukraine parliament passes budget to unlock $3.9 billion in IMF loans
WMB,Williams Companies Inc,2018-11-22,NHL roundup: Crosby tallies 3 points in return to Pens
WMB,Williams Companies Inc,2018-11-22,Top 25 roundup: No. 3 Gonzaga outlasts No. 1 Duke
WMB,Williams Companies Inc,2018-11-21,MLB notebook: Machado addresses 'Johnny Hustle' flap
WMB,Williams Companies Inc,2018-11-19,U.S. Full Employment  China Trade Pay  Japan's Quandry: Eco Day
WMB,Williams Companies Inc,2018-11-19,A key Fed official stays the course on U.S. rate hikes amid growing doubts
WMB,Williams Companies Inc,2018-11-19,Wall Street tumbles as Apple  internet stocks swoon
WMB,Williams Companies Inc,2018-11-19,Airbnb to remove listings in Israel's West Bank settlements
WMB,Williams Companies Inc,2018-11-19, John Williams Sees Fed Likely Raising Interest Rates ‘Somewhat’ More
WMB,Williams Companies Inc,2018-11-19,Stocks - Wall Street Drops on Mixed Signals for U.S.-China Trade  Apple Worries
WMB,Williams Companies Inc,2018-11-19,Global stocks push higher  dollar sapped by rate hike uncertainty
WMB,Williams Companies Inc,2018-11-19,NHL roundup: Avs beat OT buzzer and Ducks
WMB,Williams Companies Inc,2018-11-19,NFL: Redskins face tough road after gruesome Smith injury
WMB,Williams Companies Inc,2018-11-19,NFL roundup: Saints pummel Eagles
WMB,Williams Companies Inc,2018-11-27,Canada’s Oil Output Is Growing Despite Its Pipeline Problems
WMB,Williams Companies Inc,2018-11-27,U.S. voting rights trampled in Georgia governor's race: lawsuit
WMB,Williams Companies Inc,2018-11-27,Medicine or vice? Socially screened funds struggle to define cannabis industry
WMB,Williams Companies Inc,2018-11-27,Fed urged to get more serious about U.S. corporate debt risks
WMB,Williams Companies Inc,2018-11-26,Report: Cheniere ramps up feedgas deliveries to Texas LNG export terminal
WMB,Williams Companies Inc,2018-11-26,World powers meet in Geneva on Afghan reforms  peace prospects
WMB,Williams Companies Inc,2018-11-26,Canadian football: Calgary tops Ottawa to prevail in Grey Cup
WMB,Williams Companies Inc,2018-11-26,NBA roundup: Butler's last-second 3 sends Sixers past Nets
WMB,Williams Companies Inc,2018-11-25,SARB Hikes  Fed Outlook  Trump Thanks Saudi on Oil: EM Review
WMB,Williams Companies Inc,2018-11-25,Economic Calendar - Top 5 Things to Watch This Week
WMB,Williams Companies Inc,2018-11-30,Fed Jumps Off Predictable Rate Path and Into a Policy Wilderness
WMB,Williams Companies Inc,2018-11-29,NFL notebook: 49ers' Sherman eager to face Seahawks
WMB,Williams Companies Inc,2018-11-29,Dell posts revenue jump ahead of voting on VMware offer
WMB,Williams Companies Inc,2018-11-29,President cheers as Ukraine on cusp of church independence
WMB,Williams Companies Inc,2018-11-29,NBA roundup: Westbrook a triple threat vs. Cavs
WMB,Williams Companies Inc,2018-11-29,Top 25 roundup: Forrest saves No. 15 FSU vs. No. 19 Purdue
WMB,Williams Companies Inc,2018-11-28,Olympics: Snowboarder Shaun White sets sights on 2020 skateboarding
WMB,Williams Companies Inc,2018-11-28,U.S. urges Palestinians to free dual national suspected of Jerusalem land deal
WMB,Williams Companies Inc,2018-11-28,Motor racing: F1 podium domination by top teams is unacceptable - Brawn
WMB,Williams Companies Inc,2018-11-27,NFL notebook: Redskins claim troubled LB Foster
WMB,Williams Companies Inc,2018-12-04,NBA roundup: Nuggets snap Raptors' win streak
WMB,Williams Companies Inc,2018-12-03,Motor racing: Racing Point will change name again before F1 season starts
WMB,Williams Companies Inc,2018-12-03,Motor racing: Williams sign Canadian Latifi as F1 reserve
WMB,Williams Companies Inc,2018-12-03,Stocks - U.S. Futures Rise After U.S. and China Agree to Trade Ceasefire
WMB,Williams Companies Inc,2018-12-03,NBA roundup: Jordan lifts Mavs over Clippers
WMB,Williams Companies Inc,2018-11-30,Kinder Morgan  Williams win OK to start up facilities to boost feedgas to Cheniere LNG terminals
WMB,Williams Companies Inc,2018-11-30,Wildfires pose threat to California climate goals  officials say
WMB,Williams Companies Inc,2018-11-30,Motor racing: New Force India owner targets top three and a profit
WMB,Williams Companies Inc,2018-11-30,Motor racing: Force India complete 2019 grid with Stroll
WMB,Williams Companies Inc,2018-11-30,Williams backs new Fed approaches to targeting inflation
WMB,Williams Companies Inc,2018-12-06,Top 25 roundup: No. 1 Gonzaga edges Washington
WMB,Williams Companies Inc,2018-12-05,NFL puts ref on leave over Hughes altercation
WMB,Williams Companies Inc,2018-12-05,Ukraine elections won't derail inflation targeting  forex reforms: central bank
WMB,Williams Companies Inc,2018-12-05,Serena confirmed for Australian Open return
WMB,Williams Companies Inc,2018-12-04,Co-founder takes interim role leading Medicine Man after CEO's death
WMB,Williams Companies Inc,2018-12-04,America's Job Growth Is Polarized  and Even More So in New York
WMB,Williams Companies Inc,2018-12-04,As markets turn  Fed says it is not fazed
WMB,Williams Companies Inc,2018-12-04,Russian threat highest since 2014: Ukraine military chief
WMB,Williams Companies Inc,2018-12-04,Fed’s Williams Says Strong Economy Warrants Further Rate Hikes
WMB,Williams Companies Inc,2018-12-04,Fed's Williams expects further U.S. rate increases into next year
WMB,Williams Companies Inc,2018-12-09,Chiefs beat Ravens in OT to clinch playoff berth
WMB,Williams Companies Inc,2018-12-09,NBA roundup: Celts win by 56  make history with Bulls
WMB,Williams Companies Inc,2018-12-08,NHL roundup: Bishop  Stars hold off Sharks
WMB,Williams Companies Inc,2018-12-07,Fed policymakers signal turning point on U.S. rate-hike path
WMB,Williams Companies Inc,2018-12-07,Motor racing: Rule changes are a chance for all F1 teams  says Wolff
WMB,Williams Companies Inc,2018-12-07,Tesla hires Washington trial lawyer as new general counsel
WMB,Williams Companies Inc,2018-12-07,Take 5: Top offenses and defenses clash in Week 14
WMB,Williams Companies Inc,2018-12-06,NFL notebook: McCarthy addressed Packers players
WMB,Williams Companies Inc,2018-12-06,Tariffs have hit confidence  to slow U.S. economy: Fed's Williams
WMB,Williams Companies Inc,2018-12-06,Ex-NFL star Williams behind new Freedom Football League
WMB,Williams Companies Inc,2018-12-13,Trump Attacks on Fed Could Backfire  Boosting Powell's Support
WMB,Williams Companies Inc,2018-12-13,Journeyman Johnson charged with reviving Redskins at Jacksonville
WMB,Williams Companies Inc,2018-12-13,Airbus strategy review augurs clean break under new CEO
WMB,Williams Companies Inc,2018-12-13,Israeli troops kill two fugitive Hamas gunmen in West Bank
WMB,Williams Companies Inc,2018-12-12,Ingram on verge of breaking McAllister's TD mark
WMB,Williams Companies Inc,2018-12-12,How one humble English club is greening up soccer
WMB,Williams Companies Inc,2018-12-12,Suns owner Sarver threatens to move team to Seattle or Las Vegas
WMB,Williams Companies Inc,2018-12-11,Broncos  Browns on playoff fringe ahead of matchup
WMB,Williams Companies Inc,2018-12-11,Uber's dominant size may rob smaller Lyft of its IPO oxygen
WMB,Williams Companies Inc,2018-12-10,Ravens expect QB Jackson to be OK
WMB,Williams Companies Inc,2018-12-16,"Israel signals displeasure at Australia's ""mistaken"" West Jerusalem move"
WMB,Williams Companies Inc,2018-12-16,Bowl roundup: Rushing Rivers lifts No. 21 Bulldogs in Vegas
WMB,Williams Companies Inc,2018-12-15,Ukraine's President names leader of new church in split from Russia
WMB,Williams Companies Inc,2018-12-15,As Zinke departs  Trump says he will name new interior secretary next week
WMB,Williams Companies Inc,2018-12-14,NFL notebook: Steelers expecting RB Conner back for Pats
WMB,Williams Companies Inc,2018-12-14,Chargers' gamble results in key win over Chiefs
WMB,Williams Companies Inc,2018-12-14,Airbus names Mhun as next programs chief
WMB,Williams Companies Inc,2018-12-14,Some see 'devil's work' as Ukrainian Church prepares to split with Russia
WMB,Williams Companies Inc,2018-12-13,Take 5: Steelers' D vs. Brady headlines Week 15
WMB,Williams Companies Inc,2018-12-13,WTA to offer increased rankings protection for returning mothers: report
WMB,Williams Companies Inc,2018-12-18,U.S. Cuba lobby celebrates a farm bill win despite worsening ties
WMB,Williams Companies Inc,2018-12-18,British Airways to resume Pakistan flights decade after hotel bombing
WMB,Williams Companies Inc,2018-12-17,FLM All-32: Team-by-team NFL notes
WMB,Williams Companies Inc,2018-12-17,Yeareneder: Djokovic back on top as old guard refuse to let go
WMB,Williams Companies Inc,2018-12-17,Yearender: Hamilton and Mercedes shift from fourth to fifth
WMB,Williams Companies Inc,2018-12-17,Ravens use schedule as motivator again
WMB,Williams Companies Inc,2018-12-17,WTA increases rankings protection for returning mothers
WMB,Williams Companies Inc,2018-12-17,NFL roundup: Steelers knock off Brady  Patriots
WMB,Williams Companies Inc,2018-12-16,No-Deal Brexit Fears Take Heavy Toll on U.K. Housing Market
WMB,Williams Companies Inc,2018-12-16,Footgolf: Argentina's Perrone crowned world champion
WMB,Williams Companies Inc,2018-12-21,Nasdaq confirms bear market; economic worries sink Wall Street
WMB,Williams Companies Inc,2018-12-21,Exclusive: City Financial's hedge fund Decca to shut down - letter
WMB,Williams Companies Inc,2018-12-21,Williams soothes markets  says Fed listening and could change policy
WMB,Williams Companies Inc,2018-12-21,Junk Bonds Endure an Awful Day But Live to Tell About It
WMB,Williams Companies Inc,2018-12-21,The Fed Needs a Little Push From the Data for a Pause
WMB,Williams Companies Inc,2018-12-21,The Sinclair POCO: Build your own and start gaming
WMB,Williams Companies Inc,2018-12-20,Take 5: Steelers-Saints center stage in Week 16
WMB,Williams Companies Inc,2018-12-20,Top 25 roundup: NC State upsets No. 7 Auburn
WMB,Williams Companies Inc,2018-12-19,Season over for Redskins DB Nicholson after arrest
WMB,Williams Companies Inc,2018-12-18,Penny Marshall  'Big' director and TV's 'Laverne ' dead at 75
WMB,Williams Companies Inc,2018-12-29,NBA roundup: Davis pours in 48 as Pelicans edge Mavs
WMB,Williams Companies Inc,2018-12-28,NFL notebook: Steelers could be without Brown for finale
WMB,Williams Companies Inc,2018-12-28,Bills DT Williams to retire after season finale
WMB,Williams Companies Inc,2018-12-28,Amos Oz  author who chronicled Israel's struggles  dead at 79
WMB,Williams Companies Inc,2018-12-27,NBA roundup: Leonard  Raptors ends Heat’s win streak
WMB,Williams Companies Inc,2018-12-24,College football notebook: Alabama suspends three ahead of CFP semifinal
WMB,Williams Companies Inc,2018-12-24,Redskins release Swearinger after critical comments
WMB,Williams Companies Inc,2018-12-24,NFL roundup: Saints hold off Steelers  clinch home field
WMB,Williams Companies Inc,2018-12-23,Top 25 roundup: No. 18 Arizona State stuns No. 1 Kansas
WMB,Williams Companies Inc,2018-12-22,NBA roundup: Ailing LeBron nets triple-double
WMB,Williams Companies Inc,2019-01-02,NBA roundup: Leonard scores 45 as Raptors top Jazz
WMB,Williams Companies Inc,2019-01-01,Federer  Serena click 'greatest selfie of all time' after dream clash
WMB,Williams Companies Inc,2019-01-01,Federer emerges victorious in historic clash with Serena
WMB,Williams Companies Inc,2019-01-01,Bowl roundup: Oklahoma State drops No. 23 Missouri
WMB,Williams Companies Inc,2018-12-31,Serena wins return in Hopman Cup
WMB,Williams Companies Inc,2018-12-31,Dorsey: Williams  Kitchens among Browns HC candidates
WMB,Williams Companies Inc,2018-12-31,Serena wins on return but U.S. lose Hopman Cup opener
WMB,Williams Companies Inc,2018-12-31,Israel jails Palestinian for Briton's killing  says is mentally ill
WMB,Williams Companies Inc,2018-12-30,Fed Chair Powell's unscripted approach sets up for rocky 2019
WMB,Williams Companies Inc,2018-12-30,Top 25 roundup: Western Kentucky stuns No. 15 Wisconsin
WMB,Williams Companies Inc,2019-01-06,Tennis: Goerges rallies past teen Andreescu to retain Auckland title
WMB,Williams Companies Inc,2019-01-06,NBA roundup: Curry  Warriors win 3-pointer battle with Kings
WMB,Williams Companies Inc,2019-01-05,WTA roundup: Pliskova into Brisbane final
WMB,Williams Companies Inc,2019-01-05,NBA roundup: Celtics rip Mavs wire-to-wire
WMB,Williams Companies Inc,2019-01-04,NFL coaching carousel: Packers reportedly to interview Gase
WMB,Williams Companies Inc,2019-01-04,WTA roundup: Pliskova into Brisbane semis
WMB,Williams Companies Inc,2019-01-04,NHL roundup: Habs' Price returns  blanks Canucks
WMB,Williams Companies Inc,2019-01-03,U.S. judge orders Ed Sheeran to face Marvin Gaye plagiarism lawsuit
WMB,Williams Companies Inc,2019-01-03,Federer beats Tsitsipas to send Switzerland into Hopman Cup final
WMB,Williams Companies Inc,2019-01-03,Serena Williams to take Bumble's woman-first message to Super Bowl
WMB,Williams Companies Inc,2019-01-10,Reports: Williams among Jets DC candidates
WMB,Williams Companies Inc,2019-01-09,Serena's legacy secure despite infamous U.S. Open umpire row: Evert
WMB,Williams Companies Inc,2019-01-09,Djokovic  Federer  Serena remain favorites to win opening Grand Slam
WMB,Williams Companies Inc,2019-01-09,NHL roundup: Vasilevskiy  Lightning blank Jackets
WMB,Williams Companies Inc,2019-01-08,Reports: Browns eye Kitchens  Stefanski in HC search
WMB,Williams Companies Inc,2019-01-07,NFL notebook: Arians reportedly to become Buccaneers' coach
WMB,Williams Companies Inc,2019-01-07,NHL roundup: Pacioretty wins it again as Knights edge Devils
WMB,Williams Companies Inc,2019-01-07,NBA roundup: Raptors down Pacers without Leonard
WMB,Williams Companies Inc,2019-01-06,WTA roundup: Pliskova rallies for second Brisbane title
WMB,Williams Companies Inc,2019-01-06,Nishikori  Pliskova crowned Brisbane International champions
WMB,Williams Companies Inc,2019-01-12,Cleveland officially names Kitchens as coach
WMB,Williams Companies Inc,2019-01-12,Former banking executive Walter Shipley dead at 83: JPMorgan Chase
WMB,Williams Companies Inc,2019-01-12,NHL roundup: Penguins rally past Ducks
WMB,Williams Companies Inc,2019-01-12,Tennis: Kerber feels solid again with new coach Schuettler
WMB,Williams Companies Inc,2019-01-11,Leaner  mature Osaka stays grounded in Melbourne
WMB,Williams Companies Inc,2019-01-11,Top Picks 2019- Innovative Industrial Properties IIPR
WMB,Williams Companies Inc,2019-01-11,NHL roundup: Flyers end 8-game slide
WMB,Williams Companies Inc,2019-01-11,Serena still the force on Melbourne return
WMB,Williams Companies Inc,2019-01-11,NBA roundup: Aldridge's 56 lead Spurs past Thunder in 2 OTs
WMB,Williams Companies Inc,2019-01-10,Serena mentor sees no crackdown on courtside coaching
WMB,Williams Companies Inc,2019-01-14,Pompeo meets Saudi leaders  cancels Kuwait visit
WMB,Williams Companies Inc,2019-01-14,NHL roundup: Islanders jump on Lightning early in win
WMB,Williams Companies Inc,2019-01-13,CEO exits as PG&E faces fire liabilities  bankruptcy preparations
WMB,Williams Companies Inc,2019-01-13,Saints hunt another Super Bowl after ending Eagles long run
WMB,Williams Companies Inc,2019-01-13,PG&E CEO to Leave With Utility at Brink of Bankruptcy
WMB,Williams Companies Inc,2019-01-13,PG&E could tell workers about possible bankruptcy as soon as Monday - report
WMB,Williams Companies Inc,2019-01-13,Economic Calendar - Top 5 Things to Watch This Week
WMB,Williams Companies Inc,2019-01-13,Israel claims Syria air strike  says hunt for Hezbollah tunnels over
WMB,Williams Companies Inc,2019-01-13,Serena ready to claim first Slam as a mum: coach
WMB,Williams Companies Inc,2019-01-12,NFL notebook: Fitzgerald pondering Cardinals return
WMB,Williams Companies Inc,2019-01-16,PG&E to get pulled out of S&P 500  shares near 2001 lows
WMB,Williams Companies Inc,2019-01-16,Back where it all began  Djokovic renews Tsonga rivalry
WMB,Williams Companies Inc,2019-01-15,NFL notebook: Eagles still committed to Wentz
WMB,Williams Companies Inc,2019-01-15,Osaka clubs her way into Australian Open second round
WMB,Williams Companies Inc,2019-01-15,Venus Williams secures come-from-behind win
WMB,Williams Companies Inc,2019-01-15,Ruthless Serena makes strong start in Melbourne return
WMB,Williams Companies Inc,2019-01-15,No clear path for California as massive PG&E utility nears bankruptcy
WMB,Williams Companies Inc,2019-01-14,PG&E Bailout Hopes Are Crushed With California Showing Little Interest
WMB,Williams Companies Inc,2019-01-14,PG&E prepares bankruptcy filing after California wildfires
WMB,Williams Companies Inc,2019-01-14,Tennis: Halep faces tricky test against Kanepi in Melbourne opener
WMB,Williams Companies Inc,2019-01-17,Take five: Conference championship keys
WMB,Williams Companies Inc,2019-01-17,UK's Prince Philip  97  escapes unhurt from car crash
WMB,Williams Companies Inc,2019-01-17,In third year  U.S. women's marches turn to 2020 elections
WMB,Williams Companies Inc,2019-01-17,Ex-Symantec executive Canellos joins Ericom Software as CEO
WMB,Williams Companies Inc,2019-01-17,Halep hopes tough matches will provide route to rhythm
WMB,Williams Companies Inc,2019-01-17,Serena juggles business  motherhood before beating Bouchard
WMB,Williams Companies Inc,2019-01-17,Tennis: Top seed Halep digs deep against impressive Kenin to advance
WMB,Williams Companies Inc,2019-01-17,NBA roundup: Nets shock Harden  Rockets in OT
WMB,Williams Companies Inc,2019-01-17,Graf backs Williams to surpass Court's Grand Slam record
WMB,Williams Companies Inc,2019-01-16,NFL notebook: Steelers don't expect Brown return
WMB,Williams Companies Inc,2019-01-20,Unseeded Collins and Tiafoe make quarters on 'Super Sunday'
WMB,Williams Companies Inc,2019-01-20,NBA roundup: George  Thunder edge Sixers in thriller
WMB,Williams Companies Inc,2019-01-19,Top seed Halep marches on with clinical win over Venus
WMB,Williams Companies Inc,2019-01-19,Serena consoles Ukrainian teen after sailing into last 16
WMB,Williams Companies Inc,2019-01-18,S&P 500 Relief Rally is Exhausted
WMB,Williams Companies Inc,2019-01-18,Studious Shapovalov hopes Nadal videos can help topple Djokovic
WMB,Williams Companies Inc,2019-01-18,Fed's Williams says rate policy must be patient  data dependent
WMB,Williams Companies Inc,2019-01-18,Stocks - U.S. Futures Lifted by Trade Hopes
WMB,Williams Companies Inc,2019-01-17,MGM hands board seat to activist hedge fund Corvex's Meister
WMB,Williams Companies Inc,2019-01-17,U.S. appeals court will not delay net neutrality case
WMB,Williams Companies Inc,2019-01-23,Plucky Pliskova stuns Serena with epic Australian Open fightback
WMB,Williams Companies Inc,2019-01-22,Trading in the Dark- 24 Economic Reports Delayed & One that Came in Strong
WMB,Williams Companies Inc,2019-01-22,Explainer: U.S. government shutdown leaves data vacuum in its wake
WMB,Williams Companies Inc,2019-01-22,Taco Bell's first Thailand outlet to serve spicy fare and local beer
WMB,Williams Companies Inc,2019-01-22,Battling Nishikori faces big test against bugbear Djokovic
WMB,Williams Companies Inc,2019-01-21,Serena edges top seed Halep to reach last eight
WMB,Williams Companies Inc,2019-01-21,Pliskova pounds Muguruza to reach quarters
WMB,Williams Companies Inc,2019-01-21,Inspired by young guns  Osaka marches on in Melbourne
WMB,Williams Companies Inc,2019-01-21,NBA roundup: Wolves' Rose beats buzzer to bury Suns
WMB,Williams Companies Inc,2019-01-20,Halep not intimidated by Serena ahead of Melbourne showdown
WMB,Williams Companies Inc,2019-01-24,Kvitova on the brink of crowning brave comeback
WMB,Williams Companies Inc,2019-01-24,Osaka digs deep against Pliskova to set up Kvitova final
WMB,Williams Companies Inc,2019-01-24,Australian Open run was no 'fluke'  says Collins
WMB,Williams Companies Inc,2019-01-24,Top 25 roundup: No. 1 Vols edge Vandy in OT
WMB,Williams Companies Inc,2019-01-23,U.S. government shutdown to crimp growth  recession risk steady: Reuters poll
WMB,Williams Companies Inc,2019-01-23,Saints cornerback Williams charged with drunk driving
WMB,Williams Companies Inc,2019-01-23,Top Picks 2019- EVIO EVIO
WMB,Williams Companies Inc,2019-01-23,Taco Bell eyes Asia-Pacific to drive overseas expansion
WMB,Williams Companies Inc,2019-01-23,Osaka reaches Melbourne semis for first time
WMB,Williams Companies Inc,2019-01-23,Shutdown Deprives Data-Dependent Fed of Data It's Dependent On
WMB,Williams Companies Inc,2019-01-27,Top 25 roundup: No. 8 Kentucky stops Kansas  extends home streak
WMB,Williams Companies Inc,2019-01-26,NBA notebook: LeBron in full-contact drills  but won't play Sunday
WMB,Williams Companies Inc,2019-01-26,Osaka edges Kvitova to claim Australian Open crown
WMB,Williams Companies Inc,2019-01-26,NBA roundup: Harden extends streak  Rockets stop Raptors
WMB,Williams Companies Inc,2019-01-25,Motor racing: Zanardi looks ahead with realistic expectations
WMB,Williams Companies Inc,2019-01-25,Osaka  Kvitova chase double delight in Melbourne final
WMB,Williams Companies Inc,2019-01-25,Top 25 roundup: No. 6 Michigan State avoids upset at No. 19 Iowa
WMB,Williams Companies Inc,2019-01-25,Australia divided: thousands expected to protest Australia Day legacy
WMB,Williams Companies Inc,2019-01-25,Tennis: Fit  focused Osaka has 'upper hand' against Kvitova - coach
WMB,Williams Companies Inc,2019-01-24,Global economy in real danger if U.S.-China trade war escalates: Reuters poll
WMB,Williams Companies Inc,2019-03-14,Superdry founder urges shareholders to vote him to board
WMB,Williams Companies Inc,2019-03-13,NFL transactions notebook: NT Mebane agrees to deal with Chargers
