code,company,date,text
CSCO,Cisco Systems Inc,2017-06-13,U.S. stocks higher at close of trade; Dow Jones Industrial Average up 0.44%
CSCO,Cisco Systems Inc,2017-06-13,Tech companies with overseas cash could benefit from Trump tax plan
CSCO,Cisco Systems Inc,2017-06-13,Hyundai Motor bets on new small SUV as China sales skid
CSCO,Cisco Systems Inc,2017-06-12,Exclusive - Foxconn says Apple  Dell join its bid for Toshiba chip business
CSCO,Cisco Systems Inc,2017-06-12,Foxconn confirms Apple in Toshiba bid  hints at others
CSCO,Cisco Systems Inc,2015-10-08,Amazon launches platform to build apps for 'Internet of Things'
CSCO,Cisco Systems Inc,2015-10-06,Cisco security researchers disable big distributor of 'ransomware'
CSCO,Cisco Systems Inc,2015-10-05,U.S. stocks higher at close of trade; Dow Jones Industrial Average up 1.85%
CSCO,Cisco Systems Inc,2015-10-02,U.S. stocks higher at close of trade; Dow Jones Industrial Average up 1.23%
CSCO,Cisco Systems Inc,2015-10-01,U.S. stocks mixed  as poor global manufacturing data weighs 
CSCO,Cisco Systems Inc,2015-09-25,U.S. stocks mixed as Nike boosts Dow  biotech's weigh on NASDAQ  S&P 500
CSCO,Cisco Systems Inc,2015-09-25,U.S. stocks mixed at close of trade; Dow Jones Industrial Average up 0.70%
CSCO,Cisco Systems Inc,2015-09-17,BlackBerry CEO sees company patents as key to turnaround strategy
CSCO,Cisco Systems Inc,2015-09-16,Cisco router break-ins bypass cyber defenses
CSCO,Cisco Systems Inc,2015-09-16,Apple faces hurdles as it positions iPad Pro for business use
CSCO,Cisco Systems Inc,2013-05-10,U.S stocks rise on jobs data  hopes stimulus to stay; Dow gains 0.24%
CSCO,Cisco Systems Inc,2013-05-07,U.S stocks hit record highs on German factory data; Dow rises 0.58%
CSCO,Cisco Systems Inc,2013-05-02,U.S stocks gain on falling jobless claims  ECB rate cut; Dow rises 0.89%
CSCO,Cisco Systems Inc,2013-05-01,U.S stocks ignore Fed and dive on weak data; Dow loses 0.94%
CSCO,Cisco Systems Inc,2013-04-25,U.S stocks rise on falling jobless claims; Dow gains 0.17%
CSCO,Cisco Systems Inc,2013-04-24,U.S stocks close flat to lower on earnings; Dow dips 0.29%
CSCO,Cisco Systems Inc,2013-04-10,U.S. stocks rise on hopes for solid earnings  recovery; Dow gains 0.88%
CSCO,Cisco Systems Inc,2013-04-05,U.S. stocks fall on dismal March jobs report; Dow ends down 0.28%
CSCO,Cisco Systems Inc,2013-04-04,U.S. stocks inch up on hopes for solid jobs report; Dow ends up 0.38%
CSCO,Cisco Systems Inc,2013-04-02,U.S. stocks gain on hopes for more robust recovery; Dow ends up 0.61%
CSCO,Cisco Systems Inc,2018-10-22,U.S. stocks mixed at close of trade; Dow Jones Industrial Average down 0.50%
CSCO,Cisco Systems Inc,2018-10-16,MarketPulse: Tech Stocks on a Tear
CSCO,Cisco Systems Inc,2018-10-15,U.S. stocks lower at close of trade; Dow Jones Industrial Average down 0.35%
CSCO,Cisco Systems Inc,2018-10-12,U.S. stocks higher at close of trade; Dow Jones Industrial Average up 1.15%
CSCO,Cisco Systems Inc,2018-10-12,Cisco Rises 3%
CSCO,Cisco Systems Inc,2018-10-11,Cisco Falls 3%
CSCO,Cisco Systems Inc,2018-10-11,India to raise import tariffs on electronic and communication items
CSCO,Cisco Systems Inc,2018-10-10,Cisco Falls 3%
CSCO,Cisco Systems Inc,2018-10-08,U.S. stocks mixed at close of trade; Dow Jones Industrial Average up 0.15%
CSCO,Cisco Systems Inc,2018-10-08,Consolidated Comms expands ProConnect UC offering
CSCO,Cisco Systems Inc,2018-02-05,Apple  Cisco team up with insurance companies to offer cyber policy discounts
CSCO,Cisco Systems Inc,2018-02-02,Cisco cuts stake in litigation opponent Finjan to zero
CSCO,Cisco Systems Inc,2018-02-02,Cisco absorbs BroadSoft
CSCO,Cisco Systems Inc,2018-01-31,Slack adds Target  BBC  E*Trade as clients in enterprise push
CSCO,Cisco Systems Inc,2018-01-30,Juniper Networks' first-quarter forecast disappoints  shares slide
CSCO,Cisco Systems Inc,2018-01-30,On Closer Inspection Your Blockchain ETF May Just Be a Tech Fund
CSCO,Cisco Systems Inc,2018-01-29,Trump team idea to nationalize 5G network to counter China is rejected
CSCO,Cisco Systems Inc,2018-01-29,Trump team weighs nationalizing 5G
CSCO,Cisco Systems Inc,2018-01-25,Dow Jones Closes at Record High as Bullish Earnings Continue To Drive Rally
CSCO,Cisco Systems Inc,2018-01-25,U.S. stocks mixed at close of trade; Dow Jones Industrial Average up 0.37%
