company,date,text
Microsoft Corporation (MSFT),2018-03-20,Amazon is now second most valuable U.S.-listed company  tops Alphabet
Microsoft Corporation (MSFT),2018-03-20,BlackBerry shares rise after software security pact with Microsoft
Microsoft Corporation (MSFT),2018-03-20,Stocks- Wall Street Rises as Investors Look Ahead to the Fed
Microsoft Corporation (MSFT),2018-03-20,Japanese researchers seek to unmask Draghi's poker face to predict policy changes
Microsoft Corporation (MSFT),2018-03-20,Stocks- U.S. Futures Mixed as Facebook Data Leak  Trade War Weighs
Microsoft Corporation (MSFT),2018-03-20,China Pledges Action on Tech Transfer as Trump Plans Tariff Hit
Microsoft Corporation (MSFT),2018-03-19,Dropbox IPO oversubscribed: sources
Microsoft Corporation (MSFT),2018-03-19,Corporate America Warns Trump Against Broad-Based China Tariffs
Microsoft Corporation (MSFT),2018-03-19,BlackBerry +5% on enterprise partnership with Microsoft
Microsoft Corporation (MSFT),2018-03-19,Tech stocks wobble in U.S.; some investors worry party is ending
Microsoft Corporation (MSFT),2018-03-22,Facebook scandal could push other tech companies to tighten data sharing
Microsoft Corporation (MSFT),2018-03-22,Tencent shares slide after revenue miss and margin warning
Microsoft Corporation (MSFT),2018-03-21,U.S. spending bill includes bid to solve international email privacy impasse
Microsoft Corporation (MSFT),2018-03-21,Slack Technologies builds engineering team to combat outages
Microsoft Corporation (MSFT),2018-03-21,U.S. investment trusts gobble assets; retirement plans retreat from active funds
Microsoft Corporation (MSFT),2018-03-21,More analysts weigh in on Salesforce's MuleSoft purchase
Microsoft Corporation (MSFT),2018-03-21,Dropbox raises IPO price range by $2 on strong demand
Microsoft Corporation (MSFT),2018-03-21,Tencent to invest more in video  payment after profit beats estimates
Microsoft Corporation (MSFT),2018-03-20,Videogame sales build on 2018 with 23% February gains
Microsoft Corporation (MSFT),2018-03-20,Blackstone co-founder Peter Peterson dies  aged 91
Microsoft Corporation (MSFT),2018-03-05,IBM settles legal dispute with diversity officer hired by Microsoft
Microsoft Corporation (MSFT),2018-03-05,Amazon confirms acquiring GameSparks
Microsoft Corporation (MSFT),2018-03-05,Microsoft launching on-premise Azure for governments
Microsoft Corporation (MSFT),2018-03-05,Microsoft to offer governments local version of Azure cloud service
Microsoft Corporation (MSFT),2018-03-02,Microsoft buying output from Singapore clean energy project
Microsoft Corporation (MSFT),2018-03-02,Toyota venture to spend $2.8 billion to develop self-driving technology
Microsoft Corporation (MSFT),2018-03-01,Zuckerberg sold nearly $500 million Facebook stock in February
Microsoft Corporation (MSFT),2018-03-01,Axios: Microsoft's Cortana gets new leader
Microsoft Corporation (MSFT),2018-02-28,Microsoft to buy solar power in Singapore in first renewable deal in Asia
Microsoft Corporation (MSFT),2018-02-28,Google's shopping rivals call for action from EU antitrust watchdog
Microsoft Corporation (MSFT),2018-02-28,Alphabet roundup: Google launches Slack competitor  snippets; Waymo does demo
Microsoft Corporation (MSFT),2018-02-28,Google launches Slack competitor Hangouts Chat
Microsoft Corporation (MSFT),2018-02-28,Microsoft pushes into healthcare with new Azure tool  cloud blueprints
Microsoft Corporation (MSFT),2018-02-28,Facebook expands presence in jobs market
Microsoft Corporation (MSFT),2018-02-27,Apple roundup: Ireland must collect back taxes  new series  and potential new hire
Microsoft Corporation (MSFT),2018-02-27,Supreme Court seems split on Microsoft data case
Microsoft Corporation (MSFT),2018-02-27,Supreme Court wrestles with Microsoft data privacy fight
Microsoft Corporation (MSFT),2018-02-27,Ten Most Popular Hedge Fund Stocks 
Microsoft Corporation (MSFT),2018-02-27,Google not obligated to vet websites  German court rules
Microsoft Corporation (MSFT),2018-02-27,Microsoft privacy case heads to Supreme Court
Microsoft Corporation (MSFT),2018-02-23,Microsoft and Xiaomi will collaborate on cloud  AI  and hardware
Microsoft Corporation (MSFT),2018-02-23,The 10 Largest U.S. Companies By Market Capitalization 
Microsoft Corporation (MSFT),2018-02-23,'Australia's Warren Buffet' quits as head of fund management firm
Microsoft Corporation (MSFT),2018-02-22,Intel did not tell U.S. cyber officials about chip flaws until made public
Microsoft Corporation (MSFT),2018-02-22,Intel collaborates with PC makers for 5G connection
Microsoft Corporation (MSFT),2018-02-21,Videogame sales jump 59% to best January in seven years
Microsoft Corporation (MSFT),2018-02-20,U.S. stocks lower at close of trade; Dow Jones Industrial Average down 1.01%
Microsoft Corporation (MSFT),2018-02-20,Walmart halts Dow's six-day rally; S&P edges higher
Microsoft Corporation (MSFT),2018-02-19,Amazon got bigger than Microsoft by beating it at its own game
Microsoft Corporation (MSFT),2018-02-18,Global dividends hit record of $1.25 trillion in 2017  more to come
Microsoft Corporation (MSFT),2018-02-27,Norway's wealth fund doubles return in 2017 as stock market booms
Microsoft Corporation (MSFT),2018-02-26,Telaria down 22% on Q4 results
Microsoft Corporation (MSFT),2018-02-26,U.S. appeals court says Title VII covers discrimination based on sexual orientation
Microsoft Corporation (MSFT),2018-02-26,U.S. Supreme Court weighs Microsoft overseas data fight
Microsoft Corporation (MSFT),2018-02-26,Supreme Court will decide on Microsoft data case by June
Microsoft Corporation (MSFT),2018-02-26,Europe seeks power to seize overseas data in challenge to tech giants
Microsoft Corporation (MSFT),2018-02-25,Nokia phones look to the future  and to the past
Microsoft Corporation (MSFT),2018-02-24,Venture capital deals of the week
Microsoft Corporation (MSFT),2018-02-23,Dropbox files for IPO of up to $500 million
Microsoft Corporation (MSFT),2018-02-23,U.S. stocks higher at close of trade; Dow Jones Industrial Average up 1.39%
Microsoft Corporation (MSFT),2018-02-16,Exclusive: Walmart in talks to buy more than 40 percent of India's Flipkart - sources
Microsoft Corporation (MSFT),2018-02-16,Walmart in talks for major Flipkart stake
Microsoft Corporation (MSFT),2018-02-14,IBM lawsuit casts diversity in starkly competitive terms
Microsoft Corporation (MSFT),2018-02-14,Rise of the data protection officer  the hottest tech ticket in town
Microsoft Corporation (MSFT),2018-02-14,Walmart goes to the cloud to close gap with Amazon
Microsoft Corporation (MSFT),2018-02-13,Microsoft builds up Teams with Chalkup tech
Microsoft Corporation (MSFT),2018-02-13,IBM sues former exec moving to Microsoft
Microsoft Corporation (MSFT),2018-02-13,IBM sues former HR boss hired by Microsoft
Microsoft Corporation (MSFT),2018-02-13,Stocks- Volatility Continues to Shake Up Wall Street
Microsoft Corporation (MSFT),2018-02-12,Google hires former Samsung executive to coordinate Internet of Things projects
Microsoft Corporation (MSFT),2018-02-12,Twilio +2.6% after appointing Chief Partners Officer
Microsoft Corporation (MSFT),2018-02-09,Wall Street rebounds but posts worst week in two years
Microsoft Corporation (MSFT),2018-02-09,U.S. stocks higher at close of trade; Dow Jones Industrial Average up 1.38%
Microsoft Corporation (MSFT),2018-02-09,Dow Jones 830 Point Comeback Fails To Prevent Biggest Weekly Drop in 2 Years
Microsoft Corporation (MSFT),2018-02-09,Frenzied demand for Nvidia's graphic chips shoot prices through the roof
Microsoft Corporation (MSFT),2018-02-09,Sanctions bolstering Russian IT sector  IBS Group CEO says
Microsoft Corporation (MSFT),2018-02-08,Salesforce investing $2 billion in Canada  as U.S. tech firms head north
Microsoft Corporation (MSFT),2018-02-08,Nvidia's upbeat forecast powered by data center  cryptocurrency demand
Microsoft Corporation (MSFT),2018-02-08,Internet firms back congressional vote to restore net neutrality rules
Microsoft Corporation (MSFT),2018-02-08,Microsoft Build scheduled for May 7 to 9  overlaps with Google I/O
Microsoft Corporation (MSFT),2018-02-08,Market cap wars: Amazon aims for No. 3 spot
Microsoft Corporation (MSFT),2018-02-07,U.S. stocks lower at close of trade; Dow Jones Industrial Average down 0.08%
Microsoft Corporation (MSFT),2018-02-07,Dow Reverses Gains Closes Lower as Soaring Bond Yields Spook Investors
Microsoft Corporation (MSFT),2018-02-07,Amazon's market value on verge of beating out Microsoft
Microsoft Corporation (MSFT),2018-02-07, For Crypto Investing Fans  Blockchain ETFs Will Have To Do 
Microsoft Corporation (MSFT),2018-02-06,Microsoft's free offer for Google  Box customers
Microsoft Corporation (MSFT),2018-02-06,Argus raises Microsoft target to 22% upside
Microsoft Corporation (MSFT),2018-02-06,Dividend plays on slippery ground as bond yields steepen
Microsoft Corporation (MSFT),2018-02-06,Stocks-  Wall Street Set To Tumble as Sell-Off Continues
Microsoft Corporation (MSFT),2018-02-05,U.S. tax overhaul may drain $2 trillion from foreign projects: U.N.
Microsoft Corporation (MSFT),2018-03-13,Microsoft reportedly opens two German data centers
Microsoft Corporation (MSFT),2018-03-13,Microsoft opens two data centers in Germany: reports
Microsoft Corporation (MSFT),2018-03-13,Microsoft in spotlight over harassment complaints
Microsoft Corporation (MSFT),2018-03-13,Microsoft women filed 238 discrimination and harassment complaints: court documents
Microsoft Corporation (MSFT),2018-03-12,Microsoft declares $0.42 dividend
Microsoft Corporation (MSFT),2018-03-12,Dropbox IPO price range puts valuation nearly a third below peak
Microsoft Corporation (MSFT),2018-03-12,Conservative commentator Kudlow a contender to replace Cohn: source
Microsoft Corporation (MSFT),2018-03-12,Microsoft: 200K organizations now use Teams
Microsoft Corporation (MSFT),2018-03-12,Microsoft touts progress of chat app Teams in battle with Slack
Microsoft Corporation (MSFT),2018-03-12,Top 5 Things to Know in the Market on Monday
Microsoft Corporation (MSFT),2018-02-01,Big results expected from 'Big Tech'
Microsoft Corporation (MSFT),2018-02-01,Top 5 Things to Know in the Market on Thursday
Microsoft Corporation (MSFT),2018-02-01,Google's G Suite is no Microsoft killer  but still winning converts
Microsoft Corporation (MSFT),2018-01-31,Microsoft's cloud computing business grows  stock edges up
Microsoft Corporation (MSFT),2018-01-31,Microsoft -1.3% despite Q2 beats  98% Azure growth
Microsoft Corporation (MSFT),2018-01-31,U.S. stocks higher at close of trade; Dow Jones Industrial Average up 0.28%
Microsoft Corporation (MSFT),2018-01-31,US Stocks Rebound to Close Higher; Tech Earnings Eyed
Microsoft Corporation (MSFT),2018-01-31,Options traders see outsized stock moves on U.S. tech results
Microsoft Corporation (MSFT),2018-01-31,Analyst color on AMD's earnings report
Microsoft Corporation (MSFT),2018-01-31,Slack adds Target  BBC  E*Trade as clients in enterprise push
Microsoft Corporation (MSFT),2018-02-02,Dow sees worst day in two years as bond yields jump
Microsoft Corporation (MSFT),2018-02-02,Dell says it will explore IPO or merger with VMware
Microsoft Corporation (MSFT),2018-02-02,Amazon stock market value on verge of eclipsing Microsoft
Microsoft Corporation (MSFT),2018-02-02,Exclusive: Dell  VMware decide to explore options including merger - sources
Microsoft Corporation (MSFT),2018-02-01,Amazon posts largest profit in its history on sales  tax boost
Microsoft Corporation (MSFT),2018-02-01,Dow Jones Ekes Out Gains; Alphabet Misses Earnings  Beats Revenue
Microsoft Corporation (MSFT),2018-02-01,Analysts raise Microsoft price targets after earnings
Microsoft Corporation (MSFT),2018-02-01,WSJ: Alphabet  Aramco planning data centers in Saudi Arabia
Microsoft Corporation (MSFT),2018-02-01,Microsoft Q3 guidance beats revenue estimates
Microsoft Corporation (MSFT),2018-02-01,MSCI beats by $0.15  beats on revenue
Microsoft Corporation (MSFT),2018-01-29,Top 5 Things to Know in the Market on Monday
Microsoft Corporation (MSFT),2018-01-29,Tech stocks reach record  bond yields rise again
Microsoft Corporation (MSFT),2018-01-28,Economic Calendar - Top 5 Things to Watch This Week
Microsoft Corporation (MSFT),2018-01-27,Venture capital deals of the week
Microsoft Corporation (MSFT),2018-01-26,Take Five: World markets themes for the week ahead
Microsoft Corporation (MSFT),2018-01-26,Trump Says `America First' Will Benefit World in Davos Speech
Microsoft Corporation (MSFT),2018-01-26,Dell considering acquisitions or possible IPO:  sources
Microsoft Corporation (MSFT),2018-01-25,Intel data center sales surge  warns of potential security flaw fallout
Microsoft Corporation (MSFT),2018-01-24,Alphabet unveils business unit devoted to cyber security
Microsoft Corporation (MSFT),2018-01-24,Nomura initiates Microsoft with 11% upside
Microsoft Corporation (MSFT),2018-01-31,Stocks-  U.S. Futures Rise Ahead of Yellen’s Last Fed Meeting
Microsoft Corporation (MSFT),2018-01-31,Top 5 Things to Know in the Market on Wednesday
Microsoft Corporation (MSFT),2018-01-31,Walmart in talks to buy minority stake in India's Flipkart - report
Microsoft Corporation (MSFT),2018-01-30,Notable earnings after Wednesday’s close
Microsoft Corporation (MSFT),2018-01-30,Microsoft update disables Spectre patch
Microsoft Corporation (MSFT),2018-01-29,Microsoft issues update to disable Intel's buggy Spectre patch
Microsoft Corporation (MSFT),2018-01-29,India's Ola eyes Australia market in tussle with global rival Uber
Microsoft Corporation (MSFT),2018-01-29,Microsoft acquires backend game platform provider for Azure
Microsoft Corporation (MSFT),2018-01-29,Economic Calendar: Top Things to Watch 
Microsoft Corporation (MSFT),2018-01-29,Stocks - U.S. Futures Pull Back From Record Highs in Key Week for Earnings  Data
Microsoft Corporation (MSFT),2018-01-23,PlayStation  Xbox vet Phil Harrison joins Google
Microsoft Corporation (MSFT),2018-01-23,Former Xbox exec Phil Harrison joins Google hardware unit
Microsoft Corporation (MSFT),2018-01-23,Space Companies Attracting Real World Investment Dollars 
Microsoft Corporation (MSFT),2018-01-23,Musk to get no salary unless Tesla hits milestones
Microsoft Corporation (MSFT),2018-01-23,U.S. cloud-computing failure could spur up to $19 billion in losses: Lloyd's
Microsoft Corporation (MSFT),2018-01-23,Microsoft could lose out if it curbs sales in Russia: minister
Microsoft Corporation (MSFT),2018-01-22,Business booms for privacy experts as landmark data law looms
Microsoft Corporation (MSFT),2018-01-22,Top Global Companies Turning to Blockchain Technology  
Microsoft Corporation (MSFT),2018-01-22,Sanctions bite: Microsoft curbs sales in Russia
Microsoft Corporation (MSFT),2018-01-22,Exclusive: U.S. sanctions curb Microsoft sales to hundreds of Russian firms
Microsoft Corporation (MSFT),2018-03-11,Trump considers ex-Microsoft exec as top economic adviser: official
Microsoft Corporation (MSFT),2018-03-09,High-performance U.S. tech stocks drive Nasdaq to record high
Microsoft Corporation (MSFT),2018-03-09,New acronym needed as Nasdaq hits all-time high
Microsoft Corporation (MSFT),2018-03-09,Agrawal takes over as CTO at Twitter
Microsoft Corporation (MSFT),2018-03-08,Twitter appoints Parag Agrawal as Chief Technology Officer
Microsoft Corporation (MSFT),2018-03-08,Hold the iPhone! Amazon primed to be larger than Apple
Microsoft Corporation (MSFT),2018-03-08,Uber hires Amazon's VP of voice shopping
Microsoft Corporation (MSFT),2018-03-08,Videogame stocks higher as White House summit eyes violence
Microsoft Corporation (MSFT),2018-03-07,Five facts on the discovery of WW2 warship 'Lady Lex'
Microsoft Corporation (MSFT),2018-03-06,Microsoft signs solar power agreement in India
Microsoft Corporation (MSFT),2018-01-17,Google changing YouTub ad programs  launches new user-friendly AI tool
Microsoft Corporation (MSFT),2018-01-17,Barclays gives IBM a double upgrade on cloud potential
Microsoft Corporation (MSFT),2018-01-17,IBM shares rise after Barclays double upgrade
Microsoft Corporation (MSFT),2018-01-17,Microsoft tops Thomson Reuters top 100 global tech leaders list
Microsoft Corporation (MSFT),2018-01-16,U.S. companies list blockchain ETFs as bitcoin proposals languish
Microsoft Corporation (MSFT),2018-01-16,BofA Tops IBM  Payments Firms With Most Blockchain Patents
Microsoft Corporation (MSFT),2018-01-16,Google building three underwater cables to expand Cloud  compete with Amazon
Microsoft Corporation (MSFT),2018-01-15,AI beats humans in Stanford reading test
Microsoft Corporation (MSFT),2018-01-13,Venture capital deals of the week
Microsoft Corporation (MSFT),2018-01-13,Las Vegas gunman emailed about bump stocks months before rampage: documents
Microsoft Corporation (MSFT),2018-01-12,Which voice in your fridge? Makers pick virtual assistants
Microsoft Corporation (MSFT),2018-01-12,Barclays increases Microsoft's price target ahead of Q2 earnings
Microsoft Corporation (MSFT),2018-01-12,Some Chinese Apple users warned by firm on dodging new data law
Microsoft Corporation (MSFT),2018-01-12,Explainer: How chip flaws Spectre  Meltdown work and what's next
Microsoft Corporation (MSFT),2018-01-11,AMD drops after admitting vulnerability to Spectre flaw
Microsoft Corporation (MSFT),2018-01-11,Microsoft brings end-to-end encryption to Skype
Microsoft Corporation (MSFT),2018-01-11,Google says its security patches not slowing down systems
Microsoft Corporation (MSFT),2018-01-11,Signal partners with Microsoft to encrypt Skype messages
Microsoft Corporation (MSFT),2018-01-11,Nvidia updates software  says graphic chips not hit by flaws
Microsoft Corporation (MSFT),2018-01-10,Buffett succession gains clarity as Berkshire promotes Abel  Jain
Microsoft Corporation (MSFT),2018-01-10,Nvidia rolling out patches for chip security flaw
Microsoft Corporation (MSFT),2018-01-10,Cloud companies consider Intel rivals after security flaws found
Microsoft Corporation (MSFT),2018-01-09,Microsoft says security patches slowing down PCs  servers
Microsoft Corporation (MSFT),2018-01-09,Wall Street climbs with boost from healthcare  banks
Microsoft Corporation (MSFT),2018-01-09,Microsoft pushes Cortana reference designs  integration potential
Microsoft Corporation (MSFT),2018-01-09,IBM tops list of U.S. patents for 25th year
Microsoft Corporation (MSFT),2018-01-09,Microsoft suspends some chip patches due to PC freezing
Microsoft Corporation (MSFT),2018-01-08,Google teams with Sony  Lenovo for smart speakers with touchscreens
Microsoft Corporation (MSFT),2018-01-06,Venture capital deals of the week
Microsoft Corporation (MSFT),2018-01-06,Stocks to watch next week
Microsoft Corporation (MSFT),2018-03-15,Investors still in love with growth stocks risk losing out on value
Microsoft Corporation (MSFT),2018-03-14,Google  Apple face EU law on business practices
Microsoft Corporation (MSFT),2018-03-14,Microsoft AI reaches human parity in Chinese-English translation
Microsoft Corporation (MSFT),2018-03-14,21Vianet and Microsoft extend cloud partnership in China
Microsoft Corporation (MSFT),2018-03-14,Microsoft will open first Middle East data centers in 2019
Microsoft Corporation (MSFT),2018-03-13,U.S. stocks lower at close of trade; Dow Jones Industrial Average down 0.68%
Microsoft Corporation (MSFT),2018-03-13,Wall Street slips after Tillerson exit
Microsoft Corporation (MSFT),2018-03-13,Trump signals Kudlow is front-runner for top economic job
Microsoft Corporation (MSFT),2018-03-13,Top Tech Stocks Of The Bull Market 
Microsoft Corporation (MSFT),2018-03-13,Finland invests $1 billion in Nokia to boost national influence
Microsoft Corporation (MSFT),2018-01-06,U.S. fund managers expect value stocks to jump in 2018
Microsoft Corporation (MSFT),2018-01-05,Businesses cautious in installing patches to fix chip flaw
Microsoft Corporation (MSFT),2018-01-05,S&P 500  Nasdaq post best week in more than a year
Microsoft Corporation (MSFT),2018-01-05,Stocks- Wall Street Rises Despite Disappointing Jobs Data
Microsoft Corporation (MSFT),2018-01-05,Intel says performance impact of security updates not significant
Microsoft Corporation (MSFT),2018-01-05,Apple to issue fix for iPhones  Macs at risk from 'Spectre' chip flaw
Microsoft Corporation (MSFT),2018-01-04,How a researcher hacked his own computer and found 'worst' chip flaw
Microsoft Corporation (MSFT),2018-01-04,Intel shares fall as investors worry about costs of chip flaw
Microsoft Corporation (MSFT),2018-01-04,Warren Buffett proclaims optimism for America's financial future
Microsoft Corporation (MSFT),2018-01-04,Coming soon: Microsoft's $319 Cortana-powered thermostat
Microsoft Corporation (MSFT),2018-01-04,FlexShares Credit-Scored US Long Corporate Bond Index Fund (LKOR) December Summary
Microsoft Corporation (MSFT),2018-01-04,Security flaws put virtually all phones  computers at risk
Microsoft Corporation (MSFT),2018-01-03,Bargain Bin: ETFs for value hunters
Microsoft Corporation (MSFT),2018-01-03,Microsoft acquiring cloud provider Avere Systems
Microsoft Corporation (MSFT),2018-01-03,BlackBerry +6% with QNX to anchor Baidu self-driving cars
Microsoft Corporation (MSFT),2018-01-03,AMD +6.7% on Intel chip flaw report
Microsoft Corporation (MSFT),2018-01-02,U.S. airport immigration computers go down temporarily: agency
Microsoft Corporation (MSFT),2017-12-29,Boeing  Caterpillar top Dow 2017 standings; GE lags far behind
Microsoft Corporation (MSFT),2017-12-28,Exclusive: Apple and Amazon in talks to set up in Saudi Arabia - sources
Microsoft Corporation (MSFT),2017-12-26,WhatsApp ending support for BlackBerry OS  Windows Phones
Microsoft Corporation (MSFT),2017-12-19,U.S. says Facebook fought off cyber attacks; Germany questions data use
Microsoft Corporation (MSFT),2017-12-19,U.S. blames North Korea for 'WannaCry' cyber attack
Microsoft Corporation (MSFT),2017-12-19,Facebook makes German marketing push as hate speech law bites
Microsoft Corporation (MSFT),2017-12-18,U.S. stocks higher at close of trade; Dow Jones Industrial Average up 0.57%
Microsoft Corporation (MSFT),2017-12-18,Dow Jones Notches 140 Points Ahead of US Tax Vote
Microsoft Corporation (MSFT),2017-12-16,Venture capital deals of the week
Microsoft Corporation (MSFT),2017-12-15,U.S. stocks higher at close of trade; Dow Jones Industrial Average up 0.58%
Microsoft Corporation (MSFT),2017-12-15,S&P 500 Closes in Record Territory on Signs of Tax Reform Progress
Microsoft Corporation (MSFT),2017-12-14,Videogame sales jump 30% from last year as holidays fire up
Microsoft Corporation (MSFT),2017-12-14,U.S. regulators ditch net neutrality rules as legal battles loom
Microsoft Corporation (MSFT),2017-12-07,EU to intervene in Microsoft's U.S. Supreme Court data protection case
Microsoft Corporation (MSFT),2017-12-06,U.S. stocks mixed at close of trade; Dow Jones Industrial Average down 0.16%
Microsoft Corporation (MSFT),2017-12-06,Dow Jones Closes Lower as Financials Weigh
Microsoft Corporation (MSFT),2017-12-06,EU urges internet companies to do more to remove extremist content
Microsoft Corporation (MSFT),2017-12-06,Wall Street flat; rise in tech stocks offsets energy lag
Microsoft Corporation (MSFT),2017-12-06,Google beats class action sex bias claims  for now
Microsoft Corporation (MSFT),2017-12-06,EU regulators threaten court challenge to EU-U.S. data transfer pact
Microsoft Corporation (MSFT),2017-12-05,Microsoft unveils laptops featuring Qualcomm chips
Microsoft Corporation (MSFT),2017-12-05,Belarus arrests suspected ringleader of global cyber crime network
Microsoft Corporation (MSFT),2017-12-04,Nasdaq Slumps as Tech Tumbles  Dow Jones Closes at Record 
Microsoft Corporation (MSFT),2017-12-08,Jony Ive back in charge of Apple design team
Microsoft Corporation (MSFT),2017-12-08,U.S. stocks higher at close of trade; Dow Jones Industrial Average up 0.49%
Microsoft Corporation (MSFT),2017-12-08,CNBC: Microsoft and Google spoke to Qualcomm against Broadcom offer
Microsoft Corporation (MSFT),2017-12-08,Dow  S&P 500 Notch Record Close as Tech Advances 
Microsoft Corporation (MSFT),2017-12-08,Cross Research upgrades TE Connectivity
Microsoft Corporation (MSFT),2017-12-08,November payrolls report lifts Wall Street
Microsoft Corporation (MSFT),2017-12-08,Evercore raises Microsoft price target  sees $1T valuation by FY21
Microsoft Corporation (MSFT),2017-12-08,U.S. tax repatriation plan may not cure long-term dollar weakness
Microsoft Corporation (MSFT),2017-12-08,Sony stays atop VR headset market
Microsoft Corporation (MSFT),2017-12-07,EU filing brief in Supreme Court case involving Microsoft data
Microsoft Corporation (MSFT),2017-12-04,Microsoft extends its NFL deal for Surface tablets
Microsoft Corporation (MSFT),2017-12-04,Tax-cut euphoria elevates Wall Street to record high
Microsoft Corporation (MSFT),2017-12-04,Money continues to rotate out of tech
Microsoft Corporation (MSFT),2017-12-04,Oppenheimer ESG Revenue ETF (ESGL) November Summary
Microsoft Corporation (MSFT),2017-12-01,Mutual Funds May Be Over Those Big FANG Names  Goldman Data Show
Microsoft Corporation (MSFT),2017-11-30,Amazon steps up pace in artificial intelligence race
Microsoft Corporation (MSFT),2017-11-30,Now hiring? Amazon says its voice aide Alexa is ready for the office
Microsoft Corporation (MSFT),2017-11-30,Microsoft declares $0.42 dividend
Microsoft Corporation (MSFT),2017-11-30,Flipkart investors  employees trimming stakes as part of SoftBank deal: sources
Microsoft Corporation (MSFT),2017-11-29,Amazon adopts open cloud technology as competition heats up
Microsoft Corporation (MSFT),2017-11-29,U.S. stocks mixed at close of trade; Dow Jones Industrial Average up 0.44%
