company,date,text
Microsoft Corporation (MSFT),2016-04-03,Bernie Sanders' ghost tweeter keeps his Brooklyn accent
Microsoft Corporation (MSFT),2016-04-01,Tech giants back EPA in climate rule legal challenge
Microsoft Corporation (MSFT),2016-04-01,Broad base can support extension of S&P 500 rally
Microsoft Corporation (MSFT),2016-04-01,Amazon  Microsoft look for big data role in self-driving cars
Microsoft Corporation (MSFT),2016-03-31,Microsoft looking to support ad blockers in Edge web browser
Microsoft Corporation (MSFT),2016-03-31,Microsoft details subscriber growth in cloud
Microsoft Corporation (MSFT),2016-03-31,World of Tanks shows Belarus potential beyond Soviet-era farms
Microsoft Corporation (MSFT),2016-03-30,Microsoft's artificial intelligence 'chatbot' messes up again on Twitter
Microsoft Corporation (MSFT),2016-03-30,Microsoft's Windows 10 reaches 270 million users  no mobile numbers
Microsoft Corporation (MSFT),2016-03-10,Bridgewater continues management transition with Rubinstein co-CEO hire
Microsoft Corporation (MSFT),2016-03-10,Former Microsoft CEO Ballmer does about-face on Linux technology
Microsoft Corporation (MSFT),2016-03-10,U.S. stocks mixed at close of trade; Dow Jones Industrial Average down 0.03%
Microsoft Corporation (MSFT),2016-03-10,Opera becomes first big browser maker with built-in ad-blocker
Microsoft Corporation (MSFT),2016-03-08,GM says shareholder groups need 3 percent stake to nominate directors
Microsoft Corporation (MSFT),2016-03-08,U.S. stocks halt five-day rally as China exports  crude sell-off weigh 
Microsoft Corporation (MSFT),2016-03-07,China says 'resolutely opposed' to U.S. export restrictions on ZTE 
Microsoft Corporation (MSFT),2016-03-07,U.S. curbs China's ZTE exports over Iran business allegations
Microsoft Corporation (MSFT),2016-03-07,Microsoft takes on Oracle  opening up database software to Linux
Microsoft Corporation (MSFT),2016-03-07,Mac ransomware caught before large number of computers infected
Microsoft Corporation (MSFT),2016-03-26,Microsoft meets with private equity over Yahoo deal
Microsoft Corporation (MSFT),2016-03-26,Microsoft apologizes for offensive tirade by its 'chatbot'  
Microsoft Corporation (MSFT),2016-03-24,Microsoft told potential Yahoo bidders it might back bids: report
Microsoft Corporation (MSFT),2016-03-24,Microsoft's AI Twitter bot goes dark after racist  sexist tweets
Microsoft Corporation (MSFT),2016-03-24,France fines Google over 'right to be forgotten'
Microsoft Corporation (MSFT),2016-03-24,Brazilian turbulence may offer value for careful stockpickers
Microsoft Corporation (MSFT),2016-03-23,Judge dismisses ex-LA Clippers owner Sterling's lawsuit vs NBA
Microsoft Corporation (MSFT),2016-03-22,The next big thing in phones may not be a phone
Microsoft Corporation (MSFT),2016-03-22,U.S. grants China's ZTE temporary export license through June 30
Microsoft Corporation (MSFT),2016-03-22,U.S. charges three Syrian hackers: Justice Department
Microsoft Corporation (MSFT),2016-03-06,U.S. Commerce Department to place restrictions on China's ZTE
Microsoft Corporation (MSFT),2016-03-05,U.S. Commerce Department to place restrictions on China's ZTE
Microsoft Corporation (MSFT),2016-03-05,Apple case exposes ongoing government rift over encryption policy
Microsoft Corporation (MSFT),2016-03-05,U.S. National Guard may join cyber offense against Islamic State: Carter
Microsoft Corporation (MSFT),2016-03-04,Police say criminals like Apple iPhones because of encryption
Microsoft Corporation (MSFT),2016-03-04,U.S. tech companies unite behind Apple ahead of iPhone encryption ruling
Microsoft Corporation (MSFT),2016-03-03,U.S. defense chief urges Congress to stick to bipartisan budget deal
Microsoft Corporation (MSFT),2016-03-03,Wall Street falls as health  tech stocks drag
Microsoft Corporation (MSFT),2016-03-03,Amazon launches two Alexa digital assistant-based gadgets
Microsoft Corporation (MSFT),2016-03-02,Privacy groups urge U.S. judge to support Apple in iPhone case
Microsoft Corporation (MSFT),2016-03-02,U.S. hi-tech energy agency chief aims to outperform Tesla
Microsoft Corporation (MSFT),2016-03-01,How Stock Market Investing Has Changed in the World of Tech Disruptions
Microsoft Corporation (MSFT),2016-02-29,N.Y. judge backs Apple in encryption fight with government
Microsoft Corporation (MSFT),2016-02-29,Judicial panel members consider legal brief in Apple case: sources
Microsoft Corporation (MSFT),2016-02-27,Dow settlement signals impact of Scalia death on class actions
Microsoft Corporation (MSFT),2016-02-25,Wall Street rallies as battered investors eye support
Microsoft Corporation (MSFT),2016-02-25,Apple calls FBI iPhone request 'unprecedented' in court filing
Microsoft Corporation (MSFT),2016-02-24,Justice Department  Silicon Valley discuss online extremism
Microsoft Corporation (MSFT),2016-02-24,Space projects lured $1.8 billion in venture capital last year: report
Microsoft Corporation (MSFT),2016-02-24,Salesforce.com faces scrutiny as Wall St frets over cloud spending
Microsoft Corporation (MSFT),2016-01-26,High-tech 'incubator' nurtures Gaza start-ups with industry's help
Microsoft Corporation (MSFT),2016-01-26,Big Pharma's bet on Big Data creates opportunities and risks
Microsoft Corporation (MSFT),2016-01-26,Robot arm sorts and stacks delicate fruits
Microsoft Corporation (MSFT),2016-01-22,Visual China buys Corbis Entertainment 
Microsoft Corporation (MSFT),2016-01-22,U.S. privacy 'ombudsman' idea floated in EU-U.S. data pact talks
Microsoft Corporation (MSFT),2016-01-20,U.S. lawmakers delay bill on European data privacy deal
Microsoft Corporation (MSFT),2016-01-20,News Corp denies rumors of Twitter bid
Microsoft Corporation (MSFT),2016-01-20,EU wants stricter controls over U.S. snooping powers in data pact talks
Microsoft Corporation (MSFT),2016-01-20,IBM's gloomy forecast weighs down shares
Microsoft Corporation (MSFT),2016-01-20,Here come the robots: Davos bosses brace for big technology shocks
Microsoft Corporation (MSFT),2016-02-03,Cisco to pay $1.4 billion for Internet of Things firm Jasper
Microsoft Corporation (MSFT),2016-02-03,Apple ordered to pay $625 million in patent dispute with VirnetX
Microsoft Corporation (MSFT),2016-02-01,Nokia patent sales forecast falls short after Samsung deal
Microsoft Corporation (MSFT),2016-01-29,Apple building secret team to work on virtual reality: FT
Microsoft Corporation (MSFT),2016-01-29,Wall St. up as weak GDP spurs hope of slower rate hikes
Microsoft Corporation (MSFT),2016-01-29,Microsoft's secret weapon for growth in the cloud: email
Microsoft Corporation (MSFT),2016-01-28,Microsoft beats Wall Street view on high demand for cloud products
Microsoft Corporation (MSFT),2016-01-28,Data privacy bill in Congress  trans-Atlantic deal elusive
Microsoft Corporation (MSFT),2016-01-28,Top 5 Things to Know In the Market on Thursday
Microsoft Corporation (MSFT),2016-01-28,Wall Street points to higher open ahead of busy earnings day
Microsoft Corporation (MSFT),2016-01-04,Apple shares off but weather U.S. market selloff
Microsoft Corporation (MSFT),2016-01-04,Microsoft's latest operating system running on 200 million devices
Microsoft Corporation (MSFT),2016-01-04,Nokia to move swiftly after taking control of Alcatel-Lucent
Microsoft Corporation (MSFT),2015-12-31,Microsoft failed to warn victims of Chinese email hack: former employees
Microsoft Corporation (MSFT),2015-12-30,Exclusive: Microsoft to warn email users of suspected hacking by governments
Microsoft Corporation (MSFT),2015-12-29,Samsung ups investment in southern Vietnam project to $2 billion
Microsoft Corporation (MSFT),2015-12-28,Tech giants spot opportunity in forecasting China's smog
Microsoft Corporation (MSFT),2015-12-23,Juniper breach reflects risk of 'back doors': researchers
Microsoft Corporation (MSFT),2015-12-21,Obamacare  tech stocks boost Wall Street
Microsoft Corporation (MSFT),2015-12-16,Europeans to be 'masters' of their personal data: senior official
Microsoft Corporation (MSFT),2016-01-20,Symantec to get $1 billion less cash in sale of Veritas to Carlyle
Microsoft Corporation (MSFT),2016-01-15,Growth funds dumping Apple stock as iPhone sales seen sagging; value-managers moving in
Microsoft Corporation (MSFT),2016-01-15,U.S. Supreme Court agrees to hear Microsoft appeal in Xbox case
Microsoft Corporation (MSFT),2016-01-12,New venture aims to fill customer-service void in healthcare
Microsoft Corporation (MSFT),2016-01-10,Illumina  partners make $100 million bet to detect cancer via blood test
Microsoft Corporation (MSFT),2016-01-08,Former Cardinals exec pleads guilty to hacking into Astros' network
Microsoft Corporation (MSFT),2016-01-08,U.S. to form new task force to fight online militant propaganda
Microsoft Corporation (MSFT),2016-01-07,Mobileye wants automakers to share maps for autonomous cars: chairman
Microsoft Corporation (MSFT),2016-01-06,Samsung Electronics at risk of 2016 profit drop on components headwinds
Microsoft Corporation (MSFT),2016-01-05,China regulator queries Microsoft on findings in anti-trust probe
Microsoft Corporation (MSFT),2015-12-16,Tesla rival NextEV hires former Cisco tech chief Padmasree Warrior
Microsoft Corporation (MSFT),2015-12-16,China calls for Internet front to fight hacking  cyber 'arms race'
Microsoft Corporation (MSFT),2015-12-15,Firms to face stiff fines under new EU data protection law
Microsoft Corporation (MSFT),2015-12-11,Musk  other tech chiefs back artificial intelligence startup with $1 billion
Microsoft Corporation (MSFT),2015-12-09,EU explores whether Google  Yahoo should pay for showing online news snippets
Microsoft Corporation (MSFT),2015-12-04,With an eye on Russia  Estonia seeks security in computing cloud
Microsoft Corporation (MSFT),2015-12-04,Finland's Nokia closes maps unit sale to German car makers
Microsoft Corporation (MSFT),2015-12-03,Weather delays Orbital's return to International Space Station
Microsoft Corporation (MSFT),2015-12-02,Facebook's Zuckerberg takes philanthropy into profit  politics 
Microsoft Corporation (MSFT),2015-12-01,Facebook's CEO and wife to give 99 percent of shares to couple's foundation
Microsoft Corporation (MSFT),2015-11-10,Microsoft launches cloud-based blockchain platform with Brooklyn start-up
Microsoft Corporation (MSFT),2015-11-09,Finnish company launches pocket PC
Microsoft Corporation (MSFT),2015-11-08,Activist stampede pushes board directors into shareholders' arms
Microsoft Corporation (MSFT),2015-11-06,NSA says how often  not when  it discloses software flaws 
Microsoft Corporation (MSFT),2015-11-06,EU aims to seal data transfer deal with U.S. in three months
Microsoft Corporation (MSFT),2015-11-05,EU seeks to reassure companies about transatlantic data transfers
Microsoft Corporation (MSFT),2015-11-04,UK unveils powers to spy on Web use  raising privacy fears
Microsoft Corporation (MSFT),2015-11-04,Fancy a sauna? Or a headbang? Finland launches national 'emojis'
Microsoft Corporation (MSFT),2015-11-03,Energy  tech push stocks up; Nasdaq 100 sets record
Microsoft Corporation (MSFT),2015-11-03,Activision Blizzard buys 'Candy Crush' maker in mobile push
Microsoft Corporation (MSFT),2015-10-29,U.S. stocks lower at close of trade; Dow Jones Industrial Average down 0.13%
Microsoft Corporation (MSFT),2015-10-26,U.S. stocks mixed as sell-off in energy sector  Apple weigh
Microsoft Corporation (MSFT),2015-10-26,U.S. stocks mixed at close of trade; Dow Jones Industrial Average down 0.14%
Microsoft Corporation (MSFT),2015-10-26,With global outlook weak  many U.S. companies tighten belts
Microsoft Corporation (MSFT),2015-10-25,Apple earnings may propel Nasdaq to record high 
Microsoft Corporation (MSFT),2015-10-24,Nasdaq may see record with Apple earnings 
Microsoft Corporation (MSFT),2015-10-23,Techs lead Wall St. higher; S&P 500 erases 2015 loss 
Microsoft Corporation (MSFT),2015-10-23,U.S. stocks higher at close of trade; Dow Jones Industrial Average up 0.90%
Microsoft Corporation (MSFT),2015-10-23,U.S. stocks reach 2-month high  as China stimulus triggers tech surge 
Microsoft Corporation (MSFT),2015-10-23,Europe's top privacy watchdog calls on firms to curb U.S. data transfers
Microsoft Corporation (MSFT),2015-10-23,Spanish recluse behind Zara briefly becomes world's richest man
Microsoft Corporation (MSFT),2015-10-23,Twitter's Dorsey to give a third of his stock to employee equity pool
Microsoft Corporation (MSFT),2015-10-23,Alphabet  Microsoft  Amazon give Wall Street reason to cheer
Microsoft Corporation (MSFT),2015-10-22,Alphabet  formerly Google  sets share buyback  shares jump
Microsoft Corporation (MSFT),2015-10-22,Cloud services bolster Microsoft results  shares soar
Microsoft Corporation (MSFT),2015-10-22,S&P 500 ends at highest in two months; Alphabet up after hours
Microsoft Corporation (MSFT),2015-10-22,U.S. stocks surge to 9-week high amid strong earnings  Draghi comments
Microsoft Corporation (MSFT),2015-10-22,NFL keen to see who watches Yahoo game webcast and how
Microsoft Corporation (MSFT),2015-10-22,U.S. stock futures higher before opening bell 
Microsoft Corporation (MSFT),2015-10-22,Top 5 Things to Know This Morning
Microsoft Corporation (MSFT),2015-10-22,Wall Street points to higher open ahead of data  earnings
Microsoft Corporation (MSFT),2015-10-21,Apple to build more solar projects in China  green its suppliers
Microsoft Corporation (MSFT),2015-10-21,Indonesia to woo American investment in e-commerce sector
Microsoft Corporation (MSFT),2015-10-20,Yahoo signs ad pact with Google; earnings and revenue miss
Microsoft Corporation (MSFT),2015-10-19,Microsoft nominates two women to its Board of Directors
Microsoft Corporation (MSFT),2015-10-19,IBM revenue falls more than expected  cuts profit forecast
Microsoft Corporation (MSFT),2015-10-19,Google offering free Apps for Work to some customers
Microsoft Corporation (MSFT),2015-10-16,Wall St. closes up  registers third week of gains
Microsoft Corporation (MSFT),2015-10-16,Steve Ballmer takes 4 percent stake in Twitter  owns more than CEO  
Microsoft Corporation (MSFT),2015-10-16,IBM allows Chinese Government to review source code: WSJ
Microsoft Corporation (MSFT),2016-02-23,U.S. stocks lower at close of trade; Dow Jones Industrial Average down 1.14%
Microsoft Corporation (MSFT),2016-02-23,U.S. government  Apple take encryption case to court of public opinion
Microsoft Corporation (MSFT),2016-02-18,Branson's Virgin Galactic moves to return to space race 
Microsoft Corporation (MSFT),2016-02-10,Google to scrub web search results more widely to soothe EU objections
Microsoft Corporation (MSFT),2016-02-08,Cisco's quarterly report to offer gauge of technology demand
Microsoft Corporation (MSFT),2016-02-08,Tech stocks extend losses  valuations dented
Microsoft Corporation (MSFT),2016-02-05,Business services firms' shares bleed as LinkedIn  Tableau crash
Microsoft Corporation (MSFT),2016-02-05,Showdown in Europe over privacy has U.S. firms ducking for cover
Microsoft Corporation (MSFT),2016-02-05,Microsoft recalls 2.3 million power cords sold with Surface Pro tablets
Microsoft Corporation (MSFT),2016-02-05,IBM tries to bolster cloud growth with developer tools
Microsoft Corporation (MSFT),2015-10-15,Indonesian president to court tech giants on U.S. trip
Microsoft Corporation (MSFT),2015-10-13,License sales help SAP operating profit to beat forecasts 
Microsoft Corporation (MSFT),2015-10-13,Russia's Yandex teams up with Microsoft for Windows 10
Microsoft Corporation (MSFT),2015-10-10,Obama backs away from law to access encrypted information 
Microsoft Corporation (MSFT),2015-10-09,Dell looks to EMC deal to boost corporate presence
Microsoft Corporation (MSFT),2015-10-08,Amazon launches platform to build apps for 'Internet of Things'
Microsoft Corporation (MSFT),2015-10-08,Sony cuts U.S. prices for PlayStation 4 ahead of holiday season
Microsoft Corporation (MSFT),2015-10-07,Smaller U.S. businesses fear freeze from EU privacy ruling
Microsoft Corporation (MSFT),2015-10-07,Amazon rolls out new services for cloud
Microsoft Corporation (MSFT),2015-10-07,Max Schrems: the law student who took on Facebook
Microsoft Corporation (MSFT),2015-10-06,Europe-U.S. data transfer deal used by many firms ruled invalid
Microsoft Corporation (MSFT),2015-10-06,Big U.S. firms hold $2.1 trillion overseas to avoid taxes: study
Microsoft Corporation (MSFT),2015-10-06,Microsoft unveils first laptop  updated devices using Windows 10
Microsoft Corporation (MSFT),2015-10-05,Nelson Peltz's Trian takes $2.5 billion stake in General Electric
Microsoft Corporation (MSFT),2015-10-05,In India  meat and murder threaten Modi's inclusive agenda
Microsoft Corporation (MSFT),2015-09-30,Microsoft  Google stand down in patent battles 
Microsoft Corporation (MSFT),2015-09-29,Russian sentenced to four-and-a-half years in U.S. prison for 'Citadel' malware
Microsoft Corporation (MSFT),2015-09-29,Google unveils latest Nexus phones and its first Android tablet
Microsoft Corporation (MSFT),2015-09-29,China hands Microsoft administrative fine over Xbox venture
Microsoft Corporation (MSFT),2015-09-28,Microsoft reorganizes its financial results reporting
Microsoft Corporation (MSFT),2015-11-19,Nokia remains bullish about Africa business despite economic slowdown
Microsoft Corporation (MSFT),2015-11-18,Activision's new 'Call of Duty' game rakes in $550 million in three days
Microsoft Corporation (MSFT),2015-11-18,Shunning protocol  Obama interviews Alibaba billionaire Ma 
Microsoft Corporation (MSFT),2015-11-13,Hired-gun hacking played key role in JPMorgan  Fidelity breaches
Microsoft Corporation (MSFT),2015-11-13,Russia's Yandex says complained to EU over Google's Android
Microsoft Corporation (MSFT),2015-11-12,Germany  U.S. in hot pursuit of 'messenger' drug molecules
Microsoft Corporation (MSFT),2015-11-11,Facebook reports spike in government requests for data
Microsoft Corporation (MSFT),2015-11-11,Microsoft to offer cloud services from Germany
Microsoft Corporation (MSFT),2015-11-10,Google defeats most claims in browser tracking lawsuit
Microsoft Corporation (MSFT),2015-11-10,U.S. stocks mixed at close of trade; Dow Jones Industrial Average up 0.16%
Microsoft Corporation (MSFT),2015-09-16,Apple faces hurdles as it positions iPad Pro for business use
Microsoft Corporation (MSFT),2015-09-15,Microsoft declares 16% quarterly dividend increase
Microsoft Corporation (MSFT),2015-09-15,U.S. stocks rally 1%  as Dow emerges from correction territory
Microsoft Corporation (MSFT),2015-09-15,Wall St. rallies as clock ticks toward Fed decision 
Microsoft Corporation (MSFT),2015-09-15,U.S. stocks higher at close of trade; Dow Jones Industrial Average up 1.40%
Microsoft Corporation (MSFT),2015-09-15,Amazon's Jeff Bezos ups his stake in billionaires' space race
Microsoft Corporation (MSFT),2015-09-15,U.S. does not plan cyber sanctions before Xi visit
Microsoft Corporation (MSFT),2015-09-14,Microsoft sets October 6 event for Windows 10 devices
Microsoft Corporation (MSFT),2015-09-11,Microsoft names general counsel Brad Smith as chief legal officer
Microsoft Corporation (MSFT),2015-09-10,China says Apple unit underpaid $71 million in tax in 2013
Microsoft Corporation (MSFT),2015-09-27,India's Modi emotional at Facebook as recalls childhood
Microsoft Corporation (MSFT),2015-09-25,Obama announces 'understanding' with China's Xi on cyber theft but remains wary
Microsoft Corporation (MSFT),2015-09-25,Google faces renewed U.S. antitrust scrutiny  this time over Android
Microsoft Corporation (MSFT),2015-09-25,Bill Gates foundation trust sues Brazil's Petrobras
Microsoft Corporation (MSFT),2015-09-25,U.S. companies quicker to give board seats to activists
Microsoft Corporation (MSFT),2015-09-24,EU launches inquiry into web companies' online behavior
Microsoft Corporation (MSFT),2015-09-23,China's Xi promises better investment climate  cyber war deal seen
Microsoft Corporation (MSFT),2015-09-23,Apple hack exposes flaws in building apps in China
Microsoft Corporation (MSFT),2015-09-22,Microsoft begins worldwide release of Office 2016
Microsoft Corporation (MSFT),2015-09-21,EU-U.S. data-sharing deal faces major challenge in EU court
Microsoft Corporation (MSFT),2015-09-02,Wall Street surges as turbulence becomes the norm 
Microsoft Corporation (MSFT),2015-09-01,Yahoo CEO Marissa Mayer expecting twin girls in December
Microsoft Corporation (MSFT),2015-08-28,Exclusive: Russia's Kaspersky threatened to 'rub out' rival  email shows
Microsoft Corporation (MSFT),2015-08-28,U.S. International Trade Commission clears Microsoft of patent infringement
Microsoft Corporation (MSFT),2015-08-27,GameStop says new game launches to drive strong second-half growth
Microsoft Corporation (MSFT),2015-08-27,Google rejects 'unfounded' EU antitrust charges of market abuse
Microsoft Corporation (MSFT),2015-08-27,Chinese Billionaire Calls Rapid Economic Growth A 'Fantasy'
Microsoft Corporation (MSFT),2015-08-27,Panasonic to shut battery factory in Beijing  cut 1 300 jobs
Microsoft Corporation (MSFT),2015-08-26,Facebook testing personal digital assistant inside Messenger
Microsoft Corporation (MSFT),2015-08-26,Velostrata introduces public/private cloud software; takes funds
Microsoft Corporation (MSFT),2015-08-25,U.S. stocks lower at close of trade; Dow Jones Industrial Average down 1.29%
Microsoft Corporation (MSFT),2015-08-21,U.S. stocks lower at close of trade; Dow Jones Industrial Average down 3.13%
Microsoft Corporation (MSFT),2015-08-21,Microsoft confirms Finnish phone site closure and job cuts
Microsoft Corporation (MSFT),2015-08-20,Microsoft files antitrust suit against InterDigital in patent feud
Microsoft Corporation (MSFT),2015-08-20,Salesforce raises full-year revenue forecast again
Microsoft Corporation (MSFT),2015-08-19,China summons Western tech firms  revives bank cyber rules
Microsoft Corporation (MSFT),2015-08-18,U.S. stocks lower at close of trade; Dow Jones Industrial Average down 0.19%
Microsoft Corporation (MSFT),2015-08-14,Exclusive: Russian antivirus firm faked malware to harm rivals - Ex-employees 
Microsoft Corporation (MSFT),2015-08-12,Hackers stole secrets for up to $100 million insider-trading profit: U.S.
Microsoft Corporation (MSFT),2015-08-11,Symantec to sell Veritas for $8 billion to focus on security software
Microsoft Corporation (MSFT),2015-12-01,US Companies Join Strong Climate Pact
Microsoft Corporation (MSFT),2015-11-30,Bill Gates Launches Clean Energy Fund
Microsoft Corporation (MSFT),2015-11-30,Goldman backs low-emissions stocks as climate talks start
Microsoft Corporation (MSFT),2015-11-29,Holiday shopping unlikely to cheer many investors
Microsoft Corporation (MSFT),2015-11-27,Microsoft's Gates to start multi-billion-dollar clean tech initiative
Microsoft Corporation (MSFT),2015-11-25,Exclusive: Three Goldman bankers leave for Uber as tech world raids Wall Street talent
Microsoft Corporation (MSFT),2015-11-24,Sassy woman or machine? Tech giants divided over digital assistants
Microsoft Corporation (MSFT),2015-11-20,Apple wins patent trial against Pendrell subsidiary
Microsoft Corporation (MSFT),2015-11-19,Google names VMware co-founder Diane Greene to lead cloud push
Microsoft Corporation (MSFT),2015-11-19,Tech group rejects post-Paris call for data encryption 'backdoors'
Microsoft Corporation (MSFT),2015-09-10,U.S. candidates slam Common Core  but education standards take root
Microsoft Corporation (MSFT),2015-09-09,Microsoft urges U.S. court to block warrant for emails held abroad
Microsoft Corporation (MSFT),2015-09-08,'We Really Can't Afford To Take The Time Off'
Microsoft Corporation (MSFT),2015-09-08,Microsoft  Amazon video to join Disney's cloud movie service
Microsoft Corporation (MSFT),2015-09-07,Michael Dell sees consolidation among PC makers in next few years
Microsoft Corporation (MSFT),2015-09-07,Exclusive: Apple ups hiring  but faces obstacles to making phones smarter 
Microsoft Corporation (MSFT),2015-09-06,Apple to launch Apple TV with gaming focus: NY Times
Microsoft Corporation (MSFT),2015-09-04,Wall Street caps off tough week with a steep loss
Microsoft Corporation (MSFT),2015-09-03,With abundant energy  Iceland woos power-hungry data centers
Microsoft Corporation (MSFT),2015-09-02,U.S. stocks higher at close of trade; Dow Jones Industrial Average up 1.82%
Microsoft Corporation (MSFT),2015-07-31,Google refuses French order to apply 'right to be forgotten' globally
Microsoft Corporation (MSFT),2015-07-30,U.S. stocks flat  as 2Q GDP data fails to offset disappointing earnings
Microsoft Corporation (MSFT),2015-07-30,U.S. stocks mixed at close of trade; Dow Jones Industrial Average down 0.03%
Microsoft Corporation (MSFT),2015-07-30,Google refuses French request to apply 'right to be forgotten' globally
Microsoft Corporation (MSFT),2015-07-29,A fresh Start: Microsoft's Windows 10 wins plaudits
Microsoft Corporation (MSFT),2015-07-29,U.S. stocks extend rally in spite of few hints from Fed on rate hike
Microsoft Corporation (MSFT),2015-07-29,U.S. stocks higher at close of trade; Dow Jones Industrial Average up 0.69%
Microsoft Corporation (MSFT),2015-07-29,Alibaba cloud unit sets sights on Amazon in $1 billion global push
Microsoft Corporation (MSFT),2015-07-28,U.S. stocks higher at close of trade; Dow Jones Industrial Average up 1.09%
Microsoft Corporation (MSFT),2015-07-27,U.S. private sector vows to ante up on climate finance
Microsoft Corporation (MSFT),2015-08-10,Longer time off for U.S. parents welcome  but bosses must lead the way
Microsoft Corporation (MSFT),2015-08-10,Adobe joins tech industry push in increasing maternity  parental leave
Microsoft Corporation (MSFT),2015-08-10,Back to the future: Nokia prepares for mobile comeback
