company,date,text
Microsoft Corporation (MSFT),2019-03-16,Battle of Dividends: Apple vs. Microsoft
Microsoft Corporation (MSFT),2019-03-16,In picking Microsoft's cloud  Volkswagen shows that even carmakers have some fear of Amazon
Microsoft Corporation (MSFT),2019-03-15,Apple infringed three Qualcomm patents  jury finds
Microsoft Corporation (MSFT),2019-03-15,Stocks - Dow Snaps Losing Streak as China Touts Progress on Trade
Microsoft Corporation (MSFT),2019-03-15,Special Report: Beto O'Rourke's secret membership in a legendary hacking group
Microsoft Corporation (MSFT),2019-03-15,Exclusive: Beto O'Rourke belonged to major hacker group as a teenager
Microsoft Corporation (MSFT),2019-03-15,Boeing joins Microsoft and Intel among top Dow gainers
Microsoft Corporation (MSFT),2019-03-15,Microsoft says facial recognition firm that Beijing uses to track Muslims lies about a 'partnership'
Microsoft Corporation (MSFT),2019-03-15,Huawei built software for smartphones and laptops in case it can't use Microsoft or Google products
Microsoft Corporation (MSFT),2019-03-14,Microsoft Is Bringing Xbox Live to iOS and Android. Could PS4 and Nintendo Be Next?
Microsoft Corporation (MSFT),2019-03-13,Microsoft brings PC games to Xbox
Microsoft Corporation (MSFT),2019-03-13,This Day In Market History: The Microsoft IPO
Microsoft Corporation (MSFT),2019-03-12,Microsoft's stock rallies as 'golden cross' forms about 5 weeks after a 'death cross'
Microsoft Corporation (MSFT),2019-03-12,Foxconn rejects Microsoft patent lawsuit  says never had to pay royalties
Microsoft Corporation (MSFT),2019-03-12,Software firm Cloudflare raises $150 million
Microsoft Corporation (MSFT),2019-03-12,Microsoft declares $0.46 dividend
Microsoft Corporation (MSFT),2019-03-11,Report: WPP adding Microsoft UK exec Rose to board
Microsoft Corporation (MSFT),2019-03-11,Microsoft sues Foxconn unit  claiming unpaid royalties
Microsoft Corporation (MSFT),2019-03-11,Google Cloud hires another Oracle veteran for top role
Microsoft Corporation (MSFT),2019-03-11,Boeing's big drop is shaving more than 300 points off the Dow
Microsoft Corporation (MSFT),2019-03-14,Tech makes a comeback as Wall Street's trendy trade
Microsoft Corporation (MSFT),2019-03-14,Microsoft  Facebook collab on co-packaged optics
Microsoft Corporation (MSFT),2019-03-14,Microsoft open sources its data compression algorithm and hardware for the cloud
Microsoft Corporation (MSFT),2019-03-14,Microsoft rolls out its Game Stack
Microsoft Corporation (MSFT),2019-03-14,Microsoft targets video game developers  in challenge to Amazon's cloud dominance
Microsoft Corporation (MSFT),2019-03-14,Top Analyst Upgrades and Downgrades: Apple  Atlassian  Hilton  Microsoft  MongoDB  Salesforce.com  Snap  Visa and More
Microsoft Corporation (MSFT),2019-03-14,Microsoft's HoloLens 2 headset is smarter and more comfortable than its predecessor
Microsoft Corporation (MSFT),2019-03-14,Mizuho says Buy Microsoft on cloud assets
Microsoft Corporation (MSFT),2019-03-14,U.S. prosecutors probing Facebook's data deals: New York Times
Microsoft Corporation (MSFT),2019-03-13,Why Microsoft Should Buy Valve Software
Microsoft Corporation (MSFT),2019-03-02,How to use Microsoft's tool that lets you take a picture of a spreadsheet and import it into Excel
Microsoft Corporation (MSFT),2019-03-01,Gadget Lab Podcast: A Deep Dive into Microsoft’s HoloLens 2
Microsoft Corporation (MSFT),2019-03-01,Washington Governor Inslee's White House bid to focus on climate change
Microsoft Corporation (MSFT),2019-03-01,Microsoft Built a Chat Bot to Match Patients to Clinical Trials
Microsoft Corporation (MSFT),2019-02-28,Microsoft launches cloud security product
Microsoft Corporation (MSFT),2019-02-28,Microsoft unveils AI-based Azure Sentinel ahead of RSA
Microsoft Corporation (MSFT),2019-02-28,First Facebook investigation to be completed by summer: regulator
Microsoft Corporation (MSFT),2019-02-27,Could Microsoft Become a $1 Trillion Company This Year?
Microsoft Corporation (MSFT),2019-02-27,Microsoft’s Azure Platform to Expand its Use with Telefonica Partnership
Microsoft Corporation (MSFT),2019-02-27,Volkswagen  Microsoft deepen cloud ties
Microsoft Corporation (MSFT),2019-03-06,Microsoft signs solar agreement with Invenergy
Microsoft Corporation (MSFT),2019-03-06,Microsoft's South African data centers go online
Microsoft Corporation (MSFT),2019-03-06,Why Bezos and Microsoft are betting on this $10 trillion energy fix for the planet
Microsoft Corporation (MSFT),2019-03-06,Microsoft Has a Bold Plan to Reach More Gamers
Microsoft Corporation (MSFT),2019-03-06,Stocks - U.S. Futures Slip on Trade Deal Wait  European Bank Woes
Microsoft Corporation (MSFT),2019-03-06,Microsoft’s Azure Cloud Data Centers Expands to South Africa
Microsoft Corporation (MSFT),2019-03-06,Exclusive: Grab eyes more funding after record $4.5 billion round in Southeast Asia
Microsoft Corporation (MSFT),2019-03-05,Keeping up with Kylie: Jenner is world's youngest billionaire
Microsoft Corporation (MSFT),2019-03-05,Better Buy: Microsoft vs. HP Inc.
Microsoft Corporation (MSFT),2019-03-05,Microsoft launching disc-less Xbox next month?
Microsoft Corporation (MSFT),2019-02-27,Volkswagen deepens cloud computing partnership with Microsoft
Microsoft Corporation (MSFT),2019-02-27,Norway wealth fund shrugs off Brexit  plans rise in UK investments
Microsoft Corporation (MSFT),2019-02-27,Ubben's socially conscious ValueAct Spring Fund bets on workplace wonk
Microsoft Corporation (MSFT),2019-02-26,U.S. stocks lower at close of trade; Dow Jones Industrial Average down 0.13%
Microsoft Corporation (MSFT),2019-02-26,Crypto Fans Need to Monitor Four Key Developments
Microsoft Corporation (MSFT),2019-02-26,Microsoft  VMware working on cloud partnership - report
Microsoft Corporation (MSFT),2019-02-26,Microsoft's HoloLens Creeps Into Apple and Google's Ecosystems
Microsoft Corporation (MSFT),2019-02-25,Microsoft CEO Defends Army Contract for Augmented Reality
Microsoft Corporation (MSFT),2019-02-25,Why Microsoft’s HoloLens 2 Glasses Aren’t Coming to the Masses–Yet
Microsoft Corporation (MSFT),2019-02-25,Microsoft is pitching its most futuristic technology to businesses instead of consumers
Microsoft Corporation (MSFT),2019-02-25,Why Microsoft Is Likely to Be Worth Over $1 Trillion
Microsoft Corporation (MSFT),2019-02-25,Wedbush sees $1T valuation for Microsoft
Microsoft Corporation (MSFT),2019-02-25,Top Analyst Upgrades and Downgrades: Allscripts  AmeriGas  CVS  IMAX  Kraft Heinz  Marathon Oil  Microsoft  Pfizer and Many More
Microsoft Corporation (MSFT),2019-02-25,Microsoft stock gains after Wedbush calls it a 'best idea'
Microsoft Corporation (MSFT),2019-02-24,Microsoft's Hype Strategy for HoloLens Is to Avoid It
Microsoft Corporation (MSFT),2019-02-24,Microsoft Unveils New HoloLens 2 Augmented Reality Headset— and Makes a Big Promise to Users
Microsoft Corporation (MSFT),2019-02-24,Microsoft and the creator of 'Fortnite' have formed an alliance that could put a ton of pressure on Apple and Google (MSFT)
Microsoft Corporation (MSFT),2019-02-24,Microsoft hails revamped goggles as more immersive and easy to wear
Microsoft Corporation (MSFT),2019-02-24,Microsoft unveils a $399 A.I. camera for developers
Microsoft Corporation (MSFT),2019-02-24,Microsoft unveils its HoloLens 2 mixed-reality headset  in a bet on workplace hologram tech
Microsoft Corporation (MSFT),2019-02-19,Can IBM Shares Continue Their Roll?
Microsoft Corporation (MSFT),2019-02-19,Microsoft Finds and Boots Eight Cryptojacking Apps on Microsoft Store
Microsoft Corporation (MSFT),2019-02-19,Google to buy data migration company Alooma in cloud push
Microsoft Corporation (MSFT),2019-02-19,Google acquired a small cloud start-up as it looks to catch up to Amazon and Microsoft
Microsoft Corporation (MSFT),2019-02-19,Cisco vs. Microsoft: Which Stock Is the Better Buy?
Microsoft Corporation (MSFT),2019-02-18,Microsoft's Surface Studio 2 Hits the Deck to Help You Work
Microsoft Corporation (MSFT),2019-02-16,Better Buy: Microsoft vs. Alphabet
Microsoft Corporation (MSFT),2019-02-15,8 Illicit Crypto-Mining Windows Apps Removed From Microsoft Store
Microsoft Corporation (MSFT),2019-02-14,How consumers rank Facebook  Twitter  Snapchat  Instagram  LinkedIn  and YouTube on privacy  fake news  content relevance  safety  and sharing (FB  GOOGL  TWTTR  MSFT  SNAP)
Microsoft Corporation (MSFT),2019-02-14,Zendesk just hired three former Microsoft  Salesforce and Adobe execs
Microsoft Corporation (MSFT),2019-02-24,Microsoft announces an Azure-powered Kinect camera for enterprise
Microsoft Corporation (MSFT),2019-02-24,Say hello to Microsoft’s new $3 500 HoloLens with twice the field of view
Microsoft Corporation (MSFT),2019-02-24,Microsoft’s HoloLens 2 Puts a Full-Fledged Computer on Your Face
Microsoft Corporation (MSFT),2019-02-23,Microsoft vs. IBM: What's the Better Stock Buy?
Microsoft Corporation (MSFT),2019-02-23,Microsoft workers demand it drop $480 million U.S. Army contract
Microsoft Corporation (MSFT),2019-02-22,Microsoft workers protest $480m HoloLens military deal: 'We did not sign up to develop weapons'
Microsoft Corporation (MSFT),2019-02-22,A group of Microsoft employees are demanding the company ditch a US Army contract that they say makes them 'war profiteers' (MSFT)
Microsoft Corporation (MSFT),2019-02-22,Exxon To Use Microsoft Tech To Boost Permian Oil Output  Profitability
Microsoft Corporation (MSFT),2019-02-22,Trump administration denying  delaying more foreign skilled-worker requests
Microsoft Corporation (MSFT),2019-02-22,Microsoft's stock rallies 1.1% toward highest close since Dec. 3
Microsoft Corporation (MSFT),2019-02-22,Why Alphabet and Microsoft Are Better-Positioned Than You Think
Microsoft Corporation (MSFT),2019-02-22,Exxon taps Microsoft for cloud services
Microsoft Corporation (MSFT),2019-02-22,Exxon  Microsoft strike cloud computing agreement for U.S. shale
Microsoft Corporation (MSFT),2019-02-22,Buyout firms abandon debt-laden ways for pricey deals
Microsoft Corporation (MSFT),2019-02-21,Dropbox expects drop in first-quarter operating margin  shares fall
Microsoft Corporation (MSFT),2019-02-21,U.S. stocks lower at close of trade; Dow Jones Industrial Average down 0.40%
Microsoft Corporation (MSFT),2019-02-21,Microsoft bringing Dynamics 365 mixed reality solutions to smartphones
Microsoft Corporation (MSFT),2019-02-21,Microsoft Wants Rules for Facial Recognition—Just Not These
Microsoft Corporation (MSFT),2019-02-21,Stocks - U.S. Futures Rise on Reports of Progress on China Trade Deal
Microsoft Corporation (MSFT),2019-02-21,Blown away by innovation or price? Samsung's foldable phone opens new frontier
Microsoft Corporation (MSFT),2019-02-21,Google's new cloud boss has big task to catch rivals  Reuters data show
Microsoft Corporation (MSFT),2019-02-20,Microsoft discovers hack targeting European democratic institutions
Microsoft Corporation (MSFT),2019-02-20,Microsoft says discovers hacking targeting democratic institutions in Europe
Microsoft Corporation (MSFT),2019-02-20,Russia-Linked Hackers Responsible for Vast European Cyber Attacks  Says Microsoft
Microsoft Corporation (MSFT),2019-02-20,Microsoft says hackers tried to breach European think tanks and non-profit organizations
Microsoft Corporation (MSFT),2019-02-20,Russian Hackers Targeted European Research Groups  Microsoft Says
Microsoft Corporation (MSFT),2019-02-19,There's a new snag for Amazon in the winner-take-all $10 billion Pentagon cloud contract  and it could be good news for Microsoft (AMZN  MSFT)
Microsoft Corporation (MSFT),2019-02-19,Here's How Microsoft Makes Its Money
Microsoft Corporation (MSFT),2019-02-19,51 Firms Going Ex-Dividend Next Week  Including Target  Hershey And Microsoft 
Microsoft Corporation (MSFT),2019-02-19,Microsoft is taking a slow and steady approach toward integrating GitHub  job listings suggest
Microsoft Corporation (MSFT),2019-02-14,Google  Amazon among those targeted in EU unfair practices digital rules
Microsoft Corporation (MSFT),2019-02-14,That Time Microsoft President Brad Smith Met the Pope
Microsoft Corporation (MSFT),2019-02-14,Huawei to build data centers in South Africa
Microsoft Corporation (MSFT),2019-02-13,Software pirates use Apple tech to put hacked apps on iPhones
Microsoft Corporation (MSFT),2019-02-13,Newer businesses drive Cisco's earnings beat; shares rise
Microsoft Corporation (MSFT),2019-02-13,MarketPulse: Lattice Semiconductor Surges on Earnings  Lifting Chip Stocks
Microsoft Corporation (MSFT),2019-02-13,Pope discusses ethics of artificial intelligence with Microsoft chief
Microsoft Corporation (MSFT),2019-02-12,Chipotle's Spectacular Recovery Discovers Resistance
Microsoft Corporation (MSFT),2019-02-12,Wall Street rallies on trade optimism  hopes of avoiding government shutdown
Microsoft Corporation (MSFT),2019-02-12,The dance of the megacaps: Apple and Microsoft (video)
Microsoft Corporation (MSFT),2019-02-12,IBM says Watson AI services will now work on any cloud
Microsoft Corporation (MSFT),2019-02-12,IBM Makes Watson Available Across Amazon  Microsoft  and Google Clouds
Microsoft Corporation (MSFT),2019-02-12,Analyst: Microsoft Has Potential to Catch up With Amazon’s Cloud
Microsoft Corporation (MSFT),2019-02-12,Better Buy: Microsoft vs. Oracle
Microsoft Corporation (MSFT),2019-02-12,Venture capital firm uses AI to seek out start-ups across Europe
Microsoft Corporation (MSFT),2019-02-11,Trump administration unveils order to prioritize and promote AI
Microsoft Corporation (MSFT),2019-02-11,Can Microsoft Be a Millionaire-Maker Stock?
Microsoft Corporation (MSFT),2019-02-11,Microsoft Teases a Possible HoloLens 2 Announcement at Mobile World Congress
Microsoft Corporation (MSFT),2019-02-11,THE DIGITAL HEALTH ECOSYSTEM: An in-depth examination of the players and tech trends reshaping the future of healthcare (AAPL  IBM  ANTM  GOOGL  MSFT  AMZN  PFE  GE  MCK  TMUS  WMT  WBA  MRK  CVS)
Microsoft Corporation (MSFT),2019-02-11,Microsoft teases HoloLens 2 launch
Microsoft Corporation (MSFT),2019-02-11,What It’s Like to Work Inside Apple’s ‘Black Site’
Microsoft Corporation (MSFT),2019-02-11,Google hires chip engineers in India
Microsoft Corporation (MSFT),2019-02-11,Stocks - Tesla  Apple  Netflix  Restaurant Brands Rise in Premarket
Microsoft Corporation (MSFT),2019-02-11,Google extends chip-making efforts to design hub Bengaluru
Microsoft Corporation (MSFT),2019-02-11,Google and Microsoft Warn That AI May Do Dumb Things
Microsoft Corporation (MSFT),2019-02-11,What It’s Like To Work Inside Apple’s ‘Black Site’
Microsoft Corporation (MSFT),2019-02-08,EU countries agree on copyright reforms  deal in sight next week
Microsoft Corporation (MSFT),2019-02-08,Microsoft: Drag Internet Explorer to the Trash. No  Really
Microsoft Corporation (MSFT),2019-02-08,Third Point drops stakes in Alibaba  Microsoft and Netflix in fourth quarter
Microsoft Corporation (MSFT),2019-02-08,Third Point dissolves its stakes in Netflix  Microsoft and Alibaba
Microsoft Corporation (MSFT),2019-03-11,Stocks - Dow Futures Slump After Deadly Boeing Crash in Ethiopia
Microsoft Corporation (MSFT),2019-03-09,Microsoft files suit against Foxconn parent Hon Hai for missing patent-licensing payments
Microsoft Corporation (MSFT),2019-03-09,For a sense of what Elizabeth Warren's antitrust crusade would do to tech  look back at Microsoft
Microsoft Corporation (MSFT),2019-03-08,Wall Street critic Warren vows to break up Amazon  Facebook  Google
Microsoft Corporation (MSFT),2019-03-08,   Stocks - U.S. Futures Fall as Trade Summit Delayed
Microsoft Corporation (MSFT),2019-03-07,Wall Street slips for fourth day after dovish ECB stance
Microsoft Corporation (MSFT),2019-03-07,Microsoft's Windows 10 on 800M devices
Microsoft Corporation (MSFT),2019-03-07,Microsoft is getting close to its goal of 1 billion Windows 10 devices
Microsoft Corporation (MSFT),2019-03-06,Microsoft Is Reportedly Planning to Launch a Disc-Less Xbox One S
Microsoft Corporation (MSFT),2019-03-06,The Wall Street Journal: Iranian hackers have attacked more than 200 companies in past 2 years  Microsoft finds 
Microsoft Corporation (MSFT),2019-02-01,U.S. stocks mixed at close of trade; Dow Jones Industrial Average up 0.26%
Microsoft Corporation (MSFT),2019-02-01,NewsGuard's 'real news' seal of approval helps spark change in fake news era
Microsoft Corporation (MSFT),2019-02-01,Microsoft Versus Amazon: What Acquisitions Could Move The Needle? 
Microsoft Corporation (MSFT),2019-02-01,Stocks - Wall Street Mixed With Jobs Data Strong 
Microsoft Corporation (MSFT),2019-02-01,3 Big Stock Charts for Friday: PulteGroup  Microsoft and Hologic
Microsoft Corporation (MSFT),2019-02-01,Dirty money risks encroach on Estonia's digital utopia
Microsoft Corporation (MSFT),2019-01-31,Women's empowerment  social causes take the field in NFL Super Bowl ads
Microsoft Corporation (MSFT),2019-01-31,Stocks - Dow Ends Flat  but Logs Big Monthly Gain
Microsoft Corporation (MSFT),2019-01-31,Amazon Beats; Guidance  Prime Growth Raise Concerns 
Microsoft Corporation (MSFT),2019-01-31,Intel makes interim CEO Swan permanent  bucking history of insiders
Microsoft Corporation (MSFT),2019-02-05,Indian opposition parties plan common economic blueprint to unseat Modi
Microsoft Corporation (MSFT),2019-02-04,Microsoft May Soon Expand Xbox Live to Nintendo Switch  iOS  Android  Report Says
Microsoft Corporation (MSFT),2019-02-04,U.S. stocks higher at close of trade; Dow Jones Industrial Average up 0.70%
Microsoft Corporation (MSFT),2019-02-04,Stock market ends near session high  buoyed by rally in Microsoft and Apple stocks
Microsoft Corporation (MSFT),2019-02-04,Apple briefly regains title as most valuable U.S. company
Microsoft Corporation (MSFT),2019-02-04,BTIG: Take-Two could benefit from videogame M&A wave
Microsoft Corporation (MSFT),2019-02-04,Microcaps mostly among tech movers
Microsoft Corporation (MSFT),2019-02-04,Slack makes confidential filing to go public
Microsoft Corporation (MSFT),2019-02-04,After 5 years  Microsoft CEO Satya Nadella has transformed more than the stock price
Microsoft Corporation (MSFT),2019-02-04,Microsoft Buys Startup BrightBytes’s DataSense Service
Microsoft Corporation (MSFT),2019-02-06,U.S. stocks lower at close of trade; Dow Jones Industrial Average down 0.08%
Microsoft Corporation (MSFT),2019-02-06,Apple Stock vs. Microsoft Stock: Investors Are Asking the Wrong Question
Microsoft Corporation (MSFT),2019-02-06,Apple Stock vs. Microsoft Stock: Investors Are Asking the Wrong Question
Microsoft Corporation (MSFT),2019-02-06,TomTom sees licensing sales growth from Microsoft deal
Microsoft Corporation (MSFT),2019-02-05,Canada: Blockchain Association Merges with Chamber of Digital Commerce
Microsoft Corporation (MSFT),2019-02-05,Biggest Public Company? Microsoft. Wait  Apple Again. Amazon? No  Back to Microsoft.
Microsoft Corporation (MSFT),2019-02-05,Microsoft Study Claims the Internet Is Getting More Civil. The Internet Throws Side Eye Back
Microsoft Corporation (MSFT),2019-02-05,Google no longer considers Microsoft Cortana a competitor
Microsoft Corporation (MSFT),2019-02-05,With Fading Headwinds and Cloud Growth  Microsoft Stock Looks Solid
Microsoft Corporation (MSFT),2019-02-05,Microsoft used to scare start-ups  but has become an 'outstandingly good partner ' says Ben Horowitz
Microsoft Corporation (MSFT),2019-02-08,Third Point dissolves stakes in Netflix  Microsoft and Alibaba
Microsoft Corporation (MSFT),2019-02-07,Amazon Joins Microsoft's Call for Rules on Facial Recognition
Microsoft Corporation (MSFT),2019-02-07,Here’s How Microsoft Plans To Modernize Healthcare
Microsoft Corporation (MSFT),2019-02-07,Amazon calls for transparent use of facial ID tech by law enforcement agencies
Microsoft Corporation (MSFT),2019-02-07,Microsoft Azure sets its sights on more analytics workloads
Microsoft Corporation (MSFT),2019-02-07,Microsoft Ads Attack Office 2019 in Push to Sell More Office 365 Subs
Microsoft Corporation (MSFT),2019-02-07,Facebook  Microsoft  and Apple: Don't Underestimate the Giants
Microsoft Corporation (MSFT),2019-02-06,BIG TECH IN HEALTHCARE:  How Alphabet  Amazon  Apple  and Microsoft are shaking up healthcare — and what it means for the future of the industry (GOOGL  AAPL  AMZN  MSFT)
Microsoft Corporation (MSFT),2019-02-06,BIG TECH IN HEALTHCARE:  How Alphabet  Amazon  Apple  and Microsoft are shaking up healthcare — and what it means for the future of the industry (GOOGL  AAPL  AMZN  MSFT)
Microsoft Corporation (MSFT),2019-02-06,Scoot over Microsoft: Apple again the most valuable U.S. company
Microsoft Corporation (MSFT),2019-01-30,U.S. stocks higher at close of trade; Dow Jones Industrial Average up 1.77%
Microsoft Corporation (MSFT),2019-01-30,Big thumbs-up from Wall Street after Fed signals patience on rates
Microsoft Corporation (MSFT),2019-01-30,U.S. Stocks Rally  Dollar Sinks After Fed Decision
Microsoft Corporation (MSFT),2019-01-30,Microsoft Rises 3%
Microsoft Corporation (MSFT),2019-01-30,Top 5 Things to Know in The Market on Wednesday
Microsoft Corporation (MSFT),2019-01-30,Sony  Nintendo seen scoring strong third-quarter earnings as console battle reaches next level
Microsoft Corporation (MSFT),2019-01-29,Apple Lifts Tech Stocks With Facebook and Amazon Earnings on Deck
Microsoft Corporation (MSFT),2019-01-29,Day Ahead: Top 3 Things to Watch
Microsoft Corporation (MSFT),2019-01-29,Wall Street wavers as tech gives ground and industrials rebound
Microsoft Corporation (MSFT),2019-01-29,U.S. stocks mixed at close of trade; Dow Jones Industrial Average up 0.21%
Microsoft Corporation (MSFT),2019-02-04,Tech boosts S&P  Nasdaq; healthcare weighs on Dow
Microsoft Corporation (MSFT),2019-02-04,Microsoft buys DataSense platform
Microsoft Corporation (MSFT),2019-02-04,Microsoft launching cross-platform Xbox Live SDK
Microsoft Corporation (MSFT),2019-02-04,3 Highlights from Microsoft's Earnings Call
Microsoft Corporation (MSFT),2019-02-04,Satya Nadella made Microsoft relevant again  so why isn't he a billionaire yet?
Microsoft Corporation (MSFT),2019-02-03,Is Microsoft's Biggest Growth Engine Losing Its Mojo?
Microsoft Corporation (MSFT),2019-02-02,Tech Stocks This Week: Apple and Facebook Pop As Microsoft Pulls Back
Microsoft Corporation (MSFT),2019-02-02,Microsoft Earnings Show Its Growth Is on Track
Microsoft Corporation (MSFT),2019-02-01,Microsoft Continues to Win in the Cloud
Microsoft Corporation (MSFT),2019-02-01,Boeing And Microsoft Earnings Reviews
Microsoft Corporation (MSFT),2019-01-31,Stocks - Wall Street Mixed After Earnings  Data
Microsoft Corporation (MSFT),2019-01-31,Stocks - Facebook  GE  UPS Surge in Premarket  Tesla  Microsoft  Visa Slide
Microsoft Corporation (MSFT),2019-01-31,Stocks - U.S. Futures Mixed as Facebook Leads Tech Stocks Higher
Microsoft Corporation (MSFT),2019-01-31,Top 5 Things to Know in The Market on Thursday
Microsoft Corporation (MSFT),2019-01-31,Software AG can spend 1-1.5 billion euros on acquisitions: CEO
Microsoft Corporation (MSFT),2019-01-31,U.S.  China take the lead in race for artificial intelligence: U.N.
Microsoft Corporation (MSFT),2019-01-30,Microsoft's Azure revenue growth slows  shares fall
Microsoft Corporation (MSFT),2019-01-30,Stocks on the Move After Hours: Facebook  Microsoft  Dolby  Twitter
Microsoft Corporation (MSFT),2019-01-30,Day Ahead: Top 3 Things to Watch
Microsoft Corporation (MSFT),2019-01-30,Microsoft Falls as Q2 Revenue Raises Concerns
Microsoft Corporation (MSFT),2019-01-29,Email rival Slack says it has 10 million daily active users
Microsoft Corporation (MSFT),2019-01-29,Tech giants lead Nasdaq lower; industrials show strength
Microsoft Corporation (MSFT),2019-01-29,GameStop abandons efforts to sell company
Microsoft Corporation (MSFT),2019-01-28,Caterpillar and Nvidia warnings send Wall Street tumbling
Microsoft Corporation (MSFT),2019-01-28,Bing outage in China was technical error  not censors' block: source
Microsoft Corporation (MSFT),2019-01-27,Economic Calendar - Top 5 Things to Watch This Week
Microsoft Corporation (MSFT),2019-01-25,Take Five: Time for a break? World markets themes for the week ahead
Microsoft Corporation (MSFT),2019-01-24,Ad exchange OpenX commits to $110 million Google Cloud deal
Microsoft Corporation (MSFT),2019-01-24,Access to Microsoft's Bing restored for some users in China
Microsoft Corporation (MSFT),2019-01-24,Stocks - Texas Instruments  Apple  American Airlines Gain in Premarket
Microsoft Corporation (MSFT),2019-01-24,Top 5 Things to Know in The Market on Thursday
Microsoft Corporation (MSFT),2019-01-24,Microsoft welcomes regulation on facial recognition technology: Nadella
Microsoft Corporation (MSFT),2019-01-24,Microsoft says Bing search engine blocked in China
Microsoft Corporation (MSFT),2019-01-24,Forex - Dollar Pushes Higher But Gains Checked  Aussie Weaker
Microsoft Corporation (MSFT),2019-01-22,Google  Facebook spend big on U.S. lobbying amid policy battles
Microsoft Corporation (MSFT),2019-01-22,Cloud  services fuel IBM's profit beat  robust outlook; shares jump
Microsoft Corporation (MSFT),2019-01-22,S&P 500 Breaks Rising Wedge
Microsoft Corporation (MSFT),2019-01-22,Accessories lead videogame sales to 2% December gain
Microsoft Corporation (MSFT),2019-01-21,In Versailles  Macron vows to reform to avoid king's fate
Microsoft Corporation (MSFT),2019-01-21,'A List' climate change firms outperform on stock market: survey
Microsoft Corporation (MSFT),2019-01-21,In win for tech giants  EU copyright reforms stalled
Microsoft Corporation (MSFT),2019-01-17,In 5G play  Vodafone and IBM link up cloud systems for business
